,titles,category,summary
0,후궁의 까마귀,모험,줄거리 고독한 오비의 알려지지 않은 정체는 과연   후궁 깊숙한 곳에 살고 있고  비의 자리에 있으면서 밤 시중을 들지 않는 특별한 존재 오비   그 모습을 본 사람들은 그게 노파였다고 말하기도 했고  소녀였다고 말하기도 했다    오비의 이름은 수설  그녀는 신비한 술법을 사용해 주살에서 물건 찾기까지 무슨 일이든 맡아준다고 한다   이에 현 황제인 고준이 어떤 의뢰를 위해 수설이 있는 곳에 찾아갔다   두 사람의 운명은 역사도 뒤엎는  비밀 을 파헤치게 되었는데       접기
1,리코리스 리코일,모험,줄거리 평온한 일상  그 이면에는 비밀이 있다  범죄를 미연에 방지하는 비밀 조직                      그곳의 에이전트인 소녀들  리코리스   당연한 일상도  그녀들 덕분이다   역대 최강의 리코리스라고 불리는 엘리트 니시키기 치사토  우수하지만 사연이 있는 리코리스 이노우에 타키나가 근무하는 카페  리코리코 도 지부 중 하나다   이곳에서 받는 주문은 커피와 디저트 주문부터  아이 돌보기  구매 대행  외국인을 위한 일본어 강사 등  리코리스 답지 않은 일 투성이다   자유로운 낙천가이자 평화주의자인 치사토와 쿨하고 효율을 중시하는 타키나   좌충우돌 콤비의 엉망진창인 일상이 시작된다       접기
2,섀도 하우스  nd Season,모험,줄거리 이 저택에는  아직  비밀이 있다    선보이기 를 끝마친 케이트 에밀리코 및 동기  인방은 성인으로서 새로운 생활을 시작했다    섀도 하우스 의 수수께끼를 알아내지 못한 가운데 아이들 동에서는 새로운 사건이 발생   반란 분자라고 별 보유에게 의심을 받게 된 케이트와 에밀리코는 범인이라 여겨지는  로브를 뒤집어쓴 정체불명의 그림자의 정체를 파헤치게 되었다   과연 정체불명의 그림자의 목적은       접기
3, 극장판  영원의    ,모험,줄거리  전례 없는 대재난 으로 전 세계가 몹시 혼란스러운 현대  도쿄에서 신문 장학생으로 생활하고 있는 청년 아사노 스즈시로는  누구에게도 말할 수 없는 비밀을 품고 있었다  고등학교  학년 여름에 일어난 어떤 사건을 계기로  자신의 의지와는 상관없이  주위의 시간을 멈출 수 있게 돼버린 것이다   그러던 어느 날  스즈시로는 처음으로 그 비밀을 공유할 수 있는 상대를 만난다  자신과 마찬가지로 마음에 상처를 입고 시간을 멈출 수 있게 된 소녀 나즈나   그녀가 오빠인 세리에 의해 범죄에 이용되고 있다는 사실을 알게 된 스즈시로는 충동적으로 손을 내민다    너    나하고 같이 도망가자    멈춰버린 시간을 두 사람은 다시 움직일 수 있을 것인가       접기
4,로드 엘멜로이  세의 사건부    레일 체펠린  그레이스 노트 특별편,모험,줄거리 로드 엘멜로이  세에게 도착한 한 통의 편지 그것은  동창회가 열리는 것을 알리는 내용이었다   하지만 개최일이 가까워오던 어느 날 아침  로드 엘멜로이  세는 거울에 비친 자신의 모습에 경악한다  몸이   년 전의 웨이버 벨벳의 모습으로 되돌아가 있었다   고도의 환술에 의한 것이라고 추측한 로드 엘멜로이  세는 자신의 몸에 일어난 이변을 해명하기 위해 조사를 진행한다  그리고 동창회 당일 동기들이 모여 떠들썩한 연회장으로 가 이 변신을 일으킨 인물과 그 목적을 밝힌다  하지만 사태는 아오자키 토우코의 등장으로 생각지 못한 방향으로 나아가게 되는데     접기
5,데지 미츠 걸,모험,줄거리 오키나와에 살고 있는 고등학교  학년 히가 마이세는 가업인 호텔에서 프런트 업무를 보는 아르바이트를 하면서 지루한 여름방학을 보내고 있었다   어느 날  도쿄에서 한 명의 숙박객이 찾아왔다  특별한 사정을 가진 그 남자의 이름은 스즈키 이치로     스즈키가 오고 나서부터 방 안에서 물고기들이 헤엄친다든지  천장을 꿰뚫고 거대한 나무가 자라난다든지 하는 이상한 일들이 호텔에서 벌어지기 시작했는데   둘 사이에서 별안간 벌어지는 불가사의한 일들이란 과연     접기
