,titles,category,summary
0,닌자 잇토키,판타지,줄거리 닌자는 존재하지 않는다고  우리들은 생각하고 있다   가령 닌자가 존재한다고 해도  닌자는 그 모습을 우리 앞에서 드러내는 일은 없다   그렇기에 닌자는  표면적으로는  존재하지 않는 것이다   주인공인 사쿠라바 잇토키는 우리들처럼 닌자가 존재하지 않는다고 생각하는 평범한 남자아이였다   그에게는 평소와 같은 행복하고 반짝거리는 나날이 약속되어있을   터였다   어느 날  잇토키는 목숨을 위협받았고 그것이 코가 닌자들의 소행이라는 사실을 듣게 되었다   잇토키가 목숨을 위협받게 된 이유는    그가 유서 깊은 이가 닌자 제  대 정통 후계자였기 때문이었다   이가와 코가가 오랜 세월 대립해 온 가운데 코가가 이가를 침략하려고 하는 상황   그런 상황 속에서 잇토키가 살기 위해선 스스로 닌자가 되는 수밖에 없었다  그렇게 아무것도 모르는 닌자의 세계에 몸을 던지게 된 잇토키   어엿한 닌자가 되기 위해 배우고  싸우고  고난과 맞선다  하지만 그것은 잇토키가 겪게 될 가혹한 운명의 예고에 불과했는데       접기
1,흑집사  ,판타지,줄거리 흑집사    흑집사 시작되다   시엘 팬텀하이브  자신에게 굴욕을 준 자를 향한 복수를 바라며 고귀한 영혼을 잃지 않았던 그의 곁에는 항상 집사 세바스찬 미카엘리스가 있었다   알로이스 트란시  잔인하고 포악한 행동을 일삼으나 어둠을 무서워하는 약한 심성을 가진 명문 귀족 가문의 젊은 당주에게는 칠흑의 집사 클로드 포스터스가 있었다   싶은 어둠을 품고 있는 주인과 그 주인의 명령을 완벽하게 수행하는 집사   두 쌍의 주종이 해후하는 때  이야기는 도도하게 흐르기 시작한다       접기
2,전생했더니 검이었습니다,판타지,줄거리 전생했더니 검이었습니다    인텔리전스 웨펀 이라고 불리는  검 으로서 이세계에 전생한 그는 장비자와의 만남을 꿈꾸며 고독하게 스킬 수집에 힘쓰고 있었다   어느 날 어리석게도 마력을 흡수하는  고갈의 숲 에 들어가 한 발짝도 움직일 수 없게 된다   망연자실하고 있을 때  노예 신분으로 학대받던 흑묘족 소녀 프란을 만난다   프란은 거대한 마수에게 습격당해 절체절명의 위기에 처해 있었다  그녀는 눈앞에 나타난 그를 뽑고 그 힘으로 궁지를 벗어났고 그에게  스승 이라고 이름 붙이고 정식 장비자가 되었다   모험가가 된 프란과 스승은 서로 스킬을 갈고닦으면서 퀘스트를 수행한다  프란은 강함 끝에 있는  진화 를 이루기 위해  스승은 소녀의  소원 을 이뤄주기 위해   고양이귀 소녀와 팔불출 검의 대모험이 시작된다       접기
3,악역 영애이기 때문에 최종 보스를 길러보았습니다,판타지,줄거리  너와의 약혼을 파기하겠다   아름다운 연회에서 갑자기 전해진 파혼 선언  아이린 로렌 도트리슈는 그 충격에 전생에서의 기억을 되찾고 현재 상황을 파악했다   이곳은 전생에서 자신이 좋아했던 여성향 게임  성과 마와 소녀의 레갈리아  세계 속   자신은 주인공의 연애를 방해하는 악역 영애 아이린이라는 것을  전생에서의 기억에 따르면 아이린에게 남은 건 하찮게 죽는 파멸 루트뿐   파멸 플래그의 출발점이자 최종 보스인 마왕 클로드를 공략해 애인으로 만들 수 있다면  플래그는 회피할 수 있을지도 모른다   그런 생각에 아이린은 아름다운 마왕에게 선언했다    결혼해 주세요    일발 역전  행복을 움켜쥐기 위한 아이린의 여정이 시작된다       접기
4,흑집사,판타지,줄거리   세기 영국   악의 귀족 이라고 불린 소년의 옆에는   반드시 한 사람의  집사 가 있었다     세기 후반  빅토리아 왕조 시대의 영국  명문 귀족 팬텀하이브가의 집사 세바스찬  그는 지식  교양  품위  요리  무술    모든 것에 있어서 완벽했다   제멋대로인   세의 주인 시엘을 상대로 오늘도 칠흑의 연미복 차림으로 화려하게 집무를 수행한다       접기
5,Engage Kiss,판타지,줄거리 태평양에 떠 있는 메가 플로트 도시이자  어느 국가에도 소속되지 않은 베이론 시티   그곳에는    재해 라고 불리는  악마가 일으키는 특수한 사건이 다수 발생하고 있었다   이에 대처하는 건     민간군사기업 에 소속된 사람들로  베이론 시티에 살고 있는 청년 슈도 그중 하나였다   언제나 돈에 쪼들리는 슈를 헌신적으로 도와주는 사람은  베이론 시티에서 학교에 다니고 있는 미소녀 고등학생 키사라   그리고 또 한 명  슈가 과거에 속해있던 대형    의 직원이자 전 애인인 아야노였다   키사라에게 있어서는 이는 달갑지 않았는데   이처럼 그녀의 슈에 대한 강한 집착의 근간은 두 사람이 맺은  계약 에 있었다  그녀의 정체는 악마였던 것이다   키사라는 슈의 생활을 도와주면서 계약에 따라 악마 퇴치에도 협력했고  그 대가로서 받는 건 달콤하면서 위험한  키스 였다   사랑과 계약  두 사람의 위태로운 인연  그 운명은 과연 어디로 향할 것인가       접기
