,titles,category,summary
131, 더빙  다이노코어 에볼루션  ,아동,위기에 빠진 다이노 행성을 구하기 위해 새로운 모험을 떠나는 렉스와 친구들의 이야기   메가 디 파이터 티라노    메가 디 파이터 트리  등 새로운 메카닉이 등장해 더욱 강력해진 악당에 맞서 박진감 넘치는 배틀을 선보인다
132, 더빙  내 친구 호비 part  ,아동,긍정적이며 활발한 성격을 가진 호비  호비는 호기심이 왕성하고 정의감이 넘쳐나 친구들이 힘든 일을 겪을 때면 나서서 도움을 준다  베니  페로  냥이 등의 친구들과 함께 챌린지 섬의 곳곳에서 벌어지는 호비의 신나는 모험 이야기가 펼쳐진다 
133,쾌걸 조로리   ZZ의 비밀,아동,도넛시티에서 선착순으로 나눠주는 무료 도넛을 받기 위해 신기한 캡슐 자명종을 만드는 조로리  그런데 자명종이 울리자 조로리와 이시시 노시시를 태운 캡슐이 갑자기 어디론가 날아가버린다  예상치 못하게 도착한 곳에서 경찰에게 쫓기는 신세가 된 조로리는 아름다운 로리의 도움을 받아 몸을 피하고  그녀의 기숙사 방에서 로리가 자신의 어머니 조로린느라는 증거를 발견하게 되는데   
134, 더빙  이퀘스트리아 걸스   엉망진창 봄방학,아동,봄방학을 맞이한 일곱 친구들은 호화로운 배를 타고 여유로운 크루즈 여행을 떠나게 되었어요  하지만 이퀘스트리아 마법이 나타났다고 굳게 믿고 있는 레인보우 대시는 마법을 찾겠다는 이유로 친구들을 가만 놔 두지 않네요  결국 그로 인해 바다 위에서 재앙이 벌어지고  그 과정에서 포니빌에도 찾아가게 되며  스톰 킹이 보유했던 이퀘스트리아 마법이 인간 세계로 흘러 들어가서 배에 탄 사람들을 위협하고 있다는 사실이 밝혀지게 돼요 
135, 더빙  헬로 카봇 스페셜   동물구조대,아동,수송헬기  컨버터블  제트기 등 다양한 형태의 개성만점 카봇들이 펼치는 동물 구조 이야기  그리고 아이누크와 함께 등장하는 카봇 크루 레스큐팀까지   정의롭고 멋진 카봇들과 함께 위기에 처한 동물 친구들을 구조하라 
136, 더빙  헬로 카봇 스페셜   영웅의 등장,아동,위대한 영웅 이순신 장군과 함께하는 헬로카봇 어린이날 스페셜 애니메이션  도둑들로부터 광화문 광장 이순신 장군상의 칼을 지키기 위한 카봇  아티   아티의 활약은 대한민국 최고의 영웅을 통해 어린이들에게 꿈과 희망을 키우는 최고의 시간을 선사할 것이다  그 외에도 실수로 잃어버린 큐브를 찾기 위해 고군분투하는 차탄 이야기  큐브시계의 등장  유령을 볼 수 있는 늑대 형태의 카봇  트루 와 오줌싸개 유령의 대결 등 새로운 헬로카봇 에피소드들이 시작된다 
137,공룡 대발이   살아있는 공룡,아동,공룡탐험대 루루  대발이  초록이가 함께 공룡세계를 탐험하며 경험하게 되는 재미있는 에피소드를 통해 다양한 공룡들에 대해 배우는 이야기
138,미스테리야 ,아동,악몽에 시달리고 고소공포증에 시달리던 타타는 세계 문화 수호단의 다알 박사  세실  쉑과 함께 자신의 증상을 치료하기 위해 미스테리야로 모험을 떠난다  한편 초시공 마법 악당인 도레미경은 자신의 딸인 플랫마이너 공주와 인조인간 시종 칸타를 타타의 미스테리야로 파견한다  세계를 정복할 목적으로 봉인된 몬스터 이카로스를 봉인에서 해제하는 플랫마이너와 칸타  이들은 곧 큰 대결을 펼치게 되는데  
139,로터리파크,아동,거대한 미스터리 홀 주변을 둘러싼 폐쇄된 공원  그 곳엔 남몰래 지구를 지키는 괴상한 모습의 히어로들이 있다  지구의 숨겨진 비밀과 그것을 노리는 그림자정부     기계를 만든 천재박사 지젤의 진짜 목적까지  가장 강렬한 기억이 만들어 낸 이 시대 유토피아의 문이 열린다 
140, 더빙  스파이즈,아동,고도의 훈련을 받은 스페셜 에이전트 윌리스는 임무 수행 중 실수로 인해 좌천을 당한다  하지만 정체 모를 침입자들의 습격을 받게 된 후  그들의 목적이 지구 생명체의 모든 종을 말살시키려는 것이라는 첩보를 입수한 윌리스는 다시 현장으로 복귀하게 되는데  과연 지구의 모든 종을 말살시키려는 음모를 저지하고 지구를 구할 수 있을까 
141, 더빙  꼬마마법사 레미   견습 마법사를 찾아서,아동,나이도  성격도  살아온 환경도 다른  소라     미레     레이카   하지만  꼬마 마법사 레미 를 어린 시절 추억으로 간직하고 있다는 공통점이 있다  서로 다른 세 사람을 연결해준 마법같은 인연  어른이 되느라 바빴던 그녀들은 잠시 잊고 있었던 것들을 다시금 떠올리게 되는데    지금   레미 의 마법이 다시 시작된다 
142, 더빙  악셀,아동,우주에서 가장 아름다운 행성 케플라  그러나 지구인들의 욕심으로 행성 케플라는 조금씩 오염되어 사라질 위기에 처한다  우주 소년 악셀은 케플라를 구하기 위해 친구 쥬쥬  보노와 함께 긴 모험을 떠나고  전설 속 식물인 카라로의 씨앗만이 행성을 살려낼 수 있는 마지막 희망임을 알게 된다  과연 악셀은 카라로의 씨앗을 찾아내 케플라를 구할 수 있을까 
143, 더빙  포켓몬스터   정글의 아이 코코,아동,인간들의 마을에서 멀리 떨어진 포켓몬들의 낙원 자부숲에서 엄격한 법도를 지키며 무리들과 함께 살아가던  자루도 는 우연히 강가에서 인간의 아이를 발견하게 된다  차마 아이를 외면할 수 없었던  자루도 는 숲의 법도를 깨고 아이에게  코코 라는 이름을 붙여주며 무리에서 떨어져 둘이서만 살기로 결심한다  그로부터   년 뒤  자신을 포켓몬이라고 믿는 소년  코코 는 자부숲을 찾아온  지우 와  피카츄 를 만나 새로운 세계를 알게 되는데  한편  자부숲을 지켜주는 치유의 샘을 노리는 위험한 인간들의 발소리가 들려오기 시작한다  정글의 아이  코코 는 친구들과 힘을 모아 숲을 지킬 수 있을까 
144, 자막  꼬마마법사 레미   견습 마법사를 찾아서,아동,나이도  성격도  살아온 환경도 다른  소라     미레     레이카   하지만  꼬마 마법사 레미 를 어린 시절 추억으로 간직하고 있다는 공통점이 있다  서로 다른 세 사람을 연결해준 마법같은 인연  어른이 되느라 바빴던 그녀들은 잠시 잊고 있었던 것들을 다시금 떠올리게 되는데    지금   레미 의 마법이 다시 시작된다 
145,생일왕국의 프린세스 프링,아동,                             일년 중 가장 특별한 날  생일에 어린이들을 초대해 꿈꿔온 소원을 들어주는 귀여운 토끼 공주  프린세스 프링   사랑스러운 프린세스 프링이 매일매일이 생일인 꿈과 마법의 세계  뮤지컬 어드벤처가 펼쳐지는 생일왕국으로 여러분을 초대합니다 
146,최강전사 미니특공대   새로운 악당의 습격,아동,놀라운 스피드  볼트   최고의 점프  새미   최강 방어  루시  막강 파워  맥스  각각의 특별한 능력을 지닌  미니특공대 는 작은 동물들을 끊임없이 괴롭히는 악당  나인 과  파스칼 에게 맞서 작고 힘없는 동물들을 지키고 있다  어느 날   파스칼 은 모든 것을 복제해 버리는 외계인  조디 를 세뇌해 미니특공대를 공격한다  여기에 향기만 맡아도 울음이 터지는  꽃기계몬 으로 블루벨 마을을 온통 울음바다로 만들어 버리고   파스칼 의 힘으로 더욱 강해진 쌍둥이 펭귄 도둑까지 등장하는데    최강전사 미니특공대  사악한 악당과 기계몬에게서 동물 친구들을 지켜라 
147, 더빙  내 친구 호비 part  ,아동,긍정적이며 활발한 성격을 가진 호비  호비는 호기심이 왕성하고 정의감이 넘쳐나 친구들이 힘든 일을 겪을 때면 나서서 도움을 준다  베니  페로  냥이 등의 친구들과 함께 챌린지 섬의 곳곳에서 벌어지는 호비의 신나는 모험 이야기가 펼쳐진다 
148,하얀물개,아동,상상력이 풍부한 현주리가 어느날 버려진 하얀 물개인형을 주워오면서 벌어지는 신나는 모험과 재미난 놀이 이야기  현주리와 동생 보리는 워킹맘인 엄마를 대신해서 아이들을 돌보아주는 하얀물개와 또다른 인형친구인 곰돌이 로니  코알라 부인 코코 등과 함께 매일매일 신나는 상상놀이를 벌인다  어린이의 눈높이에서 담아낸 어른들과 이웃들의 모습  자연 속에서 찾아낸 놀이감들  상상력으로 펼쳐낸 흥미로운 세계가 수채화로 그린 화면 위로 다양하게 펼쳐진다 
149,토이캅,아동,장난감 세상의 사건 사고를 해결하고 질서를 바로잡는 경찰 히어로  토이캅  대원들의 이야기를 그린 경찰 변신 로봇 애니메이션
