,titles,category,summary
0,전생했더니 슬라임이었던 건에 대하여  기,모험,샐러리맨인 미카미 사토루는 길에서 칼에 찔려 죽었다  하지만 문득 정신이 들어 깨어나보니 이세계로 전생해있었다  그것도 슬라임의 모습으로  리무루라는 이름으로 새롭게 슬라임 인생을 얻어  여러 종족이 함께 사는 세계에 떨어지게 된 그는  종족은 상관없이 모두가 행복하게 살 수 있는 나라 를 만드는 것을 새로운 인생 목표로 삼게 된다 
1,전생했더니 슬라임이었던 건에 대하여  기  부,모험,주인공 리무루와 그를 따르는 다수의 마물들이 세운 나라  쥬라 템페스트 연방국 은 근린 국가들과의 협정과 교역을 통해  인간과 마물이 공존하는 나라 라는 이상을 현실로 만들려 하고 있었다  이는 인간이었던 슬라임에서 기인한 리무루의  인간에 대한 호의  였다  하지만 이 세계에는 명확한  마물에 대한 적의 가 존재하고 있었다  그 불합리한 현실을 마주했을 때  리무루는 선택한다   무엇을 잃고 싶지 않은지 를      
2,방패 용사 성공담 Season  ,모험,평범한 오타쿠 대학생 이와타니 나오후미는 도서관에서 책을 보던 도중 사성무기서라는 책을 발견하고 그 책을 보게 된다  그 순간 정신을 잃게 되고 깨어보니 검  창  활의 용사와 함께 자신도 모르게 이세계에 소환되어 있었다  그리고 그의 손에는 어째서인지 방패가 붙어있었다 
3,소드 아트 온라인  기,모험,    년  인류는 마침내 완전한 가상 공간을 실현했다  모든 게이머가 꿈꿔왔던           가상 대규모 온라인 롤 플레잉 게임   소드 아트 온라인  이 정식 가동을 시작한다  주인공은 소드 아트 온라인 플레이어인 키리토  그는    의 세계에서 플레이를 만끽하던 중 다른  만 명의 플레이어와 함께 게임 마스터의 무자비한 선고를 듣는다     층까지 있다는 부유성 아인크라드의 정상을 정복해 게임을 클리어 하지 못하면 로그아웃을 할 수 없다고  그리고 게임 오버는 현실 세계에서  죽음 을 의미한다고    키리토는 재빨리 게임의  진실 을 받아들이고 파티를 짜지 않는 솔로 플레이어로 끝이 보이지 않는 사투에 몸을 던진다 
4,전생했더니 슬라임이었던 건에 대하여  기  부,모험,주인공 리무루와 그를 따르는 다수의 마물들이 세운 나라  쥬라 템페스트 연방국 은 근린 국가들과의 협정과 교역을 통해  인간과 마물이 공존하는 나라 라는 이상을 현실로 만들려 하고 있었다 이는 인간이었던 슬라임에서 기인한 리무루의  인간에 대한 호의 였다      하지만 이 세계에는 명확한  마물에 대한 적의 가 존재하고 있었다  그 불합리한 현실을 마주했을 때  리무루는 선택한다   무엇을 잃고 싶지 않은지 를   
5,소드 아트 온라인 앨리시제이션,모험,문득 정신이 든 키리토는 어째선지 어느 한 가상세계에 풀 다이브해 있었다  로그인 이후의 기억이 모호해  실마리를 찾기 위해 떠돌게 된 키리토는 칠흑의 거목  기가스시더 을 발견했고 거기서 한 소년을 만나게 된다   내 이름은 유지오  잘 부탁해  키리토   그 소년은 가상세계의 주민인    였음에도 인간과 똑같이 풍부한 감정을 지니고 있었다  유지오와 친한 사이가 되어가면서도 이 세계에서 로그아웃할 방법을 찾고 있던 키리토  그런 키리토에게 어느 한 기억이 뇌리에 스친다  그것은 어린 키리토와 유지오가 야산에서 뛰놀던 추억  있을 리가 없는 기억  그리고 그 기억 속에는 유지오 말고도 또 다른 금발의 여자아이가 있었다  이름은 앨리스  절대로 잊어선 안 되는 소중한 이름 
6, 더빙  강철의 연금술사 BROTHERHOOD,모험,죽은 어머니를 살리기 위해 에드워드와 알폰스 형제는 금지 되어 있는 연성술을 시행한다  그러나 연성 실패의 대가로 에드워드는 왼쪽 다리를  알폰스는 육신 자체를 잃고 말았다  동생을 살리기 위해 연성을 시도한 에드워드는 오른쪽 팔을 희생한 대가로 간신히 에드워드의 혼을 철로 된 갑옷에 담아 두는 데 성공한다  잃어 버린 사지 대신 철로 된 의수를 부착한 에드워드는 주야로 연금술을 공부하여 결국은 국가연금술사 자격증을 따내고   강철의 연금술사 라는 호칭을 얻게 된다  하지만 엘릭 형제가  현자의 돌 의 진실에 가까이 다가갈수록 그 너머에 드리워진 어두운 음모 또한 엄습해 오는데 
7,일곱 개의 대죄   계명의 부활   기 ,모험,아직 사람과 마물의 세계가 분리되기 전 시대  헨드릭슨과 드레퓌스  두 명의 성기사장의 지배로부터 왕국을 탈환한  일곱 개의 대죄 와 엘리자베스  호크  왕국탄생제도 무사히 끝나  드디어 리오네스 왕국에 평화가 찾아왔으나 다음 위협의 징조가 그들에게 다가오고 있었다 
8,일곱 개의 대죄   기 ,모험,일찍이 왕국에 반역을 꾀했다고 여겨지는  명의 전설의 역적  일곱개의 대죄   그들은 지금도 집요하게 왕국의 핵심  성기사들에게 쫓기고 있었다  한편 엘리자베스 공주는 성기사들의 반란을 눈치 채고 왕국을 구하기 위해  일곱 개의 대죄 를 찾아 나선다  공주의 진실된 마음에  일곱 개의 대죄 의 단장이자  분노의 죄 멜리오다스는 그녀와 함께 나머지  일곱 개의 대죄 를 찾는 여행에 나서기로 하는데      과연  일곱 개의 대죄 는 모두 모일 수 있을 것인가   그리고 일찍이 일어났던 반역의 진실은   전대미문의 통쾌한 영웅 판타지  개막  
9,새벽의 연화,모험,고화국의 유일한 공주인 연화는 궁 밖의 세상일은 전혀 모르는 철부지 아가씨로 항상 궁 안에서만 지내고 있다  그런 그녀에게는 학과 수원이라는 소꿉친구가 곁에 있었다  하지만 부왕이 자신의 소꿉친구이자 짝사랑하고 있던 사촌 수원에 의해 살해당하게 되고  이를 목격한 연화는   세 생일에 가장 큰 위기를 겪게 된다  학의 도움으로 궁을 빠져나온 사이 수원이 고화국의 왕위를 계승하였고  연화는 마음을 추스르며 앞으로의 길을 모색하던 중 신관 익수의 신탁을 듣고 고화국의 신화 속 비룡왕을 보필하던 네 마리 용 백룡  청룡  녹룡  황룡 의 후손을 찾아 나서게 된다 
10,약속의 네버랜드  기,모험,어머니처럼 따르는 그녀는 친모가 아니다  함께 사는 그들은 형제가 아니다  이곳 그레이스 필드 하우스는 고아원으로 나는 고아  그렇게 생각하고 있었다 
11, 자막  블랙 클로버  기,모험,어린 시절 부모에게 버림을 받고 빈민 지역 교회에서 자란 아스타와 라이벌 유노  두 사람은 마법 세계의 정점인 마법제가 되겠다는 목표를 가지고 있다  그러나 아스타는 전혀 마력을 가지고 있지 않아 마법 기술을 쓰지 못하는 반면  유노는 어린 나이에도 불구하고 엄청난 마법의 소유자로 촉망 받는다  시간이 흘러 두 사람은   세가 되고  마력을 가진   세 아이들에게 마법기사단에 들어갈 수 있는 기회가 찾아온다  유노는 강력한 마력으로 초대 마법제가 받았던 행운이 담긴 네잎 클로버 마도서에게 선택받는 반면  아스타는 우여곡절 끝에 악마가 깃든 다섯 잎 클로버 마도서를 손에 넣게 된다  반년 후 마법기사단 입단 시험에 응시하는 아스타와 유노  아홉 개의 단으로 나눠진 마법기사단 모두에게 선택 받은 유노는 최강의 마법기사단  금색의 여명 에 들어간 반면  아스타는 간신히  검은 폭우 단에 선택되어 그들의 꿈을 좇게 되는데 
12,소드 아트 온라인  기,모험,    사건으로부터  년이 지났다  어느 날  키리토는 총무성 가상과의 키쿠오카 세이지로에게 기묘한 의뢰를 받는다  총과 강철의       건 게일 온라인 통칭     에서 갑자기 발생한 데스 건 사건  정체불명의 아바타가 든 검은 총에 맞은 플레이어는 현실 세계에서도 죽음에 이른다는데    키리토는 차마 키쿠오카의 의뢰를 거절하지 못하고    에 로그인하게 된다  데스 건에 관한 단서를 얻기 위해 익숙하지 않은 게임 속을 방황하는 키리토  그런 그에게 도움의 손길을 내밀어 준 것은 거대한 라이플을 쓰는 스나이퍼  시논이었다 
13,흔해빠진 직업으로 세계최강  기,모험,왕따인 나구모 하지메는 같은 반 아이들과 함께 이세계로 소환된다  차례차례 사기적인 전투 능력을 발현하는 반 아이들과는 달리 연성사라는 평범한 능력을 손에 넣은 하지메  이세계에서도 최약인 그는 어떤 반 아이의 악의로 인해 미궁의 나락으로 떨어지고 마는데   탈출 방법을 찾을 수 없는 절망의 늪에서 연성사로서 최강에 도달하는 길을 발견한 하지메는 흡혈귀인 유에와 운명적인 만남을 갖는다   내가 유에를  유에가 나를 지킨다  그럼 최강이야  전부 쓰러뜨리고 세계를 뛰어넘자   나락으로 떨어진 소년과 가장 깊은 곳에 잠들어 있던 흡혈귀가 펼치는  최강  이세계 판타지 개막  그리고 소년은  최강 을 뛰어넘는다 
14,Re   제로부터 시작하는 이세계 생활  기 part  ,모험, 내가 반드시 너를 구해 보이겠어  마녀교 대죄사교  나태  담당 페텔기우스 로마네콩티를 물리치고 에밀리아와 재회한 나츠키 스바루  괴로운 결별을 극복하고 드디어 만난 두 사람이었지만 그것은 새로운 파란의 시작이었다  상상을 뛰어넘는 절체절명의 위기 그리고 덮쳐오는 무자비한 현실  소년은 다시 가혹한 운명에 맞선다 
15, 자막  블랙 클로버  기,모험,어린 시절 부모에게 버림을 받고 빈민 지역 교회에서 자란 아스타와 라이벌 유노  두 사람은 마법 세계의 정점인 마법제가 되겠다는 목표를 가지고 있다  그러나 아스타는 전혀 마력을 가지고 있지 않아 마법 기술을 쓰지 못하는 반면  유노는 어린 나이에도 불구하고 엄청난 마법의 소유자로 촉망 받는다  시간이 흘러 두 사람은   세가 되고  마력을 가진   세 아이들에게 마법기사단에 들어갈 수 있는 기회가 찾아온다  유노는 강력한 마력으로 초대 마법제가 받았던 행운이 담긴 네잎 클로버 마도서에게 선택받는 반면  아스타는 우여곡절 끝에 악마가 깃든 다섯 잎 클로버 마도서를 손에 넣게 된다  반년 후 마법기사단 입단 시험에 응시하는 아스타와 유노  아홉 개의 단으로 나눠진 마법기사단 모두에게 선택 받은 유노는 최강의 마법기사단  금색의 여명 에 들어간 반면  아스타는 간신히  검은 폭우 단에 선택되어 그들의 꿈을 좇게 되는데 
16, 더빙  원피스  기,모험,어렸을 적 악마의 열매를 먹고 몸이 맘대로 늘어나는 고무 인간이 돼버린 주인공 루피  그러나 해적왕이 꿈인 루피는 그 열매를 먹은 대가로 수영을 할 수가 없다  해적왕이 꿈인 소년이 수영을 할 수가 없다니 꿈을 접어야 할까  루피는 수영을 못한다면 물에 안 빠지면 된다며 자신의 꿈을 향해 전진한다  해적왕 골드로저가 남긴 보물 원피스를 차지하기 위해 수 많은 사람들이 바다로 뛰어드는 대해적 시대를 배경으로 세계지도를 그리려는 항해사  나미   최고의 검객를 꿈꾸는  조로   기적의 바다 오올 블루를 찾는 주방장  상디   코가 파랗다는 이유로 동료들에게 버려진 사슴인간  쵸파 이렇게 다섯 인물들의 파란만장한 모험 이야기가 펼쳐진다 
17, 자막  이 멋진 세계에 축복을   기,모험,게임을 사랑하는 은둔형 외톨이 소년  사토 카즈마의 인생은 너무나도 허무하게 그 막을 내린   줄 알았는데  정신을 차려보니 눈앞에 여신을 자처하는 미소녀가 있었다  이리하여  이세계로 넘어간 카즈마의 대모험이 시작  되나 싶었는데  결국 시작된 것은 의식주 확보를 위한 노동이었다  카즈마는 그저 평온하게 살고 싶지만  문제를 연달아 일으키는 여신 때문에 결국 마왕군에게 찍히고 마는데  
18,던전에서 만남을 추구하면 안 되는 걸까,모험,만남을 기대하며 던전에 뛰어든 인간 소년  벨    권속          을 찾아 거리를 헤매던 여신 헤스티아  둘의 운명적인 만남에서 새로운  신화               가 시작된다  사람들의 꿈과 욕망이 모인 이 도시에서  소년은 조그만 여신과 만난다   저는 강해질 거예요   벨은 던전에서 미녀와의 만남을 꿈꾸는 신출내기 모험자이지만 조그만 여신 헤스티아와 단둘이  파밀리아 를 세우고  던전 탐색의 나날이 시작되었다  여느 때처럼 던전에 내려갔던 그는 어느 날 미노타우로스와 조우한다  압도적으로 강한 몬스터에게 습격당해 절체절명의 위기   그런 그를 구한 것은 긴 금발과 금색 눈동자를 가진 아름다운 소녀   검희  아이즈 발렌슈타인이었다  언젠가는 그녀처럼       벨의 진정한 모험이 시작된다  
19,로그 호라이즌  기,모험, 만 명의 게이머가 게임 속 세계로 소환  더 이상 게임이 아닌 세계에서 히키코모리 기질의 안경 주인공의 모험이 시작된다  약  만 명의 게이머가 끌려 들어간 온라인 게임 속 세계인  엘더테일   그 세계의 한 지역인  아키바  거리는 표면적으로는 평온한 분위기를 회복했지만  다른 한편으로는 난폭한 공기를 여전히 간직하고 있었다  그 와중에 시로에는 도움을 받었던 초보 모험가 토우야와 미노리의 감금 사실을 알게 되고        아키바 의 정세에 혐오감을 씻을 수 없게 된 시로에가 드디어 움직인다  역전의 맹자   명을 결집시켜 무법 지대가 되어버린  아키바 에  희망 을 되찾기 위하여 
