,titles,category,summary
32, 자막  블랙 클로버  기,액션,어린 시절 부모에게 버림을 받고 빈민 지역 교회에서 자란 아스타와 라이벌 유노  두 사람은 마법 세계의 정점인 마법제가 되겠다는 목표를 가지고 있다  그러나 아스타는 전혀 마력을 가지고 있지 않아 마법 기술을 쓰지 못하는 반면  유노는 어린 나이에도 불구하고 엄청난 마법의 소유자로 촉망 받는다  시간이 흘러 두 사람은   세가 되고  마력을 가진   세 아이들에게 마법기사단에 들어갈 수 있는 기회가 찾아온다  유노는 강력한 마력으로 초대 마법제가 받았던 행운이 담긴 네잎 클로버 마도서에게 선택받는 반면  아스타는 우여곡절 끝에 악마가 깃든 다섯 잎 클로버 마도서를 손에 넣게 된다  반년 후 마법기사단 입단 시험에 응시하는 아스타와 유노  아홉 개의 단으로 나눠진 마법기사단 모두에게 선택 받은 유노는 최강의 마법기사단  금색의 여명 에 들어간 반면  아스타는 간신히  검은 폭우 단에 선택되어 그들의 꿈을 좇게 되는데 
33,무직전생   이세계에 갔으면 최선을 다한다  기,액션, 나는 이 세계에서 최선을 다하겠어     세 총각에 무직인 방구석 폐인이었던 남자  그는 부모님의 장례식 날에 집에서 쫓겨나 트럭에 치여 목숨을 잃었다  다시 눈을 떴을 때 그는 검과 마법이 존재하는 이세계에서 아기로 다시 환생해 있었다  쓰레기처럼 살아온 남자는 소년 루데우스로서 이세계에서 최선을 다해 살아가기로 맹세한다  루데우스를 기다리는 것은 로리 마술사  엘프 귀를 가진 소꿉친구  흉포한 새침데기 아가씨와 그 외 다양한 인간들과의 만남  그리고 가혹한 모험과 전투  그의 새로운 인생이 움직이기 시작한다   인생 재시작  판타지  개막    
34,불꽃 소방대  기,액션,방금까지 멀쩡하던 사람이 갑자기 불타올라 불을 다루고 끝없이 파괴를 일삼는 괴물   화염 인간 이 되는  인체 발화 현상 에 전인류는 두려움에 떨었다  불의 공포에 맞서는 특수 소방대는 그 현상의 수수께끼를 풀고  인류를 구하는 것이 사명  어떤 이유로 인해 악마라 불리는 신입 대원  신라는  히어로 를 목표로 동료들과 함께  화염 인간 과의 대결의 나날에 몸을 던진다 
35,소드 아트 온라인  기,액션,    사건으로부터  년이 지났다  어느 날  키리토는 총무성 가상과의 키쿠오카 세이지로에게 기묘한 의뢰를 받는다  총과 강철의       건 게일 온라인 통칭     에서 갑자기 발생한 데스 건 사건  정체불명의 아바타가 든 검은 총에 맞은 플레이어는 현실 세계에서도 죽음에 이른다는데    키리토는 차마 키쿠오카의 의뢰를 거절하지 못하고    에 로그인하게 된다  데스 건에 관한 단서를 얻기 위해 익숙하지 않은 게임 속을 방황하는 키리토  그런 그에게 도움의 손길을 내밀어 준 것은 거대한 라이플을 쓰는 스나이퍼  시논이었다 
36,오버로드  기,액션,아인즈는 고민하고 있었다  아인즈 울 고운 마도국의 왕으로서 이 나라를 어떻게 다스려야 할 것인가  알베도  데미우르고스 같은 우수한    들과 휴식 없이 일할 수 있는 언데드들 덕분에  마도국은 현재 안전하고 굶주림 없는 장소가 되어 있었다  하지만  그곳에서 살고 있는 사람들은 아직 공포와 불안감에 떨고 있었고  도시는 불이 꺼진 듯이 조용했으며 활기를 잃어버렸다  사람들의 웃음을 찾아볼 수 없는 가운데  아인즈는 모험자 조합에 방문해 조합장인 아인잭에게 어떤 제안을 했다  한편  갑자기 생겨난 마도국에 당혹스러워하던 주변 나라들의 지도자들도 각자 대항책을 강구하고 있었다  과연 아인즈는 각 나라의 모략을 저지하고 자신의 이상향을 만들어낼 수 있을 것인가 
37,오버로드  기,액션,오버로드  기      년  월 방영 시작 
38,원펀맨  기,액션,취미로 히어로를 시작한 남자  사이타마   년간의 훈련에 의한 무적의 힘을 손에 넣어 모든 적을 일격에 쓰러뜨리는 영웅이다  우연한 일로 제자가 된 제노스와 함께 히어로 협회에서 정식 히어로 활동을 개시한다  괴인발생률이 비정상적으로 높아지는 가운데  대예언자 시바바와가 보낸  지구가 위험하다  예언을 받고  대책에 나서려는 히어로 협회  거기에 히어로 사냥의 가로우가 나타난다 
39,오버로드  기,액션,때는     년  한때 폭발적인 인기를 얻었던 가상 체감형 게임  위그드라실 은 서비스를 종료할 예정이었다  플레이어인 모몬가는 동료와 함께 나자릭 지하대분묘에서 서비스 종료시간을 기다리고 있었다  하지만 종료시간이 지나도 로그아웃이 되기는커녕    들이 갑자기 의지를 가지고 스스로 움직이기 시작했다  게다가 나자릭 밖으로 나가보니 본적도 없는 이세계가 펼쳐져 있었다  모몬가는 예전 동료들을 찾기 위해 길드의 이름이었던 아인즈 울 고운이라는 이름을 사용하고  이세계에 그 이름을 널리 퍼뜨리기로 결심한다  그리고 절대적인 충성을 맹세한 부하들과 함께 새로운 땅을 향해 진격한다 
40,아픈 건 싫으니까 방어력에 올인하려고 합니다,액션,친구가 같이 하자는 말에 시작한            메이플 이라는 이름으로 가상현실에 접속한 카에데는 뭐가 뭔지 하나도 몰라서  스테이터스를 모두     방어력 에 투자하고 마는데    보통이라면 아무도 고르지 않은 방어 특화의 길  하지만 그것이 메이플의 특이함과 맞물려  절대방어 라는 스킬을 낳고  어지간한 일로는 대미지가  도 들어가지 않는 철벽의 최강 캐릭터를 탄생시켰다   순진무구한 온라인 게임 초보 메이플이 방어력에 올인하는 특이한 플레이를 하면서 벌어지는 웃기고  신기하고  가슴 후련한 이야기 
41,세계 최고의 암살자  이세계 귀족으로 전생하다,액션,특정 에피소드가 청불로 지정되어  성인이용가로 분류되었습니다  서비스 이용에 참고 부탁드립니다  세계 최고의 암살자가 암살 귀족의 장남으로 환생했다  이세계에서 다시 태어나는 조건으로 그가 여신으로부터 받은 미션은 단 하나  인류에 재앙을 가져온다고 예언된 용사를 죽이는 것  그것이 세계 최고의 암살자가 새로운 인생에서 완수해야 할 사명이었다  현대에서 온갖 암살을 가능케 한 폭넓은 지식과 경험  그리고 이세계 최강으로 칭송받는 암살자 일족의 비술과 마법  그 모든 것이 시너지 효과를 낳아  그는 견줄 상대가 없는 암살자로 성장해 가는데   
42,현자의 손자,액션,사고로 죽었을 청년이 갓난아기의 모습으로 이세계에서 환생  구국의 영웅  현자  멀린 월포드에게 거둬진 그는 신이라는 이름을 받는다  손자로서 마린의 기술을 흡수해가며 놀라운 힘을 얻게 된 신이었지만  그가 열다섯 살이 되자 할아버지는 이렇게 말했다   앗차차   상식을 가르치는 걸 깜빡했구먼   이런 이유로 신은 상식과 친구를 얻기 위해 알스하이드 고등 마법학원에 입학하게 되는데    규격 외  소년의 파격적인 이세계 판타지 라이프  여기서 개막 
43,Re   제로부터 시작하는 이세계 생활  기 part  ,액션, 내가 반드시 너를 구해 보이겠어  마녀교 대죄사교  나태  담당 페텔기우스 로마네콩티를 물리치고 에밀리아와 재회한 나츠키 스바루  괴로운 결별을 극복하고 드디어 만난 두 사람이었지만 그것은 새로운 파란의 시작이었다  상상을 뛰어넘는 절체절명의 위기 그리고 덮쳐오는 무자비한 현실  소년은 다시 가혹한 운명에 맞선다 
44,원펀맨,액션,일격필살  너무나 강해진 나머지 제아무리 흉악한 괴인이라도 원 펀치로 무찔러버리는 히어로  사이타마   최강의 뜨뜻미지근 히어로 전설 개막     작가 원펀맨이 인기를 끌어 초절정 그림체로 업그레이드했다  최고로 강하고 최고로 헐렁한 히어로의 새로운 코믹 액션   다양한 괴수가 나타나기 시작한 현대 도시  혼란에 빠진 세상을 구하기 위해 나타난 한 남자가 있었으니  어떤 적이든 일격에 끝장내 버리는 초강력 히어로 사이타마였다  하지만 너무나도 순식간에 적을 끝장내버리는 바람에 아무도 그의 활약을 눈치 채지 못하는데   세상을 지키고도 인기를 얻기는커녕 보답조차 받지 못해 생활고에 시달리는  최고로 서민적인 히어로의 지구 수호 활약기 
45, 자막  스파이 패밀리 part  ,액션,사람은 누구나 아무에게도 보여줄 수 없는 자신을 갖고 있다   세계 각국이 물밑에서 치열하게 정보전을 펼치는 시대  오스타니아와 웨스탈리스는 십수 년간에 걸쳐 냉전 상태에 있었다  웨스탈리스의 정보국 대동과        소속의 수완가 스파이인  황혼 은 동서 평화를 위협하는 위험인물  오스타니아의 국가통일당 총재 도노반 데스몬드의 동향을 살피기 위해 어떤 극비 임무를 수행하게 된다  그 이름은 오퍼레이션  올빼미   임무 내용은   일주일 이내에 가족을 만들어  데스몬드의 아들이 다니는 명문 학교의 친목회에 잠입하라     황혼 은 정신과 의사 로이드 포저로 위장하고 가족을 만들게 된다  하지만  그가 만난 딸 아냐는 마음을 읽을 수 있는 초능력자  아내 요르는 암살자였다   명의 이해가 일치하여 서로 정체를 숨기면서 함께 생활하게 되는데  해프닝 연속인 임시 가족에게  세계의 평화는 맡겨졌다   
46,진격의 거인  기 part  ,액션,백 년이라는 긴 시간 동안 인류와 바깥 세계의 사이를 막아온 벽  그 벽 너머에는 본 적 없는 세계가 펼쳐져 있었다  불꽃의 물  물의 대지  사막의 설원 등 책에 써있던 것들은 소년의 탐구심을 자극할 뿐이었다  이윽고 시간이 지나 벽이 거인들에게 파괴된 지금  인류는 세계의 진실을 향해 한발한발 내디딘다  거인의 정체는 무엇인가  왜 벽 안쪽은 거인으로 가득했는가  거인화한 엘런 예거가 가진 좌표의 힘이란 무엇인가  그리고 히스토리아 레이스는 이 세계의 무엇을 알고 있는가  엘렌을 비롯한    기 병사들이 포함된 새로운 체제의 리바이반  본격적으로 움직이기 시작한 그들의 앞을 가장 강한 최악의 적이 가로막는다 
47,진격의 거인 The FINAL part  ,액션,그 거인은 언제 어떤 시대에도 자유를 갈망하며 나아갔다  자유를 위해 싸웠다  그 이름은 진격의 거인 드디어 밝혀진 벽 밖의 진실과 거인의 정체 이곳에 이르기까지 인류는 너무나도 큰 희생을 치렀다  그럼에도 그들은 계속 나아가야만 한다  벽 밖에 있는 자유의 상징  바다를 아직 그 눈으로 보지 못했으니까  이윽고 시간은 흘러 첫 번째  초대형 거인 에 의한 최초의 습격으로부터  년 조사병단은 월 마리아 밖의 벽외 조사를 감행한다   벽 너머에는 바다가 있고  바다 너머에는 자유가 있다  그렇게 믿어왔는데        벽 안의 인류가 처음으로 도달한 바다  끝없이 펼쳐진 수평선 너머에 있는 것은 자유인가  아니면       엘런 예거의 이야기는 새로운 국면을 맞이한다     
48,나루토  기,액션,나뭇잎 마을의 우즈마키 나루토는 아무도 못말리는 말썽꾸러기인데다가  닌자 졸업 시험에 연속해서 낙방한 전력이 있는 문제아  다시 돌아온 시험에서 나루토는 마지막 관문인 분신술에 실패하여 또 낙제를 하게 된다  상심한 나루토에게 닌자 선생님 중 한 명인 미즈키 선생님이 다가와 마을 뒷산에 숨겨진  봉인의 서 봉인된 책  만 있으면 시험에 쉽게 통과할 수 있다고 알려준다  그러나 나루토가 이 책을 가지러 갔다는 말에  평소 나루토를 아껴주고 힘을 북돋워주던 이루카 선생님은 급히 나루토의 뒤를 쫒는다  미즈키는 사실 마을의 천덕꾸러기로 미움을 받고 있는 나루토를 이용하여 봉인의 서를 손에 넣으려는 음모를 꾸몄던 것이다  이 일을 계기로 나루토는 미즈키로부터 자신의 정체가 구미호의 봉인체라는 충격적인 이야기를 듣는다  사람들을 닥치는대로 해하던 흉한 구미호를 전설적인 닌자인 호카게가 당시 아기였던 자신의 몸에 봉인했다는 것이다  나루토는 마음의 충격이 컸지만 자신을 위로해주는 이루카 선생님의 말씀에 감동하여 마침내 자신의 능력을 제대로 선보이고  그 결과 졸업에 성공하게 된다  하급 닌자인 견습 닌자가 된 나루토는  꽤나 실력도 인물도 출중한 사스케와 당찬 여닌자 사쿠라를 동료로 하여 새로운 선생님인 카카시를 모시게 된다  하지만 행실이 그다지 선생님으로서 모범적이지 못한 카카시는 오히려 나루토 일행에게 실력이 너무 형편없다며 구박을 일삼는다  사실 말이 동료일뿐 팀 웍이 전혀 갖추어지지 않은 나루토 일행은 개인 플레이로 인해 여러번 일을 망치곤 한다  자신들의 주어진 일에 만족하지 못하고 있는 나루토 일행에게 호카게  최고의 닌자에게 대를 물려 이어지는 이름 는 새로운 임무를 주는데   
49,문호 스트레이 독스  기,액션,문호스트레이독스  쿨  기   외전 소설 다자이 오사무와 암흑시대  원작  권에서  권을 애니화 다자이 오사무가 탐정사에 오기 전  다자이가   살때  아직 그가 포트마피아의 간부로 있을 적에 그에게는 직분의 차이와 관계없는 우정을 가진  명의 친구가 있었다  조직의 정보원인 사카구치 안고  조직의 하급조직원인 오다 사쿠노스케  그들은 주로 바 루핀에서 모여 이런 자질구레한 이야기를 하며 술을 마셨다  그러던 어느날  늘 같은 곳에서 술을 마시던 그들은 다자이의 제안으로 사진을 찍게 된다  그리고 그 날을 계기로 그 세명이 다시 그 곳에 모이는 일은 없어졌다  왜냐하면 그  명의 친구 중 한 사람이 죽었기 때문이다 
50,진격의 거인  기,액션,꿈도 희망도 허락되지 않았던 인류와 거인의 대결이 시작된다      여 년 전 갑작스레 나타난 거인의 먹이가 되어버린 인류는 높이   미터에 이르는 거대한 벽을 쌓고 벽 바깥으로 나가는 자유와 맞바꿔 침략을 막고 있었다  그러나 허울뿐인 평화는 벽을 넘어 버리는 초대형 거인의 등장으로 무너지고  지옥 같은 상황에 빠지고 만다  한편 아직 보지 못한 벽 바깥 세상에 대해 동경하던 앨런과 막강한 전투력의 보유자 미카사  마음 약한 아르민은 병사가 되어 마을을 지켜 나가는데   
51, 자막  블랙 클로버  기,액션,어린 시절 부모에게 버림을 받고 빈민 지역 교회에서 자란 아스타와 라이벌 유노  두 사람은 마법 세계의 정점인 마법제가 되겠다는 목표를 가지고 있다  그러나 아스타는 전혀 마력을 가지고 있지 않아 마법 기술을 쓰지 못하는 반면  유노는 어린 나이에도 불구하고 엄청난 마법의 소유자로 촉망 받는다  시간이 흘러 두 사람은   세가 되고  마력을 가진   세 아이들에게 마법기사단에 들어갈 수 있는 기회가 찾아온다  유노는 강력한 마력으로 초대 마법제가 받았던 행운이 담긴 네잎 클로버 마도서에게 선택받는 반면  아스타는 우여곡절 끝에 악마가 깃든 다섯 잎 클로버 마도서를 손에 넣게 된다  반년 후 마법기사단 입단 시험에 응시하는 아스타와 유노  아홉 개의 단으로 나눠진 마법기사단 모두에게 선택 받은 유노는 최강의 마법기사단  금색의 여명 에 들어간 반면  아스타는 간신히  검은 폭우 단에 선택되어 그들의 꿈을 좇게 되는데 
52,진격의 거인 The FINAL part  ,액션,그 거인은 언제 어떤 시대에도 자유를 갈망하며 나아갔다  자유를 위해 싸웠다  그 이름은    진격의 거인  드디어 밝혀진 벽 밖의 진실과 거인의 정체  이곳에 이르기까지 인류는 너무나도 큰 희생을 치렀다  그럼에도 그들은 계속 나아가야만 한다  벽 밖에 있는 자유의 상징  바다를 아직 그 눈으로 보지 못했으니까    이윽고 시간은 흘러 첫 번째  초대형 거인 에 의한 최초의 습격으로부터  년  조사병단은 월 마리아 밖의 벽외 조사를 감행한다   벽 너머에는 바다가 있고  바다 너머에는 자유가 있다  그렇게 믿어왔는데        벽 안의 인류가 처음으로 도달한 바다  끝없이 펼쳐진 수평선 너머에 있는 것은 자유인가  아니면       엘런 예거의 이야기는 새로운 국면을 맞이한다 
53, 더빙  원피스  기,액션,어렸을 적 악마의 열매를 먹고 몸이 맘대로 늘어나는 고무 인간이 돼버린 주인공 루피  그러나 해적왕이 꿈인 루피는 그 열매를 먹은 대가로 수영을 할 수가 없다  해적왕이 꿈인 소년이 수영을 할 수가 없다니 꿈을 접어야 할까  루피는 수영을 못한다면 물에 안 빠지면 된다며 자신의 꿈을 향해 전진한다  해적왕 골드로저가 남긴 보물 원피스를 차지하기 위해 수 많은 사람들이 바다로 뛰어드는 대해적 시대를 배경으로 세계지도를 그리려는 항해사  나미   최고의 검객를 꿈꾸는  조로   기적의 바다 오올 블루를 찾는 주방장  상디   코가 파랗다는 이유로 동료들에게 버려진 사슴인간  쵸파 이렇게 다섯 인물들의 파란만장한 모험 이야기가 펼쳐진다 
54, 자막  이 멋진 세계에 축복을   기,액션,게임을 사랑하는 은둔형 외톨이 소년  사토 카즈마의 인생은 너무나도 허무하게 그 막을 내린   줄 알았는데  정신을 차려보니 눈앞에 여신을 자처하는 미소녀가 있었다  이리하여  이세계로 넘어간 카즈마의 대모험이 시작  되나 싶었는데  결국 시작된 것은 의식주 확보를 위한 노동이었다  카즈마는 그저 평온하게 살고 싶지만  문제를 연달아 일으키는 여신 때문에 결국 마왕군에게 찍히고 마는데  
55,진격의 거인  기 part  ,액션,백 년이라는 긴 시간 동안 인류와 바깥 세계의 사이를 막아온 벽  그 벽 너머에는 본 적 없는 세계가 펼쳐져 있었다  불꽃의 물  물의 대지  사막의 설원 등 책에 써있던 것들은 소년의 탐구심을 자극할 뿐이었다  이윽고 시간이 지나 벽이 거인들에게 파괴된 지금  인류는 세계의 진실을 향해 한발한발 내디딘다  엘렌을 비롯한    기 병사들이 포함된 새로운 체제의 리바이반  본격적으로 움직이기 시작한 그들의 앞을 가장 강한 최악의 적이 가로막는다 
56,은혼  기,액션,외계인들이 습격으로 지구인과 천인 사이에   여년에 걸친 전쟁으로 대다수의 무사와 양이지사      가 천인이 벌인 전쟁에 참가했다  하지만 천인의 막강한 힘에 무릎을 꿇은 막부는 천인의 침략을 인정하고 조약을 체결하게 된다  무사들은 폐도령     으로 칼을 잃고  막부는 천인이 세운 괴뢰정권으로 변했다  이 내용은 실제 일어난 쿠로후네 사건을 모티브로 하고  에도 시대와 현대 문화 및 우주선을 자신의 감각에 맞게 섞어 놓았다  이 무렵 은발의 무사인 사카타 긴토키가 동료들과 함께 기상천외한 생활을 겪는 이야기이다 
57,거미입니다만  문제라도 ,액션,아주 평범한 여고생이었던 주인공  나 는  졸지에 판타지 세계의 거미 마물로 환생하게 된다  그 뿐만 아니라 깨어난 곳은 흉악한 몬스터로 가득 찬 던전  나의 인간적인 지식과 압도적인 긍지만 을 무기로  살아남기 위해 거미줄과 덫을 이용해 더 강한 몬스터들을 물리쳐야 한다  단지 살아남기 위해서 말이다 
58,마왕학원의 부적합자,액션,마왕으로 군림하던 아노스 볼디고드는 마왕성 데르조게이드에서 용사 카논이 창조신 미리티아와 대정령 레노와 함께 쳐들어오는 것을 맞이한다  마족과 인간  정령  신들 간의 전쟁에 질려버린 아노스는 그 비극을 끝내길 원했고   개의 세계로 분리하는 결계를 만드는 것과  천 년 후 전생하는 것을 조건으로 해서 그들을 불러들인 것으로 마왕 아노스는 용사의 검에 순순히 목숨을 내준다  그로부터  천 년 후  어느 젊은 부부가 갓난 아기를 낳는다  두 부부는 태어난 아기에게 어떤 이름을 지어줄까하면서 이름에 대해서 말한다  그리고 그 아기는 눈을 뜨면서 말한다   이름은 아노스  아노스 볼디고드다  
59,귀멸의 칼날   무한열차편,액션,혈귀로 변해버린 여동생 네즈코를 인간으로 되돌릴 단서를 찾아 비밀조직 귀살대에 들어간 탄지로  젠이츠  이노스케와 새로운 임무 수행을 위해 무한열차에 탑승 후 귀살대 최강 검사 염주 렌고쿠와 합류한다  달리는 무한열차에서 승객들이 하나 둘 흔적 없이 사라지자 숨어있는 식인 혈귀의 존재를 직감하는 렌고쿠  귀살대 탄지로 일행과 최강 검사 염주 렌고쿠는 어둠 속을 달리는 무한열차에서 모두의 목숨을 구하기 위해 예측불가능한 능력을 가진 혈귀와 목숨을 건 혈전을 시작하는데 
60,던전에서 만남을 추구하면 안 되는 걸까,액션,만남을 기대하며 던전에 뛰어든 인간 소년  벨    권속          을 찾아 거리를 헤매던 여신 헤스티아  둘의 운명적인 만남에서 새로운  신화               가 시작된다  사람들의 꿈과 욕망이 모인 이 도시에서  소년은 조그만 여신과 만난다   저는 강해질 거예요   벨은 던전에서 미녀와의 만남을 꿈꾸는 신출내기 모험자이지만 조그만 여신 헤스티아와 단둘이  파밀리아 를 세우고  던전 탐색의 나날이 시작되었다  여느 때처럼 던전에 내려갔던 그는 어느 날 미노타우로스와 조우한다  압도적으로 강한 몬스터에게 습격당해 절체절명의 위기   그런 그를 구한 것은 긴 금발과 금색 눈동자를 가진 아름다운 소녀   검희  아이즈 발렌슈타인이었다  언젠가는 그녀처럼       벨의 진정한 모험이 시작된다  
61, 무삭제  해골기사님은 지금 이세계 모험 중,액션,눈을 떠 보니       에서 자신이 사용하던 게임 캐릭 터의 모습으로 이세계에 떨어진  아크   그 모습은 외형이 갑옷  내용물은 전신골격인 해골기사  였다     정체를 들키면 몬스터로 몰려 토벌 대상이 될 수 있다   때문에  아크 는 눈에 띄지 않게 용병으로 지내기로 결심 하지만  눈앞에서 일어난 악행을 내버려 둘 만한 남자는 아니었다  해골기사님의 무자각  사회혁명 이세계 판타지  
62,문호 스트레이 독스  기,액션,백호와 검은 짐승   나카지마 아츠시와 아쿠타가와 류노스케의 공동 투쟁이 프랜시스  와의 결전을 제압하고 대국으로부터 내습한  길드 와의 거대 이능 전쟁은 종결을 맞이했다  그 싸움 속에서 맺어진  무장 탐정사 와 포트 마피아 의 휴전 협정을 이어가는 가운데  괴멸의 위기에서 벗어난 요코하마의 거리는 오늘도 일상이라는 이야기를 써나가고 있다 하지만 거기에는 유입되는 해외 범죄 조직의 소문과 길드 잔당의 그림자도 보일듯 말듯     한편  다자이 오사무는 우려했다   마인 의 각성과 새로운 재앙이 시작되는 것을    배수관에서 몸부림치는 도적단  죽음의 집의 쥐  의 두목  표도르    그 무서운 모략이 결국 송곳니를 드러낸다 
