,titles,category,summary
38,PSYCHO PASS  기,성인,인간의 심리상태와 성격 경향을 측정하고 수치화시키는 세계  모든 심리 경향이 기록 관리되는 가운데 개인의 영혼 판정 기준이 된 이 계측치를 사람들은 사이코 패스라고 부르게 되었다 잠정적 범죄자를 가려내어 치안 유지를 담당하는 형사들은 범인을 체포하는  집행관 과 집행관을 감시  지휘하는  감시관 으로 구성되어 팀을 이룬다  스스로가 높은  범죄계수 를 가지고 있는 집행관들은 범죄자가 될 수 있는 위험성을 가지고 있어 냉정한 판단력을 갖춘 엘리트   감시관 에게 항상 감시되고 있다  이런 상황 속에  공안국 형사과의 멤버들은 각자의 정의를 가지고 임무를 수행한다  과연 그들이 향하는 곳 끝에 있는 것은 
39,금장의 벨메이유  벼랑 끝 마술사는 최강의 재액과 마법세계를 헤쳐나간다 ,성인,왕립 올티기아 마법학원    소환 마술에 성공하지 못해 유급될 위기에 처한 학생 알트는 우연히 발견한 낡은 소환 마술서에서 본 마법진을 그리고 봉인돼있던 악마 벨메이를 소환해버린다  그녀는 오래전부터 두려움의 대상이었던  악마 이자 재액을 불러오는 강대한 힘을 가지고 있었다  사역마가 된 벨메이에게는 정기적으로 마력을 공급할 필요가 있었고 그 방법은 진한 키스를 하는 것이었다  그런 두 사람의 관계를 질투하는 소꿉친구 리리아  그리고 전대미문의 사역마에 어리둥절해하는 다른 학생들  최강의 사역마와 계약한 알트는 위대한 마법사  플래티넘 스퀘어 를 목표로 한다  벼랑 끝 마술사와 불건전한 악마 누나의 왕도 판타지 개막 
40, 무삭제  도쿄 구울   re,성인,인간의 형태를 하고 사람들 속에 섞여  인간 고기를 먹으며 살고 있는  식종 구울   구울을 구축 연구하는   는 어떤 하나의 명제를 성취하기 위해 실험체 집단을 신설한다  그것의 이름은  크인크스    제대로 된 인간이 아닌 그들과 함께   사사키 하이세  일등 수사관이  도쿄 의 한 마을에서 마주하게 되는 것은    도쿄 구울    그  년 후의 이야기가 시작된다 
41,단간론파   희망의 학교와 절망의 고교생,성인,졸업하는 것만으로 인생 성공이 약속받는다는  키보가미네 학원   하지만 이 학원에 들어갈 수 있는 것은 극히 한정된 사람들인  초고교급 이라 불리는 뛰어난 재능을 가진 학생들뿐이었다   그리고 지금  이 학원에 한 명의 소년이 발을 들여놓으려 하고 있다  특별한 특징도 없는 극히 평범한 주인공 나에키 마코토  그는 추첨으로 홀로 입학을 허락받은  초고교급 의 행운을 가진 자였다  스스로의 행운과 새로운 환경에 흥분을 감출 수 없는 나에키  하지만 그런 그를 기다리고 있던 것은 상상도 하지 못한 사태였다  학원에 발을 들여놓자마자 온몸을 휘감는 충격  그리고 마코토가 눈을 떴을 때  그는   명의 동료와 함께 봉쇄된 교사에 갇혀있다는 것을 알게 된다  게다가 갑작스런 상황에 어리둥절해하는 나에키 일행의 앞에 나타난 것은 학원장이라고 하는 모노쿠마  그는 이렇게 고한다   지금부터 여러분은 평생 이곳에서 지내게 됩니다  학원에서 졸업하고 싶다면  동료를 죽여야만 합니다 라고  
42,종말의 하렘,성인,때는 근미래      년의 일본 동경  난치병에 걸린 청년 레이토는 소꿉친구 에리사와 재회를 맹세하고  병을 치료하기위해  콜드슬립 에 들어간다   년 후에 눈을 떴을 때  세계는 커다란 변화를 이루고 있었다                  바이러스에 의해 지구상의      의 남성은 사멸  지상은  명의 남자에 비하여   억의 여성이 존재하는  초하렘이 되어 있었다    바이러스의 저항력을 가진 남성  넘버스 는  겨우  명  그 중  명인 레이토는  남겨진 여성들과 인류의 잔류를 위해  아이갖기 하는 것을 요구 받는다  팬더믹 후의 세계에 펼쳐지는 하렘생활  동시에  레이토는 넘버스를 둘러싼 세계적인 음모에 휘말려 들어간다  밀려오는 유혹을 이겨내고  세계를 구할 수 있을까 
43, 무삭제  도쿄 구울   re part  ,성인, 카네키 켄 을 둘러싼 이야기    그 마지막 장  군중 속에 섞여  인간 고기를 먹고 산다  인간의 형태를 하면서 인간과는 다른 존재     식종 구울   구울을 구축  연구하는    로  크인크스 를 이끌던 구울 수사관  사사키 하이세  그가 바로 실종된 안대의 식종  카네키 켄 이었다  한편  새로운 체제가 된      에서는 후루타 니무라를 중심으로 불온한 움직임이 표면화 하고     카네키 켄 을 둘러싼 이야기는 마침내 마지막 장에   
44,나만 들어가는 숨겨진 던전,성인,욕구를 충족시켜 세계최강 스킬을 창작  부여  편집해라  희귀한 아이템과 마물들이 도사리고 있는 전인미답이자 도달 불가능한 던전     숨겨진 던전  운 좋게 그곳의 문을 연 것은 가난한 귀족의 셋째 아들 노르 스탈지아였다  미궁 안에서 붙잡혀있는전설의 모험가 올리비아 서번트를 만나 노르는 강력한 세 가지 스킬을 이어받는다  스킬을 자유롭게 만드는  창작  스킬을 부여할 수 있는  부여  스킬을 바꿀 수 있는  편집  하지만 스킬을 사용하기 위해서는     라는 생명력을 사용해야만 한다  욕구를 충족시켜   를 높이고  세계최강 의 스킬을 구사하라 
45,나는    만명의 목숨 위에 서 있다  기,성인,합리적인 단독 행동을 좋아하는 중학교  학년 요츠야 유스케는 어느 날 게임 같은 이세계로 전송된다  먼저 전송된 같은 반 신도우 이우 하코자키 쿠스에와 함께  번 째 플레이어가 된 그는 목숨을 건 퀘스트에 도전하게 된다  감정론을 버리고 모든 요소를 평면적으로 보고 때로는 동료의 목숨도 장기짝으로 취급하는 냉혹한 요츠야  덮쳐오는 마물  성가신 사건  그리고 암약하는 강적들로부터 파티의 전멸을 막고 이 게임을 클리어할 수 있을 것인가 
46,음란한 아오는 공부를 할 수 없어,성인,관능 소설가인 아버지에게 시달리는 여고생  호리에 아오 는 아버지에게서 벗어나 염원하던 독립 생활을 위하여  명문대인 난칸 대학의 합격을 목표로 열심히 공부 중이다   청춘  이성교제  그런거 알까보냐   하지만  그런 아오에게 학급의 인기인 리얼충 키지마가 설마하던 사랑의 고백을 하게되고  분위기를 읽지 못하는 키지마의 접근에 공부는커녕 아오의 에로 망상이 폭주한다 
47,새여동생 마왕의 계약자,성인,너 여동생이 갖고 싶다고 했었지  고교생 토죠 바사라는 아버지의 갑작스런 질문에 당황한다  아버지는 담담하게 자신의 재혼을 선언하고는 의붓동생이 된 두 명의 미소녀를 데려온다  그러나 여동생들의 정체는 마왕 후보자와 서큐버스 였는데   
48,최약무패의 신장기룡,성인, 년 전 쿠데타로 인해 멸망한 제국의 왕자  룩스는 실수로 난입하고 만 여자 기숙사 목욕탕에서 신 왕국의 공주  리즈샤르테와 만난다  리즈샤르테는 엿보기의 대가로 결투를 제안하고 룩스는 결투 끝에 기룡사 육성을 위한 여학교에 입학하게 되는데    
49,도메스틱한 그녀,성인,소설가를 지망하는 고등학생 후지이 나츠오는  교사인 타치바나 히나를 짝사랑하고 있다  어느 날 학우들에게 꾀어 미팅을 하게 되고  타치바나 루이와 만나 얼떨결에 관계를 가지게 된다  얼마 후 나츠오의 아버지가 새 엄마와 그 딸들을 집으로 데려오게 되는데 그 딸들이 히나와 루이였다 
