,titles,category,summary
63,로그 호라이즌  기,액션, 만 명의 게이머가 게임 속 세계로 소환  더 이상 게임이 아닌 세계에서 히키코모리 기질의 안경 주인공의 모험이 시작된다  약  만 명의 게이머가 끌려 들어간 온라인 게임 속 세계인  엘더테일   그 세계의 한 지역인  아키바  거리는 표면적으로는 평온한 분위기를 회복했지만  다른 한편으로는 난폭한 공기를 여전히 간직하고 있었다  그 와중에 시로에는 도움을 받었던 초보 모험가 토우야와 미노리의 감금 사실을 알게 되고        아키바 의 정세에 혐오감을 씻을 수 없게 된 시로에가 드디어 움직인다  역전의 맹자   명을 결집시켜 무법 지대가 되어버린  아키바 에  희망 을 되찾기 위하여 
64,흑집사  기,액션, 어디까지나 집사니까요   그 집사  유능  만능  이능  최강  최고   도련님의 명령을 완벽하게 수행하는 수수께끼의 집사 세바스찬  그렇다  이것이 항간에 소문 자자한 집사 코믹   집사인 자  이 정도도 못하면 되겠습니까  영국의 명문 귀족 팬텀하이브 가의 집사 세바스찬  그는 지식  교양  품위  요리  무술    모든 면에서 완벽하다  자기밖에 모르는   세 주인을 상대로 칠흑 같은 연미복을 하늘하늘 나부낀다  세계에서 가장 홍차와 어울리는 집사만화를 당신에게     
65,나루토 질풍전  기,액션,악의 화신인 망량은 그 힘이 거대해져 세계를 파멸 직전으로 까지 몰고 간다  이에 귀신의 나라 무녀는 망량을 봉인하고 육체는 늪의 나라에 영혼은 귀신의 나라에 각각 봉인해버린다  하지만   년 뒤 봉인을 풀리고 대륙은 다시 멸망의 일촉즉발의 위기에 몰리게 된다  이에 각 나라의 닌자들이 힘을 합하여 망량에 의해 조정당하는 병마용을 쳐부수게 되는데   
66,Fate stay night  Unlimited Blade Works ,액션,무대는 바다와 산에 둘러싸인 도시 후유키 시  그 도시에서 행해지는 어떠한 의식  손에 넣은 자의 소망을 이루어주는 성배를 불러내기 위해 성배에게 선택받은 일곱 명의 마술사에게는 성배가 선택한 일곱 서번트가 각각 주어진다  검사  세이버  창병  랜서  궁사  아처  기병  라이더  마술사  캐스터  암살자  어쌔신  광전사  버서커  마스터는 일곱 서번트 중 하나와 계약하여 성배를 갈구하며 최후의 한 팀이 될 때까지 싸워나간다  그것이 바로  성배전쟁  그 다섯 번째 싸움이 지금 시작되려 한다 
67,체인소 맨,액션, 체인소의 악마 포치타와 함께 데블 헌터로 사는 소년 덴지  부모가 남긴 빚을 갚기 위해  가난한 생활을 하던 중  배신을 당해 죽임을 당하고 만다  희미해지는 의식 속에서  덴지는 포치타 와 계약을 맺고  악마의 심장을 가진 자  체인소 맨 으로 되살아 난다  
68,    에이티식스   기,액션,동부 전선 제 전투구역 제  방어 부대  통칭 스피어헤드 전단  산마그놀리아 공화국으로부터 배제된 에이티식스 소년 소녀들로 구성되어있는 그들은  기아데 제국이 투입한 무인 병기  레기온 과의 가혹한 싸움에 몸을 던지고 있었다  그렇게 하나둘 숫자가 줄어가는 스페어헤드 전단에게 주어진 성공률     임무 기간 무제한의  특별 정찰 임무   그것은 실질적으로 모국으로부터 내려진 사형 선고였으나  리더인 신에이 노우젠  라이덴 슈가  세오토 릿카  앙쥬 에마  크레나 쿠쿠미라  명은 그럼에도 불구하고 계속 싸우며 앞으로 나아가는 길을 선택했다  희망이나 미래를 추구하는 것이 아니다   전장 이  그들에게 있어선 유일하게 있을 곳이었으니까  그리고 그 염원은 아이러니하게도 모르는 사이에 발을 디딘 새로운 땅에서 이루어지게 되었는데    
69, 자막  천관사복,액션,선락국 태자 출신의 사련은 등선과 폄적을 반복하다 세 번째로 선경에 오른다  허나 실수로 신관들의 금전을 파괴하여 졸지에 공덕을 쌓아 만회해야 하는 처지에 놓인다  사련은 속세에 자신을 봉양하는 이가 없으니 직접 속세에 내려가 귀신을 제거하여 공덕을 쌓기로 하고  그 곳에서 자신을 도우려 온 두 어린 신관과 붉은 옷을 입은 신비로운 소년을 만난다  네 사람은 함께 괴이한 사건들을 차례로 해결해 나가지만  그와 동시에 찬란한 광채에 가려진 선계 신관들의 어두운 과거들마저 접하게 되는데   
70,던전에서 만남을 추구하면 안 되는 걸까  ,액션,그 도시에는 수많은 신이 살고 있고  도시 중심에는 지하 깊은 곳  심연에 도달할 수 있는  던전 이 존재한다  그 도시의 이름은 미궁 도시 오라리오  여신 헤스티아와 모헙자 벨 크라넬은 언제나처럼 주신과 단 한 명의 조직원이라는 최소 구성  하지만 사상 최고의 속도로 랭크업을 한 벨은 유례가 없을 정도로 주목을 받고 있다   미궁  만남  그리고 모험  이것은 다시 쓰이기 시작한  소년이 엮고 여신이 적은  권속의 이야기  
71,노 게임 노 라이프   판권 부활,액션,인터넷에서는 도시전설이라는 이야기마저 떠도는 천재 게이머 남매  소라   와 시로       가 항상 공란인 관계로 통칭 공백이라고 불리는 이 남매는 세상을 쓰레기 게임이라고 부르며 게임 폐인으로 지내고 있었다  그런데 어느 날 자칭 신이라는 자에게 이끌려 이세계로 소환되는데  그곳은 신에 의해 전쟁이 금지되었으며 모든 것 목숨과 국경선마저도 이 게임으로 결판이 나는 세계였다  다른 종족들에게 연패를 거듭해 마지막 도시 하나만을 남겨둔 일류  소라와 시로 폐인 남매가 이세계에서는 인류의 구세주가 될 수 있을까 
72,일곱 개의 대죄   신들의 역린   기 ,액션,아직 인간과 마물의 세계가 분리되기 전의 먼 옛 이야기   천 년의 시간을 지나 부활한 마신족의 정예  십계 와의 싸움에서  일곱 대죄 는 패배했고 멜리오다스는 죽었다  다이앤  킹  고서도 행방불명된 상태에서 리오네스 왕국을 위협하는  십계 의 마수  에스카노르가 에스타롯사를 물리치지만 약세는 계속된다  그리고 엘리자베스가 궁지에 몰린 그때  압도적인 힘을 되찾은 멜리오다스가 연옥에서 부활한다   십계 의 그레이로드와 프라우드린을 물리치고 리오네스 왕국은 지켜진다  복구되는 건물들 하지만 힘을 되찾은 일로 멜리오다스는 가장 흉악한 마신으로 불렸던 시절로 역행하고 있었다  카멜롯을 근거지로 삼은  십계 의 위협은 계속된다  브리타니아를 마신족으로부터 해방하기 위해  일곱 대죄 는 재집결을 향해 움직이기 시작한다 
73,Re   제로부터 시작하는 이세계 생활 감독판,액션,편의점에 다녀오는 길에 갑자기 이 세계에 소환된 고등학생 나츠키 스바루  이것이 요새 유행하는 이세계 소환인가   그러나 소환자는 없고  강도의 습격을 받아 일찍부터 생명의 위기가 찾아온다  그런 스바루를 구원한 것은  수수께끼의 은발 미소녀 사테라와 고양이 정령이었다  은혜를 갚는다는 명목으로 잃어버린 물건을 찾는 소녀를 돕는 스바루  그러나 단서를 잡은 순간 스바루와 소녀는 누군가의 습격을 받고 목숨을 잃는데   정신을 차리고 보니 처음 소환되었던 장소에 있었다        사망귀환  무력한 소년이 얻은 힘은 죽음으로써 시간을 되감는 능력뿐  이것은 첫째 날을 반복해 미래를 개척하는  시작의 이야기 
74,불꽃 소방대  기,액션,이  나라 는 뭔가를 숨기고 있다    네더에서의 격전을 마치고 신라와 동료들은  전도자 의 야망을 알게 된다  그 목적은 특수한 불꽃  아도라 버스트 의 사용자를 모아서    년 전의 대재해를 다시 일으켜서 세계를 멸망시키는 것이었다  아도라 버스트를 가진 신라는 전도자 일행의 타깃이 되지만 그들의 책략을 깨부수기 위해 분주하게 움직인다  새로운 아도라 버스트를 가진 소녀와의 만남 그리고 계속 숨겨 온 황국의 요지  아마테라스 이 커다란 비밀  불꽃에 미치고 불꽃에 이끌린 소년은 한 발씩 진실에 가까워진다 
75,청의 엑소시스트,액션,악마 중에 악마  사탄의 피를 물려받은 소년 오쿠무라 린  린은 자신의 존재를 모르고 살다가 어느 날 갑자기 린의 앞에 아버지라며 사탄이 나타나고 그를 악마가 사는 세계  게헤나 로 끌고 가려 한다  그러자 고명한 엑소시스트인 양아버지는 린을 지키다 목숨을 잃고 마는데   자신의 무력함에 분을 느낀 린은 엑소시스트가 되어 사탄과 싸우기로 굳게 결심하고 정십자 학원에 들어가게 된다  사탄에 맞서는 사탄의 사생아 오쿠무라 린의 판타지 액션  
76,나루토 질풍전  기,액션,지라이야와 함께 수행을 떠난지  년 반정도가 흐른 후  나루토가 다시 마을로 돌아왔다  나뭇잎마을에서 같이 수행하던 동기들도 부쩍 성장하였고  모래마을의 가아라는  카제카게 가 되기도 했다  어둠의 조직 아카츠키는 비밀리에  구미  를 모으는 작업을 진행한다  아카츠키에게 이미 가아라의  미를 뺏긴 상황에서   미를 발견했다는 소식을 듣고 그를 봉인하려 하지만 이번에도 결국 아카츠키에게 빼앗기고 만다   구미 를 둘러싸고 끊임없이 아카츠키와 대적하는 나루토 일행  그 과정에서 수많은 동료를 떠나 보내며 그들 역시 성장해나간다  한편  사스케는 오로치마루를 죽인 뒤 동료를 모아 평생의 숙적인 그의 형 이타치에게 복수하기 위한 준비를 서두른다 
77,    에이티식스 ,액션,기아데 제국에서 개발한 완전 자동화 무인 전투 병기  레기온 의 공격에 대응하기 위해 그 이웃 나라인 산마그놀리아 공화국이 개발한 무인 전투 병기  저거노트   하지만  무인이라는 건 이름뿐이었고 실제로는 사람으로 인정받지 못하는 사람들 에이티식스가 탑승해 도구처럼 다뤄지고 있었다  에이티식스들로 편성된 부대  스피어헤드 의 대장인 소년 신은 그저 죽음을 기다리는 것과도 같은 절망적인 전장 속에서 어떤 목적을 위해 싸움을 계속하고 있었다  거기에 공화국 엘리트 군인인 레나가 새로운 지휘관제관  핸들러 로서 부임했다  그녀는 에이티식스들의 희생으로 성립되는 공화국 체제를 혐오하고 있었으며   인간형 돼지 로 불리며 업신여김을 당하는 그들을 인간으로서 마주 보고자 하였다  죽음과 이웃한 최전선에서 싸움을 계속하는 에이티식스 소년과 장래를 촉망받는 재능있는 엘리트 소녀  결코 서로 마주할 일 없었을 터인 두 사람이  격렬한 싸움 속에서 미래를 바라본다 
78,모브사이코      기   판권 부활,액션,평범한 삶을 꿈꾸며 청춘을 동경하는 중  소년 카게야마 시게오  통칭 모브는 스트레스 지수가    이 되면 초능력이 극대화되어 잠재되어 있던 힘이 폭발하고 만다  모브는 엄청난 초능력을 보유한 소년이었던 것이다  하지만 자기표현이 극도로 서투른 모브는 스스로 초능력을 억누르며 살아간다  스승이자 사기 영능력자인 레이겐은 모브의 초능력을 이용하여 제령을 하고 어른으로서 조언   도 아끼지 않는다  그러나 모브의 힘을 이용하려는 사람들  모브를 둘러싼 웃음과 눈물  놀라움  싸움의 나날이 펼쳐진다  
79,나루토  기,액션,나뭇잎 마을의 우즈마키 나루토는 아무도 못말리는 말썽꾸러기인데다가  닌자 졸업 시험에 연속해서 낙방한 전력이 있는 문제아  다시 돌아온 시험에서 나루토는 마지막 관문인 분신술에 실패하여 또 낙제를 하게 된다  상심한 나루토에게 닌자 선생님 중 한 명인 미즈키 선생님이 다가와 마을 뒷산에 숨겨진  봉인의 서 봉인된 책  만 있으면 시험에 쉽게 통과할 수 있다고 알려준다  그러나 나루토가 이 책을 가지러 갔다는 말에  평소 나루토를 아껴주고 힘을 북돋워주던 이루카 선생님은 급히 나루토의 뒤를 쫒는다  미즈키는 사실 마을의 천덕꾸러기로 미움을 받고 있는 나루토를 이용하여 봉인의 서를 손에 넣으려는 음모를 꾸몄던 것이다  이 일을 계기로 나루토는 미즈키로부터 자신의 정체가 구미호의 봉인체라는 충격적인 이야기를 듣는다  사람들을 닥치는대로 해하던 흉한 구미호를 전설적인 닌자인 호카게가 당시 아기였던 자신의 몸에 봉인했다는 것이다  나루토는 마음의 충격이 컸지만 자신을 위로해주는 이루카 선생님의 말씀에 감동하여 마침내 자신의 능력을 제대로 선보이고  그 결과 졸업에 성공하게 된다  하급 닌자인 견습 닌자가 된 나루토는  꽤나 실력도 인물도 출중한 사스케와 당찬 여닌자 사쿠라를 동료로 하여 새로운 선생님인 카카시를 모시게 된다  하지만 행실이 그다지 선생님으로서 모범적이지 못한 카카시는 오히려 나루토 일행에게 실력이 너무 형편없다며 구박을 일삼는다  사실 말이 동료일뿐 팀 웍이 전혀 갖추어지지 않은 나루토 일행은 개인 플레이로 인해 여러번 일을 망치곤 한다  자신들의 주어진 일에 만족하지 못하고 있는 나루토 일행에게 호카게  최고의 닌자에게 대를 물려 이어지는 이름 는 새로운 임무를 주는데   
80, 더빙  헌터X헌터 리메이크 part  ,액션, 유유백서 로 유명한 작가 토가시 요시히로의 작품  곤은 아버지 진이 유명한 헌터였다는 말을 듣고 아버지의 흔적을 찾기 위해 헌터가 되기로 결심한다  이후 곤은 헌터 시험장에서 만난 암살족의 키르아  붉은 눈의 크라피카  그리고 레오리오와 함께 힘든 시험에 도전하여 어렵게 관문을 넘게 된다  헌터카드를 가지고 집으로 돌아온 곤은 아버지가 남긴 물건을 통해 그리드 아일랜드라는 게임이 아버지와 연관있다는 것을 알게 된다  그리드 아일랜드는 사람이 직접 게임 속으로 들어가 싸우는 것으로 아버지가 만든 넨능력자 전용 게임이다  여러가지 고비 끝에 결국 그리드 아일랜드 속에 들어간 곤과 키르아  게임 속에서 온갖 경험을 한 결과 능력이 더욱 상승한 두 사람  크라피카의 복수의 대상인  붉은 여단 과의 대결이 숨가쁘게 전개되고  이제 돌연변이 곤충들의 왕국과 인류와의 전쟁이 시작된다  과연 곤의 모험은 어디까지 이어질지      숨가쁘게 전개되는 인기 소년애니 
81,알바 뛰는 마왕님 ,액션,엔테 이슬라에서 세계정복을 코앞에 두고 마왕 사탄은 용사에게 패하여 이세계  일본 도쿄  사사즈카 로 도망친다  마력도 얼마 남지 않았고  말도 안 통하고 돈도 없는 상황    결국 마왕은 좁은 단칸방을 임시 마왕성으로 삼고  역 앞 패스트푸드 점에서 알바를 하며 부활을 꿈꾸는데    한편  마왕을 쫓아 일본에 온 용사 에밀리아 또한 텔레마케터로서 일본 경제와 싸우고 있었다  그런데 어느 날  이 두 사람이 도쿄에서 재회하게 되는데    
82,던전에서 만남을 추구하면 안 되는 걸까  ,액션,미궁도시 오라리오의 중심에 자리한 던전 수많은 몬스터가 생겨나는 이 큰 동굴에는 아직 인류가 상상할 수 없는  미지 를 무수히 많이 품고 있다  여신 헤스티아와 모험자 벨 크라넬이  헤스티아 파밀리아 를 결성한 지 어느덧 수개월  몇 명의 동료들이 추가로 가입하면서 그들의 파밀리아는 급속한 성장세를 보이며 도시의 주목을 모으고 있었다  갑자기 그들의 앞에 내려온  미지  그것은 제노스라고 불리는 말을 하는 몬스터였다   미지 는 일행을 혼란으로 이끌고 상식을 파괴하여 고뇌와 갈등을 불러일으킨다  그 앞에 있는  가능성 을 깊게 감춰 버릴 만큼       격동의 오라리오에서 벨이 결단을 내릴 때가 다가온다  이것은 소년이 걷고  여신이 기록하는   파밀리아 미스    
83,월드 트리거  기,액션,인구   만 명이 살고 있는 미카도 시에 어느 날 다른 세계로 통하는 게이트가 열렸다  이차원에서 온 침략자  네이버  의 위협에 맞서  이쪽  세계를 지키기 위한 경계방위기관  보더 가 맹활약하고 있다  문이 열리고  년 뒤  아직도 네이버들의 침략은 계속 되고 있지만  보더의 활약 덕분에 도시는 안정을 찾아가고 있다  중학생이면서 보더의 일원인 미쿠모 오사무는  수수께끼의 전학생 쿠가 유마와 만난다  제멋대로인 유마의 행동에 사사건건 휘둘리고 마는 오사무의 운명은  
84,나루토 질풍전  기,액션,나루토 일행들에게 임무가 내려졌다  그 임무는  불의 나라 국경 근처의 신성지역인 토니카 마을에서 일어난 마을 사람들의 참살 사건의 범인을 찾아 응징하라  는 것이다  오랜만에 받은 임무에 들뜬 나루토  하지만 그 마을에 도착해서 본 광경은 많은 집들이 무참히 파괴된 격렬한 싸움의 흔적들  왜 이 마을은 습격 당한 것일까  그리고 이 마을을 습격한 인물은 대체 누구인 것인가 
85,도쿄 구울,액션,먹이사슬이 정점에 있는 인간  그 중에서도 가장 상위에 위치한 최정점의 존재 인간을 먹이로 삼는 그들의 이름은  구울   인간과 바로 그  구울 이 뒤섞여 사는 세상에서 대학생 카네키는 그 존재를 실감하지 못한 채 평범한 나날을 보내고 있었다  죽을 목숨이었으나 놀랍게도 살아난 카네키  그날부터 그는  반 인간  반 구울  상태의 돌연변이가 되어 인간의 날고기 외에는 식욕을 느끼지 못하고 모두 토해버리는 끔찍한 괴물이 되어버리는데    청년이 괴인과 다시 만났을 때  기구한 운명의 수레바퀴가 돌기 시작한다   이제 인간을 먹지 않고선 살아갈 수가 없다   평범한 대학생에서 구울로 다시 태어난 카네키 켄  인간과 구울이라는 절대 교차할 수 없는 관계  고뇌하는 청년의 숙명이 지금 시작된다   
86,회복술사의 재시작,액션, 치유 의 용사로서 각성해서 다른 용사들과 세계를 구하기 위해 모험을 떠난 소년 케얄  하지만 전투능력이 없는 회복술사에게는 용사들에게 능력을 착취당하고 학대받는 나날이 기다리고 있었다  자유과 존엄을 빼앗기고 자아조차도 잃어가던 케얄은 어느 날  제정신을 되찾고  힐 의 진실을 깨닫는다   힐 은 단순한 치유가 아니다   힐 은 세계를  인간을 근원에서부터 뒤흔들 수 있는 힘이다  라고  케얄은 세계 그 자체에  힐 을 사용해서  년 전으로 모든 것을  재시작 할 것을 결심한다  그리고 용사들에게 복수할 생각에 가슴 설레는데        자  파티 복수 의 시작이다    
87, 더빙  원피스   기,액션,심해  만 미터에 있는 해저의 낙원인  어인섬 에 도착한 밀짚모자 일당은 섬을 다스리는  용궁왕국 의 왕인 넵튠의 초대를 받는다  왕궁에서 루피가 만난 시라호시 공주는 그녀를 노리는 해적 반더 덱켄  세로부터 몸을 지키기 위해 연금 상태에 놓여 있었다  한편  호디 존스가 이끄는  신어인해적단 이 덱켄 일당과 손잡고 용궁왕국의 붕괴를 노리며 움직이기 시작한다  신어인해적단은 예전에 루피가 쓰러뜨린 어인 해적 아론의 뜻을 이어받아 인간들에게 복수하기로 마음먹었다  호디는 인간과 친해지기를 바라는 사람을 제거하기 위해 왕국을 탈취하여 왕이 되겠다고 선언한다  루피는 정상전쟁에서 함께 싸운 전 칠무해 징베를 다시 만나서  오랜 세월에 걸쳐 어인섬에 뿌리내린 차별의 역사를 알게 된다  그리고 징베의 부탁을 받아 어인섬의 위기를 구하기 위해 신어인해적단과 대결한다  어인섬의 위기를 구한 루피 일행은 어인섬을 출항하여 마침내  위대한 항로  후반의 바다인  신세계 에 돌입한다 
88,이세계 미궁에서 하렘을,액션,어느 날  이 세상에 절망하고 있던  카가 미치오 가 발견한 것은 이상한 인터넷 게임  게임에 적혀 있던  이 세상이 살기 힘들다면 이세계에서 살면 된다  라는 말에 이끌려  설정이나 캐릭터 메이크업을 마친 미치오를 기다리고 있던 것은 현실과 다른 진짜 이세계 였다  다양한 스킬  무기  마법 그리고 미궁에 마치 게임 같은 이세계를 무대로  자신의 스테이터스를 자유롭게 재설정할 수 있는 힘을 구사하며 미치오의 모험이 막을 연다 
89,전생했더니 슬라임이었던 건에 대하여   전생슬라임 일기,액션,멋진 슬라임 인생   귀한 종이가 손에 들어와서 나의 지금까지를 일기로 쓰기로 했다  서두는 이렇게 할까     전생했더니 슬라임이었다   거기서부터 내 모험이  모험  이   장난기가 많고 유머러스한 리무루와 템페스트에 살고 있는 동료 마물들의 일상을 아낌없이 그려낸  슬라임 계열  전생 엔터테인먼트 
90, 더빙  헌터X헌터 리메이크 part  ,액션, 유유백서 로 유명한 작가 토가시 요시히로의 작품  곤은 아버지 진이 유명한 헌터였다는 말을 듣고 아버지의 흔적을 찾기 위해 헌터가 되기로 결심한다  이후 곤은 헌터 시험장에서 만난 암살족의 키르아  붉은 눈의 크라피카  그리고 레오리오와 함께 힘든 시험에 도전하여 어렵게 관문을 넘게 된다  헌터카드를 가지고 집으로 돌아온 곤은 아버지가 남긴 물건을 통해 그리드 아일랜드라는 게임이 아버지와 연관있다는 것을 알게 된다  그리드 아일랜드는 사람이 직접 게임 속으로 들어가 싸우는 것으로 아버지가 만든 넨능력자 전용 게임이다  여러가지 고비 끝에 결국 그리드 아일랜드 속에 들어간 곤과 키르아  게임 속에서 온갖 경험을 한 결과 능력이 더욱 상승한 두 사람  크라피카의 복수의 대상인  붉은 여단 과의 대결이 숨가쁘게 전개되고  이제 돌연변이 곤충들의 왕국과 인류와의 전쟁이 시작된다  과연 곤의 모험은 어디까지 이어질지      숨가쁘게 전개되는 인기 소년애니 
91,종말의 세라프,액션,어느 날 갑자기  미지의 바이러스에 의해 세계는 멸망했다  살아남은 것은 아이들뿐  그리고 그 아이들은 지하에서 나타난 흡혈귀들에게 지배당하게 된다  하쿠야 유우이치로우는 가족과 같은 하쿠야 미카엘라와 함께 흡혈귀에게 피를 바쳐 살고 있다  가축 같은 취급에 견디지 못한 유우이치로우는 미카엘라와 다른 고아들과 함께 바깥 세상으로 탈출하려 하는데   년 후  하쿠야 유우이치로우는 일본제귀군 흡혈귀 섬멸부대  월귀조 에 입대  스스로 무시무시한 흡혈귀들과의 전쟁에 몸을 던진다 
92,고블린 슬레이어,액션,난 세상을 구하지 않는다  고블린을 죽일 뿐이다  변경의 한 길드에는 고블린 토벌만으로도 은 등급 모험가 등급  위 까지 오른 엄청난 존재가 있다  모험자가 되어 처음으로 파티에 참여해 고블린 퇴치에 나섰다가 위기에 처한 여신관  그리고 그것을 구한 자가 바로 고블린 슬레이어라 불리는 남자였다  그 남자는 고블린 슬레이어라는 이름만큼 수단을 가리지 않고 계속해서 고블린만을 퇴치했다  그 고블린 슬레이어에게 휘둘리는 여신관  감사해하는 접수원  그를 기다리는 소꿉친구인 소치기 소녀  그리고 고블린 슬레이어의 소문을 들은 한 엘프가 어느 의뢰를 하기 위해 나타났다 
