,titles,category,summary
87, 더빙  다이노코어 시즌  ,아동,다크로를 뛰어넘는 새로운 적 비토의 등장으로 새로운 메카다이노와 홀로 전투를 벌이는 렉스에게 새로운 친구들이 찾아온다 
88,바다 탐험대 옥토넛 시즌   바다 괴물 대소동,아동,    개복치              거대한 물고기 머리와 충돌했다며 부상당한 동물들이 몰려오자 바나클은 콰지와 페이소에게 조사를 명령하고  둘은 얼마 후 괴상하게 생긴 물고기  개복치를 만나게 된다  몸에 기생충이 들끓어 괴로워하던 개복치는 옥토넛의 도움을 받게 되는데     실러캔스                 오래된 해저 동굴로 화석탐사를 나갔던 바나클과 대원들은 백악기에 멸종한 실러캔스의 화석을 발견하지만 곧 사라져버리자 범인을 찾기 위해 동굴수색을 시작한다  하지만 범인은 다름 아닌 멸종된 걸로 알려졌던 실러캔스였는데      심해벌레  그린 바머                    옥토넛 심해 연구실에 전기가 나가자 바나클과 콰지  페이소는 새 전선을 갖고 연구실로 향한다  하지만 도중에 초록색 조명탄을 던지는 신기한 벌레  그린 바머들을 만나게 되고 부상으로 해구 바닥으로 떨어진 그린 바머  지미를 찾는 일을 돕게 되는데      켈프 괴물의 정체                            아기 달팽이들이 없어졌다며 엄마 달팽이가 도움을 청하러 오자  바나클과 대원들은 급히 켈프 숲으로 출동하고  마침 놀러 와있던 대쉬의 동생 코쉬도 함께 동행한다  추리소설을 좋아해 탐정놀이에 흠뻑 빠진 코쉬는 켈프 숲에 나타났었다는 수수께끼 괴물의 정체를 밝히려 단서들을 따라가기 시작하는데      긴부리돌고래                        바다로 쓰레기 더미가 몰려오자 바나클과 대원들은 동물들을 대피시키기 시작한다  하지만 긴부리 돌고래 무리는 바나클의 얘길 들으려고도 하지 않고 거기다 모두 낮잠에 빠지자 바나클은 고민에 빠지는데        외로운 혹등고래                        신체적인 문제로 다른 혹등고래들처럼 노래할 수 없던 조는 먹이가 있는 곳으로 이동하는 무리에 끼지 못해 외로움과 배고픔에 슬픈 노래를 부른다  이상한 노래 소리를 듣고 조사를 나갔던 대원들은 조를 옥토포드로 데려와 도울 방법을 고민하는데 
89,변신뭉치 모리,아동,평범한 초등학생  학년 김시후는 어느 날 아침 수상한 털실뭉치가 자신의 머리에 붙어 있는 것을 발견한다  머리에서 떼어내려고 발버둥치다가 옷에서 떨어진 버튼이 그 털실뭉치에 닿자 놀랍게도 변신을 하는데    이 신기한 털실뭉치의 이름은 바로 모리  털실로 된 모리는 무엇이든 변신할 수 있는 능력을 가졌다  잔잔했던 시후의 일상은 변신뭉치 모리와 함께하면 언제나 변화무쌍   시후가 만약 곤란한 일을 당한다면   케케케  내가 나설 차례 모리  
90, 더빙  출동  슈퍼윙스 시즌  ,아동,슈퍼펫과 함께 떠나는 랜선 여행  슈퍼윙스가 슈퍼펫 친구들과 함께 돌아왔습니다  작고 귀엽지만 멋진 아이템으로 변신하는 슈퍼펫  슈퍼펫의 도움으로 슈퍼윙스가 더욱 강력한 활약을 선보입니다  슈퍼스타 슈퍼윙스 써니  하늘을 나는 자동차 레오 그리고 미워할 수 없는 말썽꾸러기 악당 골든보이까지 모두 함께 출동 준비 완료  
91, 더빙  겨울왕국의 무민,아동,따스한 여름이 지나고 겨울이 찾아온 무민 골짜기  밤나무와 열매 그리고 나뭇잎 향기까지  무민이 좋아했던 모든 것을 꽁꽁 얼려버린 겨울은 무민이 가장 소중하게 생각했던 해님까지 몰래 숨겨버린다 해님을 기다리던 무민은 오랜 고민 끝에 직접 해님을 찾기로 하고  친구 투티키와 특별한 도전에 나서는데 
92,앵그리버드 툰즈 시즌  ,아동,피기섬에 새해가 찾아왔습니다  그리고 새들과 돼지의 투쟁은 계속됩니다  앵그리버드 툰즈 시즌 에서 확인해보세요 
93,쿵푸 공룡 수호대,아동,천만 년 전에 세상을 지배하고자 한 악당 스코는 빙하기를 대비하여 자신의 돌연변이 공룡 군대의 파워를 수정에 봉인 한 후 적당한 시기가 오면 자신만이 찾을 수 있도록 안전한 곳에 묻어 둔다  하지만 스코도 예측 못한 것이 있었으니 빙하기의 위력이 너무 강했다는 것이다  빙하기를 거치면서 지구의 지질 구조가 변해 버리고  스코가 숨겨둔 수정들도 여기저기 흩어지게 된다  현대에 이르러 얼음 속에서 깨어난 스코는  자신이 이루고자 했던 지구 정복을 위해 수정들을 찾아 봉인을 풀려고 한다  천만 년 전에 스코에게 유일하게 맞선 쿵푸 공룡 수호대는 더욱 강력해진 스코에게 맞서기 위해 인간들의 무술인 쿵푸를 익힌 채 새롭게 태어난다  이제 새로운 영웅이 탄생하게 되니  그 이름은 쿵푸 공룡 수호대이다  과연  쿵푸 공룡 수호대는 스코의 야망을 꺾고 지구의 평화를 지킬 것인가 
94,디보  분쇼   한국어,아동,디보와 친구들의 재미있는 짧은 이야기
95,두리둥실 뭉게공항 시즌  ,아동,윙키  날개학교에 가다    세계일주의 커다란 꿈을 가진 꼬마 비행기 윙키는 뭉게공항에서의 생활도 익숙해지고 본격적인 세계일주를 위한 준비에 들어간다  하지만  아직도 부족한 것이 많다는 것을 깨달은 윙키는 애니의 소개로 로키선생님이 운영하는 날개학교를 다니게 된다  그곳에서 만난  썬더  펠리코  켈리라는 친구들과 함께 때로는 옥신각신 하기도 하고 때로는 함께 협력하면서 비행에 대해 더욱 새로운 사실을 배우며 우정을 쌓아 나간다  시즌 보다 훨씬 박력 있고 개성 있는 캐릭터들의 등장으로 더욱 재밌어진  두리둥실 뭉게공항 을 기대해주세요   
96, 더빙  아기공룡 버디 시즌  ,아동,프테라노돈 가족인 타이니  샤이니  돈  막내 티렉스 버디는 엄마와 아빠와 함께 공룡 기차를 타고 중생대 시대를 여행해요  공룡 기차 차장님의 친절한 안내를 받으며 재미있는 장소를 찾아 다니고  새로운 친구들을 만나요  버디는 새 친구를 만날 때마다 항상 자신과 비교해본답니다  최첨단 공룡 기차 산업 덕분에 프테라노돈 가족은 공룡 기차뿐만 아니라 로켓 기차  태양열 기차  잠수함 기차  체펠린 비행선 기차까지 타고 바닷속과 하늘까지도 여행을 다닐 수 있답니다  공룡과 어류  양서류  포유류 등 온갖 생물들에 대해 많은 것을 배우는 프테라노돈 가족의 선사 시대 여행이 재미있게 펼쳐집니다 
97, 더빙  내 친구 코리리,아동,다섯 살 다래를 찾아온 한국의 공룡 코리리   그리고 함께 지내는 공룡 친구들의 좌충우돌 적응기  어느 날  다래네 마을에 나타난 공룡 친구들  이제 막 세상을 배워가는 유치원생 다래와 늘 함께하는 코리리는 늘  다래야  노올자  하며 랜덤으로 들이닥치는 공룡들을 맞이해 함께 놀이를 즐기기도 하고  공룡들이 모르는 예절을 가르치기도 하고  일상을 공유하며 즐거운 하루하루를 보낸다 
98,모여라  고마짱 시즌  ,아동,집에서 여유롭게 뒹굴거리고 있는 고마  그런데 숙제하는 장수도  청소하는 엄마도 화장실에 있는 아빠도 모두 딴 데로 가라고 말한다  고마가 자신만의 방이 있는 헤엄이를 부러워한다는 걸 눈치 챈 장수는 사과 상자로 고마의 방을 만들어 주는데   
99,신밧드    하늘을 나는 공주와 비밀의 섬,아동,신밧드는 어린시절 바다에서 아버지를 잃고  엄마와 원숭이 미미와 함께 바닷가 근처에서 사는 소년이다  이런 신밧드는 어릴적 바다에서 아버지를 잃었지만 언제나 바다 건너편의 미지의 세계를 동경해왔다  그러던 차에 바하르 호 선원 알리와 만나게 된 신밧드는 알리와 함께 우연히 신기한 목설이를 줍게 되고  이에 목마를 탄 소녀 사나가 하늘에 나타난다  사나가 악당에게 쫒긴다는 것을 눈치챈 신밧드는 악당으로부터 사나를 도망치게 하기위해 노력한다  이런 모습을 본 바하르 호의 선장 라자크의 도움으로 신밧드는 바다로 나갈 기회를 얻게 되는데           
100, 더빙  다이노코어 시즌  ,아동,다크로를 뛰어넘는 새로운 적 비토의 등장으로 새로운 메카다이노와 홀로 전투를 벌이는 렉스에게 새로운 친구들이 찾아온다 
101,두리둥실 뭉게공항 시즌  ,아동,윙키  뭉게공항의 정식 비행기가 되다  세계를 여행하려면 더 많은 것을 배워야 한단다  이제는 뭉게공항이 네 학교가 될 거야  드디어  뭉게공항에서 정식노선을 갖고 취항을 하게 된 윙키  날개학교에서 배운 것을 활용하며  뭉게공항 친구들과 공항에서 많은 일을 하게 된다  그러면서 세계일주의 꿈을 향해 한걸음 더 다가가게 되는 윙키의 이야기와 아직 못 다한 비행기와 공항의 이야기가 시즌 를 통해 그려집니다 
102, 더빙  터닝메카드W 메카니멀 고,아동,메카니멀  에반 은 트라이포스에서 지구로 전송되는 과정에서 동생  타나토스 를 잃어버리고 만다  행방불명된 동생을 애타게 찾던 중 에반은 주인공  찬 과 우연히 만나고  찬은 에반을 도와 타나토스를 함께 찾기로 한다  그리고 우여곡절 끝에 에반은 마침내 타나토스와 재회하지만  타나토스는 블랙미러의  반다인 에게 세뇌 당한 탓에 형을 알아보지 못한다  찬과 에반은 타나토스와 몇 차례 배틀을 벌이며 타나토스를 원래의 모습으로 되돌리기 위해 노력한다  그리고 타나토스와의 마지막 배틀에서 찬과 에반은 멋진 호흡을 선보이며 결국 승리를 거머쥐고  이로써 타나토스의 세뇌도 풀리게 된다 
103,출동  애니멀 레스큐 part  ,아동,개발을 위해 환경파괴를 일삼는 브라이트만의 야욕 때문에 많은 동물과 식물들이 살아갈 곳을 잃고 있다  브라이트만의 수하인 연구원 삼인방에게 잡힌 로디는 같이 갇혀있던 화이트와 함께 우주의 에너지가 담긴 블루아이를 훔쳐서 탈출한다  도망 다니다가 갈 곳 없는 동물을 보살펴주는 동물보호소에 정착하게 되고 그곳 지하에 화이트가 비밀기지를 만들고 로디를 필두로 타샤와 베니를 끌어모으고 동물보호소의 딸인 진이 합류하면서 애니멀 레스큐가 결성된다  애니멀 레스큐는 전 세계를 돌아다니며 위기에 처한 동물을 도우며 브라이트만에 맞선다 
104,요괴워치 ,아동,요괴워치의 다섯 번째 애니메이션
105, 더빙  GO 아스트로 보이 Go ,아동,과학 분야 전반에 지식을 두루 갖춘 과학자 유식한 교수의 인공지능 로봇 발명으로 탄생한 아스트로 보이  여러 가지 슈퍼파워를 가지고 있고  정의감과 배려심이 넘쳐나 친구들 사이에서 믿음직한 리더로 지구에서 일어나는 어떤 임무도 해결해 나간다 
106,바다 탐험대 옥토넛 시즌   늪지탐험선K,아동,    습지 대탐험                          트윅의 아빠  레인저 마쉬의 구조요청 신호를 받은 옥토넛  바나클과 대원들은 새 습지 탐험선  를 타고 즉시 플로리다의 습지 공원  에버글레이즈로 향하고  그곳에서 레인저 마쉬를 도와 외래종 동물들을 찾아 구조하는 일을 시작하는데      민물가재                늪지에 구조활동을 나갔던 페이소  대쉬  셸링턴은 마을의 민물가재들이 모두 등에 반점이 생기고 몸이 가려운 피부병에 걸렸다는 사실을 알게 되고 급히 옥토경보를 울린다  출동한 바나클은 대원들에게 작전을 지시하고 최초 감염자를 찾아 나서는데      아기 악어                  늪지에서 우연히 탐험선에 따라온 아기 악어는 옥토포드가 신기해 이것저것을 누르다 해치를 열고 바다로 나가게 된다  아기 악어를 따라나간 콰지는 함께 해류에 휩쓸리고  어딘지 알 수 없는 곳으로 떠내려가는데      춤추는 플라밍고                 우연히 아기 플라밍고 필을 따라가게 된 바나클과 대원들은 아름다운 플라밍고 춤을 보게 된다  유난히 춤을 못 춰 고민하던 필은 혼자 연습을 하면서 습지 깊은 곳으로 향하고  아기가 사라져 엄마 플로가 사색이 되자 대원들은 필을 찾아 습지로 가는데 
107,팩맨과 유령의 모험 시즌  ,아동,수십 년 전  스페로스의 동생 비트레이어스는 강력한 군대를 이끌고 팩월드를 점령하려 든다  그 전쟁으로 수많은 생명이 희생됐는데  노란색 존재 중 유일한 생존자인 팩이 팩월드를 구하는 이야기
108, 더빙  요괴메카드 왕마,아동,교장 선생님은 우주의 문을 통해 떨어진 요괴들이 강력한 것 같다면서 이소벨  반다인  리안에게 조사를 요청한다  나찬도 함께 하겠다고 나서지만 교장선생님은 나찬이 경험이 부족하기 때문에 나서지 말라고 명령한다  교장선생님의 명령에도 불구하고 나찬은 기운찬  공주희와 함께 요괴를 잡기로 한다  각자 이천숭이  미스터문  양피곤을 불러내 개천에 숨은 요괴를 끌어내는데    엄청 큰 얼음요괴가 나타난다  얼음요괴의 이름은 아이시령  본래 얼음 조각상이었지만 사랑을 하면서 녹아버려 요괴가 됐다고 한다  그래서 사랑하는 사람들을 모두 얼려버리겠다고 한다  크기만큼이나 강력한 추위 공격을 하는 아이시령에게 세사람은 지게되고 아이시령은 요괴볼이 되버린 이천숭이를 가지고 사라진다  이에 나찬은 망연자실하게 되는데   
109, 더빙  내 친구 호비 part  ,아동,긍정적이며 활발한 성격을 가진 호비  호비는 호기심이 왕성하고 정의감이 넘쳐나 친구들이 힘든 일을 겪을 때면 나서서 도움을 준다  베니  페로  냥이 등의 친구들과 함께 챌린지 섬의 곳곳에서 벌어지는 호비의 신나는 모험 이야기가 펼쳐진다 
110, 더빙  내 친구 호비 part  ,아동,긍정적이며 활발한 성격을 가진 호비  호비는 호기심이 왕성하고 정의감이 넘쳐나 친구들이 힘든 일을 겪을 때면 나서서 도움을 준다  베니  페로  냥이 등의 친구들과 함께 챌린지 섬의 곳곳에서 벌어지는 호비의 신나는 모험 이야기가 펼쳐진다 
111,앵그리버드 툰즈 시즌  ,아동,피기섬에 새해가 찾아왔습니다  그리고 새들과 돼지의 투쟁은 계속됩니다  앵그리버드 툰즈 시즌  에서 확인해보세요 
112,바다 탐험대 옥토넛 시즌   빙하탐험선S,아동,    아기 바다코끼리                   조카들이 옥토포드에 놀러 오자 바나클은 새로운 스카우트 배지에 도전하라며 유빙 장애물 코스로 아이들을 데려간다  하지만 멀리서 들려오는 아기 바다코끼리들 울음소릴 들은 바나클과 아이들은 아기들을 구하러 얼음을 건너가지만 거대한 빙산이 다가오면서 위험에 빠지는데        비밀 호수                   남극대륙으로 탐험을 나갔던 바나클  콰지  페이소  셸링턴은 두꺼운 얼음 속에 수백만 년이나 숨겨져 있던 붉은 호수를 발견하지만 녹으로 가득한 호수를 본 셸링턴은 생물이 살 수 없을 거라며 실망한다  하지만 모두 잠든 밤  현미경 안에서 작은 미생물이 말을 걸어오는데        얼음 협곡 탐험                         북극의 북극곰 스카우트 구조본부 통신을 연결하기 위해 바나클은 트랙이 담당하고 있는 구조본부를 찾고  그곳에서 남극에서 온 구조신호를 듣게 된다  신호를 보내는 곳은 오랫동안 버려져 있던 연구시설  바나클과 대원들은 신호를 보낸 동물을 찾기 위해 급히 남극으로 향하는데        황제펭귄                        셸링턴이 낫퀵 교수와 함께 알을 품은 아빠 펭귄들을 돌볼 동안 엄마 황제펭귄들의 먹이사냥을 관찰하러 떠났던 바나클과 대쉬는 처음 먹이 사냥을 나온 펄디타가 바다에서 부상을 당하자 펄디타를 가족에게 데려다 주기 위해 사나운 눈 폭풍을 뚫고 가는데   
113,좀비덤 시즌  ,아동,세상은 좀비들이 휩쓸고 지나간 상태  마을은 폐허가 되어 인적이 사라진 텅빈 공간이 되어버렸다  어두운 거리에 달이 뜨면 성격도  능력도  가치관도 다르지만 서로의 모자람으로 똘똘 뭉친 꼬마 좀비 악동들만         에서 활개를 치고 다닌다  하지만 모자란 머리 때문에 늘 발생하는 사건 사고들  거기에 좀비 악동들 앞에 마지막 남은 인간 아이가 나타나면서부터 악동들의 모자람은 배가 되고 그로 인한 좌충우돌이 점점 더 많아진다  머리가 나빠 몸이 고생하지만 마음만은 모자람이 없는 악동들의 슬랩스틱 시츄에이션 코미디가 오늘도         에서 펼쳐진다 
114, 더빙  헬로 카봇 스페셜   펜타스톰,아동,자연을 이용한  라인의 음모에 대적하는 차탄과 카봇들  과연  차탄과 카봇들은  라인의 음모를 막아 낼 수 있을까  차탄과 그의 비밀친구 카봇들의 특별하고 신나는 일상이 시작된다 
115,폭풍우 치는 밤에   비밀 친구,아동,어느 폭풍우가 치는 밤  염소 메이는 비를 피하기 위해 한 오두막에 들어가게 된다  그런데 그곳에는 늑대 가브가 미리 와있었다  둘은 엄마를 어렸을 때 잃은 슬픔과 천둥을 무서워하는 공통점으로 인해 빨리 친해지게 된다  그렇게 둘은 많은 대화를 나누고 다음 만남을 기약하며 헤어지게 된다  그런데 둘은 약속장소에서 서로의 모습을 보고 깜짝놀라게 된다  하지만 둘은 우정을 지키기로 약속한다  하지만 시간이 지날수록 둘은 각자의 무리에서 의심을 받게 되고 서로를 배신하라는 압박을 받게 된다  가브와 메이의 우정은 계속 이어질 수 있을까 
116, 더빙  똘똘이 그림동요 시즌  ,아동,하루도 조용할 날 없는 똘똘이  오늘은 또 무슨 일이 있었을까  똘똘이의 그림일기를 보며 오늘 하루 무슨 일이 일어났는지 노래와 이야기로 확인 해보자 
117,앵그리버드 피기테일즈 시즌  ,아동,짖궂은 졸병 돼지들의 삶  또 문제를 해결하기엔 한계가 있는 지혜  피기테일즈에서는 한번도 본 적 없는 우리의 초록색 돼지들의 삶을 살펴 보실 수 있습니다 
118,헬로 코코몽  기,아동,채소와 과일을 먹으면 힘이 나는 로보콩과 함께 돌아온 우리 친구  코코몽  더 신 나고 더 재미있어진 싱싱 놀이터와 영양 만점의 싱싱한 채소들이 가득한 싱싱 농장에서 오늘도 즐겁게 뛰어노는 코코몽과 친구들  하지만 지구 온난화 때문에 생겨난 세균킹과 그 부하들은 코코몽과 싱싱마을 친구들의 그릇된 식습관을 이용해  싱싱에너지를 떨어뜨리고  싱싱마을을 빼앗을 계략을 꾸미는데  코코몽과 친구들이 싱싱마을을 지켜내고  올바른 식습관을 가질 수 있을까 
119, 더빙  아기상어 올리와 윌리엄 스폐셜 단편,아동,귀여운건 못 참아  아기상어 올리와 윌리엄이 선물하는 짧지만 강력한 웃음 한 방 
120, 더빙  레이튼 교수와 영원한 디바,아동,고교학자 레이튼 교수 연구실에 한 통의 편지가 도착한다   영원한 생명 을 손에 넣은 소녀가 나타났다는 불가사의한 내용  레이튼 교수와 루크  레미는 사건을 풀기 위해 크라운 페토네 극장으로 떠나는데   영원한 목숨 을 둘러싼 수수께끼 게임은 풀릴 수 있을 것인가 
121, 더빙  내 친구 호비 part  ,아동,긍정적이며 활발한 성격을 가진 호비  호비는 호기심이 왕성하고 정의감이 넘쳐나 친구들이 힘든 일을 겪을 때면 나서서 도움을 준다  베니  페로  냥이 등의 친구들과 함께 챌린지 섬의 곳곳에서 벌어지는 호비의 신나는 모험 이야기가 펼쳐진다 
122, 더빙  헬로 카봇 쿵 스페셜   알카봇과 동물 친구들,아동,새로운 알카봇과 귀여운 동물들이 펼치는 흥미진진한 이야기      년에도 알카봇의 활약은 멈추지 않는다 
123, 자막  치에리와 체리,아동,상상력이 뛰어난 소녀  치에리 는  년 전 아빠를 여의고 상상 속의 친구  체리 와 꼭 붙어 지낸다  아빠의 기일을 맞아 할머니 댁에 온 치에리는 홀로 집안 이곳저곳을 구경하고  새로운 친구들과 뜻밖의 추억을 만들게 된다
124, 더빙  내 친구 호비 part  ,아동,긍정적이며 활발한 성격을 가진 호비  호비는 호기심이 왕성하고 정의감이 넘쳐나 친구들이 힘든 일을 겪을 때면 나서서 도움을 준다  베니  페로  냥이 등의 친구들과 함께 챌린지 섬의 곳곳에서 벌어지는 호비의 신나는 모험 이야기가 펼쳐진다 
125, 더빙  벅스봇 이그니션 part  ,아동,어느 날 원인 불명의 바이러스가 숲에 퍼진다  숲을 치료하려는 장수풍뎅이족과 불태우려는 사슴벌레족은 전쟁을 하게 되고  전쟁에서 이기기 위해 인간들과 벅스 버디 계약을 맺는다  벅스 버디와 함께 숲의 에너지인  에코라 가 결정화된 코인을 사용하며 듀얼을 하는 벅스봇들  곤충의 힘인 버그 코인   대 원소의 힘인 엘리멘탈 코인  정령을 소환하는 스피릿 카이저 서먼 코인의 스킬을 사용해 배틀 필드에서 싸운다 
126, 더빙  토마스와 친구들   용감한 기관차와 괴물소동,아동,토마스는 지선이 수리되는 동안 점토 채취장에서 일하게 되는데  폭풍우가 몰아치고 번개가 번쩍이자 무너져내린 절벽 위에서 거대한 발자국을 보게 된다  하지만 토마스는 산사태 때문에 그 발자국에 대해 자세히 알아보지 못한 채로  개구쟁이 빌과벤에게 구출된다  자신이 목격한 거대한 발자국에 대하여 토마스는 친구 퍼시에게 이야기하고  이 이야기를 들은 퍼시는 소도어섬에 괴물이 살 거라고 굳게 믿게 된다  그리하여 퍼시는 괴물이 무서워서 야간우편열차조차 못 끌게 되고  괴상하게 생긴 기관차 게이터를 마주치자 괴물이라고 오해한다  제임스는 이런 퍼시를 놀리고 심지어는 골려주기까지 하지만  새로운 기관차 게이터는 퍼시에게 좋은 친구가 되어주고 진정한 용기란 무엇인지 알려준다 
127,앵그리버드 블루스,아동,난폭한 방식으로 임무를 완수하고 때론 우스꽝스럽게 실패하기도 하는 진정한 무법자 파랑새 세쌍둥이를 만나보세요 
128, 더빙  내 친구 호비 part  ,아동,긍정적이며 활발한 성격을 가진 호비  호비는 호기심이 왕성하고 정의감이 넘쳐나 친구들이 힘든 일을 겪을 때면 나서서 도움을 준다  베니  페로  냥이 등의 친구들과 함께 챌린지 섬의 곳곳에서 벌어지는 호비의 신나는 모험 이야기가 펼쳐진다 
129,쥬라기캅스 쥬라킹,아동,완전체로 부활한 데스바리안에서 패한 쥬라기캅스는 이전의 모습을 잃고 작은 모습으로 간신히 살아남는다  이후 데스바리안과의 대결에서 고전하던 쥬라기캅스는 공찬과의 우정  그리고 사명감으로 새로운 힘을 얻게 되고 거대한 로봇 쥬라킹으로 합체한다  한편 지구 곳곳에 흩어져 있는 오파츠를 통해 자신의 힘을 극대화하려는 데스바리안을 물리치기 위해 쥬라킹은 엄청난 능력을 가진 무기를 소환해 데스바리안에 맞선다  마지막 오파츠가 숨겨져 있는 달을 향해 돌진하는 데스바리안으로부터 쥬라킹은 과연 지구를 지켜낼 수 있을까  
130,써니버니 시즌  ,아동, 언어가 없는 특별한 애니메이션입니다  써니버니는 터보  빅부  샤이니  아이리스  호퍼라는 이름의 푹신한 빛의  개 공으로  빛이 있는 곳이면 어디든지 나타날 수 있다  토끼들은 항상 기쁨과 행복을 가져다 주며  새롭고 흥미로운 장소를 탐험하기 위해 내려가며  재미있고 장난스러운 게임을 즐긴다  모두 아이들이 쉽게 인식하고 사랑하게 될 수 있는 뚜렷한 특징을 가지고 있다  써니 버니는 재미  우정  발견  협동에 대한 모든 것이다 
