,titles,category,summary
38,이시다 히로야스 X 아라이 요지로 특별전,아동,  후미코의 고백 첫사랑의 고백은 슬프고도 아름다운 것   하지만  눈깜짝할 사이  시원하게 까이고   마는 여학생 후미코는 너무나 부끄럽다  창피한 마음을 울부짖으며  그녀는 더욱 뜨겁게 앞으로 앞으로 향한다    비오는 마을  밖은 위험한 곳이야  얼른 집으로 돌아와야 해   엄마의 배웅을 받고 노란 비옷을 입은 소녀는  혼자 집 밖 세상을 구경하려 합니다  오직 빗소리만이 들리던 도시에서  우연히 만난 고철 로봇과 함께 그녀의 특별한 추억이 다시 떠오릅니다    태양소년 이슬소녀  너를 다시 만날 수 있다면  나는 어디든 갈 수 있어  히나타는 같은 반 여학생 시구레를 짝사랑한다  그림 그리기를 좋아하는 히나타  새 그림으로 시구레와 친해지지만 곧  그녀는 먼 나라로 이민을 떠날 것이다  내성적인 히나타는 시구레에게 마음을 전달할 수 있을까  그의 첫사랑이 하늘로 날아오른다    태풍의 노루다  폭풍 속으로  너에게 빠져든다  문화제 전날인 어느 중학교  좋아하던 야구를 그만 두겠다고 하는 친구 아즈마와 싸운 사이조  그들 앞에 갑자기 붉은 눈의 수상한 소녀  노루다 가 나타나는데    그때  관측사상 역대 최대의 태풍이 학교를 덮치려 하고 있었다 
39,마인크래프트 이야기,아동,블록이 살아 움직이는 마인크래프 세계  주인공 스티브는 알렉스와 펌킨을 만나 새로운 여행을 떠나게 됩니다  마인크래프트 세계에서는 어떤 신기한 일들이 기다리고 있을까요  그럼  스티브와 함께 마인크래프트 세계로 떠나볼까요 
40, 더빙  시노스톤 프라임,아동,꿈을 가진 아이들이 세상의 지혜를 깨우치며 진정한 영웅으로 거듭나는 성장 드라마  봉과 친구들은 비밀기지에서 생활하며 세계 어딘가에서 사건이 터지면 출동한다  곳곳에서 터지는 테이커들의 사건  이에 맞서는 마스터들과 시노스톤의 새로운 힘  임무를 수행하며 세상의 지혜를 깨우치고 지켜나가는 새로운 모험이 시작된다 
41,스푸키즈 시즌  ,아동,인기척이 사라진 깊은 밤의 초등학교  학교 곳곳에 숨어있던 스푸키즈가 하나  둘씩 모이고 그들만의 수업을 시작한다 
42,극장판 열차 변형 로봇 신카리온 THE ANIMATION   미래에서 온 초고속 ALFA X,아동,어느 날  지구 침략을 꾸미는 나하네  오하네프  의문의 거대 괴물이 나타난다  그들의 습격으로 행방불명이 된 아버지 하야스기 호쿠토를 걱정하던 하야토는 타임 슬립을 한  살의 호쿠토를 만나게 된다  호쿠토는 지구를 지키고 원래 세계로 돌아가기 위해 신칸센 초진화 연구소에서 비밀리에 개발 중이었던 신카리온         알파 엑스 의 운전사가 되기로 결심한다  그리고 함께 싸우기 위해 홋카이도  야마가타를 시작으로 전국 지부의 동료들이 모인다  과연  살 호쿠토는 원래 세계로 돌아가고 행방불명이 된 아버지 호쿠토는 무사히 돌아올 수 있을까  
43, 더빙  헬로 카봇 시즌  ,아동,쿵  프라임  카봇  크루 등 서로 다른 종류의 카봇들이 하나의 세계로 뭉쳤다  개성만점 카봇들이 펼치는 일상 이야기  그리고 새로운 유니티와 카봇 크루들의 등장  정의롭고 멋진 카봇들과 함께하는 신나는 일상 이야기
44,극장판 마법천자문  대마왕의 부활을 막아라,아동,혼세마왕은 강력한 한자마법을 통해 마법천자문 조각을 빼앗으려 한다  이를 막기 위해 보리선원에 입단해 한자 마법을 익히는 손오공  나날이 실력이 늘어가지만 손오공의 친구인 돈돈도 혼세마왕에게 잡혀가게 된다  혼세마왕의 힘은 점점 강해지고    드디어 혼세마왕은 마법천자문 조각을 거의 다 모으게 된다  과연 손오공과 친구들은 혼세마왕으로부터 마법천자문 조각을 지켜낼 수 있을까 
45, 더빙  헬로 카봇 시즌    붐바,아동,지구와 자연을 사랑하는 카봇 붐바   자연의 에너지를 모아 악당들을 물리치고 지구를 지키는 카봇 붐바의 이야기  신나는 카봇의 세계로 초대합니다  붐바붐바 
46, 더빙  메카드볼 part  ,아동,블랙코마가 사라진 지구에서 바다의 세터를 없애고 지구를 장악하려는      육지의 메카드볼 세터와 바다의 메카드볼 세터간에 전쟁이 시작된다 
47,마샤의 무서운 이야기   한국어,아동,마샤의 무서운 이야기로 다 함께 떠나볼까요 
48,반지의 비밀일기  ,아동,티없이 해맑고 명랑한 반지의 학교생활은 다소 과격하지만 매력 넘치는 응심이와 얌전하고 착하지만 엉뚱한 구석이 있는 냠냠이  그리고 반지를 보듬어 주는 부드럽고 완벽한 호용이로 항상 행복하고 신나기만 하다  그렇다고 학교 가는 것이 꼭 즐겁다는 건 아니야  라고 외치는 반지에게도 고민과 근심 걱정이 찾아올 때가 있다  하지만 근심  걱정  고민  스트레스 이런 부정적인 감정은 스쳐 지나갈 뿐  반지의 무한긍정 일상에 뿌리를 내릴 수 없다  매일매일 새로운 꿈을 꾸며 미지의 미래를 위해 힘차게 달려나가는 반지는 하루하루가 신나는 일의 연속이다 
49, 더빙  펭귄 하이웨이,아동, 이 수수께끼도 풀어 보렴  어때  할 수 있겠어   한편  아오야마와 그의 연구 친구인 우치다에게 같은 반 친구 하마모토가 숲속 초원에 떠 있는 투명하고 커다란 둥근 물체의 존재에 대해 알려준다  골목대장 스즈키 일행이 훼방 놓아도  펭귄과 그 둥근 물체인  바다 의 연구를 이어가는 아오야마와 친구들  마침내 아오야마는  바다 와 펭귄  그리고 누나에게는 어떠한 연결고리가 있지 않을까 하고 생각한다  그러던 어느 날  누나의 몸 상태에 이상한 변화가 일어나고  동시에 이상한 현상이 마을을 덮친다  마을에 대피 지시가 내려지고  아오야마는 어느  한가지 가설 을 가지고 뛰기 시작한다  과연 누나와 펭귄  그리고  바다 의 수수께끼는 풀릴 것인가 
50,앵그리버드 피기테일즈 시즌 ,아동,짖궂은 졸병 돼지들의 삶  또 문제를 해결하기엔 한계가 있는 지혜  피기테일즈에서는 한번도 본 적 없는 우리의 초록색 돼지들의 삶을 살펴 보실 수 있습니다 
51,두리둥실 뭉게공항 시즌  ,아동,세상에서 가장 멋진 일이 일어나는 뭉게뭉게 비행장  세상의 모든 비행기가 모이고 세상 모든 이야기가 펼쳐지는 뭉게뭉게 비행장에서 꼬마 경비행기 윙키의 작지만 큰 꿈을 키워 나가는 애니메이션 
52, 무자막  토끼네 집으로 오세요 시즌  ,아동,개성 강한 두 토끼 남매가 소소한 일상에서 부딪히고 그것을 스스로 풀어나가는 모습을 보여줌으로써  형제간의 우애와 자립심을 가르쳐준다  혼자 자라 이기적이기 쉬운 요즘 아이들에게 다른 친구들과 조화롭게 어울리는 법을 가르쳐줄 것이며 루비에게서는 바른 생활을 배울 수 있으며  맥스에게서는 용기와 명랑함을 배울 것이다 
53,런닝맨  PART  ,아동,진정한 용기와 팀워크로 세상의 평화를 지키고 영웅이 된 런닝맨들  하지만 기쁨도 잠시  런닝맨들은 정체를 알 수 없는 악당들에게 끌려가고 만다  그들이 도착한 곳은 화가 난 풀룰루 족 관중들로 가득 차 있는 경기장  뜻하지 않게 런닝맨 서바이벌 게임에 출전하게 된 런닝맨들은 끝없이 나타나는 상대를 이겨야만 이곳을 탈출할 수 있다  살아남기 위해  그리고 진실을 밝히기 위해 런닝맨들이 다시 달리기 시작한다  
54,모여라  고마짱 시즌  ,아동,장수는 집 앞에 세운 트럭을 보면서  년 전에 고마가 왔던 날을 회상한다  그런데 아차 하는 사이에 고마를 태운 택배 트럭이 떠나고 만다  장수는 고마를 찾기 위해 동네방네를 찾아다니는데   
55, 더빙  터닝메카드W   반다인의 비밀,아동,새로운 메카니멀 마스터와 사성수  그리고 무언가 비밀을 안고 있는 듯한 반다인과의 배틀이 시작된다 
56,모여라  고마짱 시즌  ,아동,장수가 접고 있는 종이를 고마가 뭉개면서 비행기 모양이 되자 장수는 고마를 칭찬한다  또한 고마가 매직으로 장난 친 게 알파벳  자 모양처럼 보이자 장수네 가족은 고마를 또 칭찬한다  뭐든 잘한다는 칭찬에 한껏 기분이 좋아진 고마는 퀵 보드에도 도전하는데 
57, 더빙  헬로 카봇 시즌   part  ,아동,언제나 함께하는 우리의 비밀친구  헬로 카봇  카봇을 부르는 시계가 변하고 새로운 카봇 친구들이 등장 
58,디보와 노래해요   한국어,아동,디보와 친구들이 함께 하는 재미있는 노래 배워보기 
59,극장판 숲의 요정 페어리루   크리스마스의 기적   마법의 날개  ,아동, 리프 와  바이올렛   그리고  해바라기 와  로즈 는  선배 트윙클 페어리루인  스피카    시리우스 와 함께  트리를 장식할 크리스마스 스타를 함께 만들다 친구들과 다툼을 벌이게 된다   한편  여행을 떠난  산타 가 돌아오지 않자 곤란해진  크리 와  트리 는  직접  산타 로 변신해 선물을 나눠주기로 하는 등  크리스마스 준비에 바쁜 시간을 보내는데   과연  리틀 페어리루 의 요정들은 모두 행복한 크리스마스를 보낼 수 있을까요 
60, 자막  겨울왕국의 무민,아동,따스한 여름이 지나고 겨울이 찾아온 무민 골짜기  밤나무와 열매 그리고 나뭇잎 향기까지  무민이 좋아했던 모든 것을 꽁꽁 얼려버린 겨울은 무민이 가장 소중하게 생각했던 해님까지 몰래 숨겨버린다 해님을 기다리던 무민은 오랜 고민 끝에 직접 해님을 찾기로 하고  친구 투티키와 특별한 도전에 나서는데 
61,마샤의 이야기   한국어,아동,마샤의 이야기로 다 함께 떠나볼까요 
62, 더빙  요괴메카드,아동,이 세계에는 하늘에서 요괴가 별똥별을 타고 내려 와 인간 세상을 어지럽게 한다는 전설이 있다  개구쟁이 소년 나찬은 어느 날 갑자기 하늘에서 떨어진 별똥별에 맞게 된다  그런데알고 보니 그것은 별똥별이 아니라 요괴볼 이라 불리는 물건이었다  요괴들은 인간 세상에 몰 래 숨어서 장난을 치는 존재들이기 때문에 요괴볼 속에 봉인해야 한다  이런 요괴들을 봉인하는 사람을 테이머 라 고 부르고 이를 양성하는 기관이 바로 요괴볼 아카데미 이다  나찬은 요괴볼 아카데미 에 입학하여 파트너 정령 을 소환하고 배틀을 통해 요괴를 봉인하는 교육을 받는다  과연 나찬은 뛰어난 테이머가 되어 인간 세상을 요괴로 부터 지켜낼 수 있을 것인가     
63, 더빙  헬로 카봇 쿵,아동,미래에서 알 모양의 새로운 카봇이 나타났다  엄마 심부름으로 마트에 가려던 차탄은 마이스터의 급박한 호출을 받고 미래에서 온 에그카봇들을 찾아 뒷산으로 향한다  그 후 차탄은 골드렉스와 함께 에그 형태의 카봇을 발견하는데   
64,타오르지마 버스터   블랙어썰트의 귀환,아동,평화롭던 지구 생활을 즐기던 어느 날  우주 용병 회사     의 긴급 소환 명령   우주로 돌아갈 팀을 가리는 운명을 건 대결이 시작된다  한편  우주 전설이라 불리던  블랙어썰트 가 지구에 돌아온다  그리고 그를 뒤쫓는 우주해적단과 버스터 용병들의 피할 수 없는 대격돌이 펼쳐진다 
65, 더빙  다이노코어 시즌  ,아동,피자집 아들 렉스가 변신합체 로봇 다이노코어를 만나 로봇을 조정하는 영웅이 되어 지구의 정의를 위해 친구들과 함께하는 모험과 우정을 담은 좌충우돌 코믹 액션 스토리이다 
66,정글에서 살아남기,아동,마루  아라 그리고 가비는 원주민들을 위한 자원봉사에 나선 아라의 아빠를 따라 보르네오 정글을 방문하게 된다  그러던 중 헬리콥터를 타고가다가 갑작스런 토네이도에 휩쓸리게 되고  원주민의 도움으로 다행히 목숨을 건진다  가까스로 깨어나게 된 마루와 아라는 아라의 아빠가 사라져 버린 사실을 알게된다  결국  아빠를 찾기 위해 정글로의 대모험을 떠나게 되고  누구보다도 정글의 무서움과 생존 기술을 잘 아는 부족의 전사 셀리마가 이를 돕기 위해 함께 한다  흉측한 맹수  치명적인 독충 등 온갖 위험이 도사리는 정글에서 이들의 살아남기 여정이 펼쳐진다  이들은 과연 살아 남을 수 있을까 
67,안녕  괴발개발 시즌  ,아동,본인을 여왕으로 알고 인간을 하인쯤으로 여기는 강아지 엘리자베스 본명 쫑알이   무념무상 잠자는 것이 특기인 인형 같은 외모의 시크한 강아지 순돌이  애교넘치는 고양이 랑이  식탐 대마왕 유딩  그리고 아픈 상처를 가지고 있는 카리스마 넘치는 아가까지  개성 넘치는 다섯 마리의 반려동물과 그들을 모시며 살아가는 웹툰 작가 두순의 바람 잘 날 없는 일상을 그린 유쾌한 가족 시트콤 
68,버스데이 원더랜드,아동,생일 전날  평소 자신감이 없는 아카네 앞에 갑자기 나타난 연금술사 히포크라테스와 그의 제자 피포  자신들의 세계를 구해달라며 아카네를 억지로 데려온 곳은 행복의 색으로 가득한 원더랜드였다  골동품가게 지하실과 이어진 신기한 나라의 구세주가 된 아카네는 엄청난 모험 끝에 인생을 바꿀 중요한 결단을 내리는데 
69, 더빙  코코몽  기,아동,냉장고 문이 닫히면  냉장고 속 음식과 야채들이 잠에서 깨어난대요  골목대장 소시지 원숭이  코코몽 과 토끼가 된 계란 반쪽  아로미   그리고 다양한 모습으로 변한 냉장고 속 친구들  귀여운 코코몽과 그의 친구들이 만들어내는 신나고 재밌는 모험의 세계로 함께 떠나요 
70, 더빙  헬로 카봇 미니,아동,우리의 비밀친구 카봇에게도 비밀 친구가 있는 거 알아  인사해   헬로 카봇 미니  작지만 똑똑하고 열정과 재미로 가득한 카봇 크루들의 세상  오늘은 무슨 사고로 세상을 즐겁게 할지  기대해  
71, 더빙  미피의 동물원 보물찾기,아동,미피와 함께 숨겨진 동물들을 찾아보아요  미피와 친구인 멜라니  그런티는 미피의 엄마 아빠와 함께 동물원에 놀러간다  동물원에서 엄마 아빠가 내주는 찾기놀이를 하며 다양한 동물들을 만나는 미피와 친구들  다섯 가지 동물들을 모두 찾은 친구들에게 주어지는 보물과 또 다른 깜짝 선물은 과연 무엇일까 
72,몬스터탑,아동,꽤나 실력 있는 챙이 배틀 플레이어  시우와 그의 몬스터 팻 티라노  어느날 평화롭기만 하던 도시에서 미스터리한 일들이 벌어지면서 큰 혼란을 격는다  그러던 중 정체불령의 몬스터들과 마주하게 되고 배틀까지 붙게 된다  시우는 도시를 위험에 빠트리려는 세력이 있다는 걸 알아채고 친구들과 함께 되시의 평화와 나쁜 세력을 몰아내기 위한 대결을 시작하게 된다 
73, 더빙  아기상어 올리와 윌리엄  상 ,아동, 핑크퐁 아기상어 의 새로운 오리지널 애니메이션 시리즈  아기상어 올리와 윌리엄 이 찾아왔어요  바닷속 마을을 배경으로 펼쳐지는 아기상어  올리 와 단짝 친구  윌리엄 의 모험 이야기로  몸이 아픈 친구를 보살펴주고 친구들과 밴드를 결성하거나 때로는 악당과 대결하는 등 매일 새로운 사건이 펼쳐집니다  귀여운 장난꾸러기 아기상어  올리 와 단짝 친구  윌리엄  그리고 상어가족과 개성 만점 물고기 친구들이 펼치는 바닷속 신나는 모험과 우정의 세계로 여러분을 초대합니다 
74, 더빙  내 친구 호비 part  ,아동,긍정적이며 활발한 성격을 가진 호비  호비는 호기심이 왕성하고 정의감이 넘쳐나 친구들이 힘든 일을 겪을 때면 나서서 도움을 준다  베니  페로  냥이 등의 친구들과 함께 챌린지 섬의 곳곳에서 벌어지는 호비의 신나는 모험 이야기가 펼쳐진다 
75,정글에서 살아남기  기   화산섬의 비밀,아동,헬기를 타고 집으로 향하는 마루와 카이 일행  갑작스러운 화산재 폭풍에 휘말려 자바섬에 불시착 한다  이에 대화산 활동으로 잠들어 있던 땅늘보  앤드류사쿠스 등의 이그라스들이 포효 하며 화석에서 깨어나고    이때 마루는 나무에 걸려 자바 원주민에게 잡히고  아라와 카이는 마루를 찾기 위해 정글속으로 들어가는데 
76,쥬라기캅스,아동,지구를 지키는 수호자들      만년 전  인의 쥬라기캅스는 지구를 침략한  데스바리안 을 달에 봉인하고  현재는 지구 곳곳에 탈 것의 형태로 숨어 지내고 있다  쥬라기캅스의 리더이자  지구의 분신인  쥬관장 은 새로운 후계자를 찾던 어느 날 순수한 영혼을 가진  공찬 을 보자마자 최고의 적임자임을 직감하고 쥬라기커맨더로 임명한다  싸워라  소년   인의 공룡전사  쥬라기 에볼루션   
77,볼츠와 블립,아동,    년  토미 박사가 만든  크레이터 리그  덕분에 지구는 평화롭다  지구의 모든 분쟁은 은하계 로봇들의 가장 익살스러운 스포츠 경기들로 치러지는  크레이터 리그 로 해소되고 있기 때문이다  볼츠와 블립  두 시티봇은 우연히 리그의 꼴찌인 썬더볼츠 팀에 합류하게 되고  팬들의 성원에 최선을 다한다  오합지졸로 구성된 팀 멤버들의 도움으로 그들은 점점 자신들의 정체를 알아가고  토미 박사에게 앙심을 품고 있는 블러드 박사의 복수극에 휘말려 달과 지구 모두 위협을 받고 있다는 걸 알게 되는데   
78,출동  애니멀 레스큐 part  ,아동,개발을 위해 환경파괴를 일삼는 브라이트만의 야욕 때문에 많은 동물과 식물들이 살아갈 곳을 잃고 있다  브라이트만의 수하인 연구원 삼인방에게 잡힌 로디는 같이 갇혀있던 화이트와 함께 우주의 에너지가 담긴 블루아이를 훔쳐서 탈출한다  도망 다니다가 갈 곳 없는 동물을 보살펴주는 동물보호소에 정착하게 되고 그곳 지하에 화이트가 비밀기지를 만들고 로디를 필두로 타샤와 베니를 끌어모으고 동물보호소의 딸인 진이 합류하면서 애니멀 레스큐가 결성된다  애니멀 레스큐는 전 세계를 돌아다니며 위기에 처한 동물을 도우며 브라이트만에 맞선다 
79,출동 케이캅,아동, 출동  케이캅 은 현직 경찰관인 두 주인공이 우주에서 온 공주를 구해주고 슈퍼파워를 얻어 케이캅으로 활동하는 슈퍼히어로물이다  인간에게서 블랙에너지를 만들어내 지구를 지배하려는 우주악당과 신분을 숨긴 채 이에 맞서는 주인공들의 좌충우돌 소탕작전이 코믹하면서도 긴장감 넘치게 펼쳐진다 
80,엄마 찾아 삼만리   극장판 마르코,아동,이탈리아 제노바에 사는  살 소년 마르코  무료로 어려운 사람들을 진료해주는 의사 아버지의 병원이 기울면서 엄마는 돈을 벌기 위해 아르헨티나로 떠난다  마르코는 엄마가 병에 걸렸다는 소식을 듣고 엄마를 찾아 여행을 떠난다  아버지의 반대에도 불구하고 떠난 여행은 너무나 험난했다  엄마를 찾아 도착한 곳에 엄마는 이미 다른 곳으로 이동하고 없었고 좌절과 희망을 반복하는 마르코  여행 중에 사기꾼 어른들을 만나 고생도 한다  과연 마르코는 엄마를 찾아 고향으로 되돌아올 수 있을까 
81,내 사랑 뚱 시즌  ,아동, 살 꼬마 숙녀 뚱이의 천방지축 이야기가 시작된다 
82,도라에몽   진구의 신공룡,아동,진구는 공룡 엑스포 화석 발굴 체험에서 발견한 화석을 공룡알이라고 굳게 믿는다  도라에몽의 비밀도구 타임 보자기로 화석을 되돌리자 새로운 종의 쌍둥이 공룡이 태어났다  진구를 닮아 미덥지 못한 큐와 말괄량이 뮤  사랑을 듬뿍 주며 키우지만  함께 살아가는 것이 어렵다는 것을 깨달은 진구는 큐와 뮤를 원래 시대로 데려다 주기로 결심하고  친구들과 함께      만 년 전 백악기로 모험을 떠난다  도라에몽의 비밀도구와 공룡들의 도움으로 공룡의 발자국을 따라 진구와 친구들이 도착한 곳은 바로 수수께끼의 섬  공룡이 멸종했다고 알려진 백악기에서 큐와 뮤  그리고 진구를 기다리고 있는 운명은  
83,도라에몽   진구의 달 탐사기,아동,달 탐사기가 발견한 흰 그림자가 뉴스 속보로 나오게 되고  진구는 그것이  달 토끼다  라고 주장하지만 아무도 믿지 않는다  이에 진구는 도라에몽과 함께  같은 것을 믿게 하는 배지 를 이용하여 달의 뒷면에 토끼 왕국을 만들기로 한다  그러던 어느 날  수수께끼 소년  루카 가 전학을 오고  도라에몽과 친구들은 함께 토끼 왕국에 가게 된다  그리고 그곳에서 우연히  에스펄 이라는 신기한 힘을 가진 아이들과 만나 친구가 된다  함께 즐거운 시간을 보내던 도라에몽과 친구들  그리고  에스펄  앞에 의문의 우주선이 나타나고  에스펄 과 함께 도라에몽과 친구들을 구하려던  루카 도 잡히게 된다  과연  도라에몽과 친구들은  루카 를 구할 수 있을까 
84,런닝맨  PART  ,아동,진정한 용기와 팀워크로 세상의 평화를 지키고 영웅이 된 런닝맨들  하지만 기쁨도 잠시  런닝맨들은 정체를 알 수 없는 악당들에게 끌려가고 만다  그들이 도착한 곳은 화가 난 풀룰루 족 관중들로 가득 차 있는 경기장  뜻하지 않게 런닝맨 서바이벌 게임에 출전하게 된 런닝맨들은 끝없이 나타나는 상대를 이겨야만 이곳을 탈출할 수 있다  살아남기 위해  그리고 진실을 밝히기 위해 런닝맨들이 다시 달리기 시작한다  
85,바다 탐험대 옥토넛 시즌   아슬아슬 구조대작전,아동,    사마귀 새우                자신의 집게발이 더 강력하다며 끊임없이 싸움을 해대는 두 사마귀 새우가 우연히 옥토포드에 타게 되고 둘의 싸움으로 옥토포드는 순식간에 쑥대밭이 되고 마는데      죄수 베도라치                산호초 탐사를 나갔던 대쉬와셸링턴은 아치형의 거대한 돌에 균열이 생겨 무너질 위험에 처한 걸 발견하고 즉시 주변 동물들을 대피시키기 시작한다  하지만 아치 바로 아래 사는 엄마 베도라치는 절대 집을 떠나지 않겠다고 고집을 부리고 결국 바나클은 다른 방법을 생각해 내는데      옛 옥토포드의 수수께끼                   버블 변환기 고장으로 옥토포드가 움직이지 않자 바나클과 대원들은 옛 옥토포드로 변환기를 가지러 간다  하지만 누군가가 변환기를 훔쳐가는가 하면 계속 대원들을 괴롭히는데      신비의 대벌레                 폭풍에 밀려 바다 한 가운데 있는 거대한 바위섬에 가게 된 페이소는 멸종된 것으로 알려졌던 희귀 곤충   트리 로브스터  대벌레들을 만나게 된다  하지만 옥토포드로 돌아온 후 간밤에 있었던 일을 얘기해도 아무도 믿지 않자  콰지와페이소는 함께 도서관에서 자료를 찾고  그러던 중 페이소 머리에 붙어온 아기 대벌레를 발견하는데      노란배바다뱀                                동물들 진찰을 나갔다 거대한 무리를 이루고 있는 노란 배 바다뱀 무리를 발견한 페이소는 도움을 청하는 목소리를 듣고 바로 무리로 향한다  하지만 곧 몰아 닥친 폭풍에 쓸려 페이소와 뱀들은 해변으로 올라가고 뜨거운 햇빛과 부상으로 위험에 처하는데      바이올렛 바다달팽이                 해변으로 모처럼 휴일을 즐기러 간 옥토넛  오랜만에 서핑을 즐기던 대쉬는 서핑 달팽이로 불리는 바이올렛 바다달팽이 두 마리를 만나고 함께 거대한 파도에 도전한다  하지만 파도가 너무 커 거품 만들기에 실패한 달팽이들은 파도에 휩쓸려 위험에 처하는데 
86, 더빙  빠샤메카드,아동,말하고 움직이는 살아있는 미니카 변신 생명체   메카니멀  어느 날 나찬은 우연히 신비로운 레전드 메카니멀인 에반을 테이밍하게 되는데  
