,titles,category,summary
0,주술회전 part  ,액션,소년은 싸운다      올바른 죽음 을 위해 쓰라린 고통  후회  치욕 인간으로부터 흘러나온 부정적인 감정이 저주로 변해 일상에 숨어든다  저주는 세상에 만연한 재앙의 근원이며  최악의 경우 인간을 죽음으로 이끈다  그리고 저주는 저주로밖에 없앨 수 없다  경이적인 신체능력을 가진 소년 이타도리 유지는 아주 평범한 고등학생이었지만  어느 날  저주 에 습격당한 친구를 구하기 위해 특급 주물  양면 스쿠나의 손가락 을 먹고 영혼에 저주가 깃들게 된다  저주인  양면 스쿠나 와 몸을 공유하게 된 이타도리는 최강의 주술사인 고죠 사토루의 안내로 저주에 대항하는 전문 기관인  도쿄 도립 주술 고등전문학교 에 편입하게 되는데       저주를 없애기 위해 저주가 된 소년의 돌이킬 수 없는 장렬한 이야기가 움직이기 시작한다  
1, 무삭제  귀멸의 칼날,액션,숯을 파는 마음씨 착한 소년 탄지로는  어느 날 혈귀에게 가족을 몰살당한다  유일하게 살아남은 누이동생 네즈코 마저도 혈귀로 변하고 마는데    절망적인 현실에 큰 타격을 입은 탄지로였지만  동생을 인간으로 돌려놓기 위해  가족을 죽인 혈귀를 심판하기 위해   귀살대 의 길을 가기로 결의한다  인간과 혈귀가 엮어낸 애절한 오누이의 이야기가 지금 시작된다  
2,은혼  기,액션,에도 시대 말기  하늘에서 내려온  천인 의 침략으로 전쟁이 발생한다  막부들은 결국 천인과의 공존을 위해 사람들에게 검을 소지할 수 없도록 폐도령을 내려서 사무라이가 큰 위기를 겪고 있다  그러나 사무라이 정신을 굳게 간직한 남자가 있었으니 그의 이름은 사카타 긴토키  단 것을 좋아하는 저돌적인 이 남자가 부패한 에도를 두동강을 낼지도      코미디 액션   은혼의 장르는 은혼이다  
3,전생했더니 슬라임이었던 건에 대하여  기,액션,샐러리맨인 미카미 사토루는 길에서 칼에 찔려 죽었다  하지만 문득 정신이 들어 깨어나보니 이세계로 전생해있었다  그것도 슬라임의 모습으로  리무루라는 이름으로 새롭게 슬라임 인생을 얻어  여러 종족이 함께 사는 세계에 떨어지게 된 그는  종족은 상관없이 모두가 행복하게 살 수 있는 나라 를 만드는 것을 새로운 인생 목표로 삼게 된다 
4,귀멸의 칼날   환락의 거리편,액션, 매주 화요일 오전 라프텔에서 만나보세요   무한열차의 임무를 마친 탄지로 일행의 다음 행선지는  귀살대 최고의 검사  주 의 한 사람  음주  우즈이 텐겐과 탄지로 일행의 새로운 싸움의 막이 열린다 
5, 자막  스파이 패밀리 part  ,액션, 사람은 누구나 아무에게도 보여줄 수 없는 자신을 갖고 있다   세계 각국이 물밑에서 치열하게 정보전을 펼치는 시대  오스타니아와 웨스탈리스는 십수 년간에 걸쳐 냉전 상태에 있었다  웨스탈리스의 정보국 대동과        소속의 수완가 스파이인  황혼 은 동서 평화를 위협하는 위험인물  오스타니아의 국가통일당 총재 도노반 데스몬드의 동향을 살피기 위해 어떤 극비 임무를 수행하게 된다  그 이름은 오퍼레이션  올빼미   임무 내용은  일주일 이내에 가족을 만들어  데스몬드의 아들이 다니는 명문 학교의 친목회에 잠입하라    황혼 은 정신과 의사 로이드 포저로 위장하고 가족을 만들게 된다  하지만  그가 만난 딸 아냐는 마음을 읽을 수 있는 초능력자  아내 요르는 암살자였다   명의 이해가 일치하여 서로 정체를 숨기면서 함께 생활하게 되는데  해프닝 연속인 임시 가족에게  세계의 평화는 맡겨졌다   
6,주술회전 part  ,액션,소년은 싸운다      올바른 죽음 을 위해 쓰라린 고통  후회  치욕 인간으로부터 흘러나온 부정적인 감정이 저주로 변해 일상에 숨어든다  저주는 세상에 만연한 재앙의 근원이며  최악의 경우 인간을 죽음으로 이끈다  그리고 저주는 저주로밖에 없앨 수 없다  경이적인 신체능력을 가진 소년 이타도리 유지는 아주 평범한 고등학생이었지만  어느 날  저주 에 습격당한 친구를 구하기 위해 특급 주물  양면 스쿠나의 손가락 을 먹고 영혼에 저주가 깃들게 된다  저주인  양면 스쿠나 와 몸을 공유하게 된 이타도리는 최강의 주술사인 고죠 사토루의 안내로 저주에 대항하는 전문 기관인  도쿄 도립 주술 고등전문학교 에 편입하게 되는데       저주를 없애기 위해 저주가 된 소년의 돌이킬 수 없는 장렬한 이야기가 움직이기 시작한다  
7,전생했더니 슬라임이었던 건에 대하여  기  부,액션,주인공 리무루와 그를 따르는 다수의 마물들이 세운 나라  쥬라 템페스트 연방국 은 근린 국가들과의 협정과 교역을 통해  인간과 마물이 공존하는 나라 라는 이상을 현실로 만들려 하고 있었다  이는 인간이었던 슬라임에서 기인한 리무루의  인간에 대한 호의  였다  하지만 이 세계에는 명확한  마물에 대한 적의 가 존재하고 있었다  그 불합리한 현실을 마주했을 때  리무루는 선택한다   무엇을 잃고 싶지 않은지 를      
8,방패 용사 성공담 Season  ,액션,평범한 오타쿠 대학생 이와타니 나오후미는 도서관에서 책을 보던 도중 사성무기서라는 책을 발견하고 그 책을 보게 된다  그 순간 정신을 잃게 되고 깨어보니 검  창  활의 용사와 함께 자신도 모르게 이세계에 소환되어 있었다  그리고 그의 손에는 어째서인지 방패가 붙어있었다 
9,지박소년 하나코 군,액션, 하나코 씨  하나코 씨  거기 계십니까   학원에 전해지는 불가사의한 소문  구교사  층 여자화장실 세 번째 칸에는  하나코 씨 가 있어 이를 불러낸 사람의 소원은 무엇이든지 이뤄준다고 한다  자신의 소원을 이루기 위해 야시로는 학교의 괴담에 몸을 바친다  학원의 불가사의  하나코 군 과 오컬트 소녀  야시로 가 펼치는 하트풀 화장실 코미디 
10,소드 아트 온라인  기,액션,    년  인류는 마침내 완전한 가상 공간을 실현했다  모든 게이머가 꿈꿔왔던           가상 대규모 온라인 롤 플레잉 게임   소드 아트 온라인  이 정식 가동을 시작한다  주인공은 소드 아트 온라인 플레이어인 키리토  그는    의 세계에서 플레이를 만끽하던 중 다른  만 명의 플레이어와 함께 게임 마스터의 무자비한 선고를 듣는다     층까지 있다는 부유성 아인크라드의 정상을 정복해 게임을 클리어 하지 못하면 로그아웃을 할 수 없다고  그리고 게임 오버는 현실 세계에서  죽음 을 의미한다고    키리토는 재빨리 게임의  진실 을 받아들이고 파티를 짜지 않는 솔로 플레이어로 끝이 보이지 않는 사투에 몸을 던진다 
11, 자막  나의 히어로 아카데미아  기,액션,뉴 히어로 탄생에 주목하라   신세대 히어로  한국 상륙   인구의 약  할이 개성이라 불리는 초능력을 갖고 있는 초인 사회로 탈바꿈한 세계  대부분의 사람들이 개성을 보유하고 있기 때문에 이를 악용한 범죄가 폭발적으로 급증하고 이에맞서 싸우는 히어로들은 시민 모두의 동경의 대상이 되었다  세계의 평화를 수호하는 특수경찰과 같은 역할자  히어로 의 인기는 날이 갈수록 치솟기 시작하고 히어로를 양성하는 국립기관까지 세워질 정도  중학생 소년 미도리야 이즈쿠도 그런 히어로를 꿈꾼다  하지만 그는 히어로에게 필수적인  개성 을 타고나지 않았는데     타고난 초능력이 없어서 소외되던 작은 소년의 도전  성장  열정 스토리   그리고 새롭게 나온  기에서는 지난     습격 사건 이후의 이야기가 시작된다  드디어 유에이 체육제 시작   그리고 그랜 토리노 등장 
12, 자막  나의 히어로 아카데미아  기,액션,꿈을 향하여 계속 달린다  최고의 히어로가 되기위해  진정한 히어로가 되기위해   히어로    빌런 싸움이 시작된다 
13,전생했더니 슬라임이었던 건에 대하여  기  부,액션,주인공 리무루와 그를 따르는 다수의 마물들이 세운 나라  쥬라 템페스트 연방국 은 근린 국가들과의 협정과 교역을 통해  인간과 마물이 공존하는 나라 라는 이상을 현실로 만들려 하고 있었다 이는 인간이었던 슬라임에서 기인한 리무루의  인간에 대한 호의 였다      하지만 이 세계에는 명확한  마물에 대한 적의 가 존재하고 있었다  그 불합리한 현실을 마주했을 때  리무루는 선택한다   무엇을 잃고 싶지 않은지 를   
14, 자막  나의 히어로 아카데미아  기,액션,꿈이 현실로  이것은 내가 최고의 히어로가 되기까지의 이야기다  어떤 사건을 계기로      히어로 올마이트와 만난  무개성  소년 미도리야 이즈쿠  그의 마음속에 숨겨진 히어로의 자질을 발견한 올마이트에게 개성  원 포 올 을 이어받는다  미도리야는 올마이트의 혹독한 훈련을 거쳐서 유에이 고교에 입학한다  바쿠고 카츠키  우라라카 오챠코 등의  학년  반 친구들과 서로를 향상시키며 성실한 나날을 보내고 있었다  그런 가운데 나라 전체가 주목하는 빅 이벤트  유에이 고교 체육대회  개최가 다가온다  오직 정상만을 바라보는 바쿠고  가족을 그리워하며 강한 의지로 도전하는 우라라카와 이이다 텐야  그리고 한 남자를 부정하기 위해서 우승을 노리는 토도로키 쇼토  게다가 히어로과  학년  반을 비롯한 새로운 친구들까지  유에이 고교 학생 전원이 투지를 불태우고 미도리야도 결의를 새로이 한다   나도 최선을 다해 쟁취하겠어   최고의 히어로를 향한 그들의 개성과 힘  그리고 자존심이 맞부딪히는 싸움이 시작된다 
15,가정교사 히트맨 리본 ,액션,후회하라  필살탄이 당신을        부활 시킬 것이다   바보 같은 인생을 보내는 중학생 츠나의 집에 가정교사가 오게 되었다  가정교사의 이름은 리본  보기에는 어린아이지만  실제 본업은 초일류 히트맨    리본은 사실 본고라 조직의   대 보스를 키우기 위해 이탈리아에서 건너온 살인 청부업자였다  차기 보스로서 그의 타깃이 된 사람은 학교에서 제대로 하는 일이 없어 항상 왕따를 당하는 츠나라는 소년  죽을힘을 다하면 뭐든지 가능하다   츠나의 목숨을 건 수업이 시작됐다  
16,진격의 거인  기,액션,   여년 전  갑자기 나타난 거인들에 의해 멸종 위기에 처한 인류는 살아남기 위해    의 거대한 벽을 쌓고 그 안에서 숨죽이며 살아가고 있었다  그러던 어느 날  초대형 거인의 등장으로 벽은 무너지고  거인들이 벽 안으로 들어와 사람들을 잡아먹기 시작하는데    절규와 죽음으로 가득한 절망적인 상황에서 거인에게 소중한 사람들을 빼앗긴 엘런은 복수를 맹세한다 
17,암살교실  기,액션,어느 날 일반 진학교인 쿠누기가오카 중학교의 낙오자반이라고 불리는  학년  반에 정부 사람들과 인간이 아닌 정체불명의 생물이 찾아온다  이 수수께끼의 생물은 어느 날 갑자기 나타나 달의  할을 날려 버린 초생물로 내년에 지구를 날려버리겠다고 선언한 공공의 적  마하   의 속도로 하늘을 날며  상상을 초월한 공격력과 다양한 능력을 가진 이 생물이 무슨 이유에서인지  쿠누기가오카 중학교  학년  반의 선생님으로 일하겠다는 제안을 했고  세계는 그것을 받아들인 것이다 정부는 감시와 동시와 암살을 할 수 있기 때문에 이 제안을 승낙한다  암살 성공의 보수    억 엔과 인류의 운명을 걸고   명의 중학생과 살생님의 긴장감 넘치는 수업이 시작된다 
18,도쿄 리벤저스 part  ,액션,밑바닥 인생을 살던 타케미치  중학교 시절 사귀었던 인생에서 유일한 연인이었던 히나타가 가장 흉포하고 악질적인 악당 연합  도쿄 만지회 에게 살해당했다는 것을 알게 된다  사건을 알게 된 다음 날  역 플랫폼에 있던 타케미치는 누군가에게 떠밀려 선로로 떨어지고 다가오는 열차를 보며 자신의 죽음을 직감한다  하지만 정신을 차리고 보니 어째서인지   년 전으로 타임 리프해 있었다  인생의 전성기였던   년 전 중학교 시절로 타임 리프해서 연인을 구하기 위해  계속 도망치기만 했던 자신을 바꾸기 위해 인생의 리벤지를 시작한다 
19, 자막  나의 히어로 아카데미아  기,액션,꿈을 형태로 만들기 위해  히어로가 되기 위해  유에이 고교 히어로과     반        반 대항전  자존심을 건 싸움이 시작된다  한계를 넘어서  라이벌을 뛰어넘어라  
20,나루토  기,액션,나뭇잎 마을의 우즈마키 나루토는 아무도 못말리는 말썽꾸러기인데다가  닌자 졸업 시험에 연속해서 낙방한 전력이 있는 문제아  다시 돌아온 시험에서 나루토는 마지막 관문인 분신술에 실패하여 또 낙제를 하게 된다  상심한 나루토에게 닌자 선생님 중 한 명인 미즈키 선생님이 다가와 마을 뒷산에 숨겨진  봉인의 서 봉인된 책  만 있으면 시험에 쉽게 통과할 수 있다고 알려준다  그러나 나루토가 이 책을 가지러 갔다는 말에  평소 나루토를 아껴주고 힘을 북돋워주던 이루카 선생님은 급히 나루토의 뒤를 쫒는다  미즈키는 사실 마을의 천덕꾸러기로 미움을 받고 있는 나루토를 이용하여 봉인의 서를 손에 넣으려는 음모를 꾸몄던 것이다  이 일을 계기로 나루토는 미즈키로부터 자신의 정체가 구미호의 봉인체라는 충격적인 이야기를 듣는다  사람들을 닥치는대로 해하던 흉한 구미호를 전설적인 닌자인 호카게가 당시 아기였던 자신의 몸에 봉인했다는 것이다  나루토는 마음의 충격이 컸지만 자신을 위로해주는 이루카 선생님의 말씀에 감동하여 마침내 자신의 능력을 제대로 선보이고  그 결과 졸업에 성공하게 된다  하급 닌자인 견습 닌자가 된 나루토는  꽤나 실력도 인물도 출중한 사스케와 당찬 여닌자 사쿠라를 동료로 하여 새로운 선생님인 카카시를 모시게 된다  하지만 행실이 그다지 선생님으로서 모범적이지 못한 카카시는 오히려 나루토 일행에게 실력이 너무 형편없다며 구박을 일삼는다  사실 말이 동료일뿐 팀 웍이 전혀 갖추어지지 않은 나루토 일행은 개인 플레이로 인해 여러번 일을 망치곤 한다  자신들의 주어진 일에 만족하지 못하고 있는 나루토 일행에게 호카게  최고의 닌자에게 대를 물려 이어지는 이름 는 새로운 임무를 주는데   
21,문호 스트레이 독스  기,액션,고아원에서 쫒겨나서 아사직전 상태인 나카지마 아츠시는 강에서 떠내려가던 정체불명의 남자를 구하게 된다  남자의 이름은 다자이 오사무  입수 자살을 시도하던 그는 경찰도 해결하지 못하는 온갖 위험한 사건을 해결하는 이능력 집단인  무장탐정사 의 일원이라고 한다  다자이를 구한 계기로 밥을 얻어먹게 된 아츠시는 현재 다자이가 조사하는 사건이  식인호랑이 퇴치 라는 말을 듣게 된다  그런데 어째서인지 아츠시의 얼굴이 어두워지는데          유명 문호들을 모티브로 삼은 이능력 배틀물  문호 스트레이 독스 지금 시작한다 
22,소드 아트 온라인 앨리시제이션,액션,문득 정신이 든 키리토는 어째선지 어느 한 가상세계에 풀 다이브해 있었다  로그인 이후의 기억이 모호해  실마리를 찾기 위해 떠돌게 된 키리토는 칠흑의 거목  기가스시더 을 발견했고 거기서 한 소년을 만나게 된다   내 이름은 유지오  잘 부탁해  키리토   그 소년은 가상세계의 주민인    였음에도 인간과 똑같이 풍부한 감정을 지니고 있었다  유지오와 친한 사이가 되어가면서도 이 세계에서 로그아웃할 방법을 찾고 있던 키리토  그런 키리토에게 어느 한 기억이 뇌리에 스친다  그것은 어린 키리토와 유지오가 야산에서 뛰놀던 추억  있을 리가 없는 기억  그리고 그 기억 속에는 유지오 말고도 또 다른 금발의 여자아이가 있었다  이름은 앨리스  절대로 잊어선 안 되는 소중한 이름 
23, 더빙  강철의 연금술사 BROTHERHOOD,액션,죽은 어머니를 살리기 위해 에드워드와 알폰스 형제는 금지 되어 있는 연성술을 시행한다  그러나 연성 실패의 대가로 에드워드는 왼쪽 다리를  알폰스는 육신 자체를 잃고 말았다  동생을 살리기 위해 연성을 시도한 에드워드는 오른쪽 팔을 희생한 대가로 간신히 에드워드의 혼을 철로 된 갑옷에 담아 두는 데 성공한다  잃어 버린 사지 대신 철로 된 의수를 부착한 에드워드는 주야로 연금술을 공부하여 결국은 국가연금술사 자격증을 따내고   강철의 연금술사 라는 호칭을 얻게 된다  하지만 엘릭 형제가  현자의 돌 의 진실에 가까이 다가갈수록 그 너머에 드리워진 어두운 음모 또한 엄습해 오는데 
24,도쿄 리벤저스 part  ,액션,밑바닥 인생을 살던 타케미치  중학교 시절 사귀었던 인생에서 유일한 연인이었던 히나타가 가장 흉포하고 악질적인 악당 연합  도쿄 만지회 에게 살해당했다는 것을 알게 된다  사건을 알게 된 다음 날  역 플랫폼에 있던 타케미치는 누군가에게 떠밀려 선로로 떨어지고 다가오는 열차를 보며 자신의 죽음을 직감한다  하지만 정신을 차리고 보니 어째서인지   년 전으로 타임 리프해 있었다  인생의 전성기였던   년 전 중학교 시절로 타임 리프해서 연인을 구하기 위해  계속 도망치기만 했던 자신을 바꾸기 위해 인생의 리벤지를 시작한다 
25,무직전생   이세계에 갔으면 최선을 다한다  기,액션, 나는 이 세계에서 최선을 다하겠어     세 총각에 무직인 방구석 폐인이었던 남자  그는 부모님의 장례식 날에 집에서 쫓겨나 트럭에 치여 목숨을 잃었다  다시 눈을 떴을 때 그는 검과 마법이 존재하는 이세계에서 아기로 다시 환생해 있었다  쓰레기처럼 살아온 남자는 소년 루데우스로서 이세계에서 최선을 다해 살아가기로 맹세한다  루데우스를 기다리는 것은 로리 마술사  엘프 귀를 가진 소꿉친구  흉포한 새침데기 아가씨와 그 외 다양한 인간들과의 만남  그리고 가혹한 모험과 전투  그의 새로운 인생이 움직이기 시작한다   인생 재시작  판타지  개막    
26,암살교실  기,액션,    년 화제작   일본 애니계의 화두는 단연 암살교실이다  마인탐정 네우로의 작가 마츠이 유세이의 차기작으로 전작을 뛰어넘는 인기를 구사하고 있다  특히 원피스  나루토  블리치  은혼 등이 연재되는 주간 소년점프에서 연재가 시작되고부터 쭉 인기투표 순위 최상위권을 유지하고 있는 화제의 작품이다   지구 멸망        지구를 구할 방법은 졸업 전까지 이 선생을 암살하는 것 뿐    어느 날 갑자기 달이 폭발해  할이 증발했다  그 사건의 범인은  년 후 지구도 폭발시킬 예정이라고 하는 초생물  그런데 어째서인지 그 괴물이 찾아간 곳은 어느 중학교 교실로  이곳에서 교사가 될 예정이라고 한다  마하  의 속도로 하늘을 나는 등 인간의 상식을 훨씬 뛰어넘는 능력을 갖고 있는 괴물  군대를 동원해도 죽일 수 없는 이 괴물의 암살을 각국의 수뇌들은 어쩔 수 없이 그 괴물이 담임을 맡을 쿠노기가오카 중학교  학년  반 학생들에게 의뢰하게 된다  성공보수는  억 엔   낙오자들의 클래스     의  반 학생들은 졸업할 때까지 이 암살대상인 교사   살선생님 을 죽일 수 있을 것인가    
27,일곱 개의 대죄   계명의 부활   기 ,액션,아직 사람과 마물의 세계가 분리되기 전 시대  헨드릭슨과 드레퓌스  두 명의 성기사장의 지배로부터 왕국을 탈환한  일곱 개의 대죄 와 엘리자베스  호크  왕국탄생제도 무사히 끝나  드디어 리오네스 왕국에 평화가 찾아왔으나 다음 위협의 징조가 그들에게 다가오고 있었다 
28,일곱 개의 대죄   기 ,액션,일찍이 왕국에 반역을 꾀했다고 여겨지는  명의 전설의 역적  일곱개의 대죄   그들은 지금도 집요하게 왕국의 핵심  성기사들에게 쫓기고 있었다  한편 엘리자베스 공주는 성기사들의 반란을 눈치 채고 왕국을 구하기 위해  일곱 개의 대죄 를 찾아 나선다  공주의 진실된 마음에  일곱 개의 대죄 의 단장이자  분노의 죄 멜리오다스는 그녀와 함께 나머지  일곱 개의 대죄 를 찾는 여행에 나서기로 하는데      과연  일곱 개의 대죄 는 모두 모일 수 있을 것인가   그리고 일찍이 일어났던 반역의 진실은   전대미문의 통쾌한 영웅 판타지  개막  
29,오버로드  기,액션,가상 세계에서 현실처럼 플레이하는 체감형 게임  통칭         의 전성기     년      년에 발매된  위그드라실 은         들 중에서도 방대한 맵과 엄청나게 높은 플레이어 자유도로 인해 국내에서 폭발적인 인기를 얻었고         의 붐을 일으킨 장본인이다  그러나   년이 지난 지금 조용히 서비스를 종료할 예정이었다  위그드라실의 최강 마법사  모몬가는 쓸쓸히 나자릭 지하대분묘에서 종료시간을 기다리고 있었다  그러나 종료시간을 넘어도 로그아웃되지 않고     들도 갑자기 의지를 가지기 시작하는데  그의 앞에는 이제껏 본 적 없었던 이세계가 펼쳐지게 된다  
30,새벽의 연화,액션,고화국의 유일한 공주인 연화는 궁 밖의 세상일은 전혀 모르는 철부지 아가씨로 항상 궁 안에서만 지내고 있다  그런 그녀에게는 학과 수원이라는 소꿉친구가 곁에 있었다  하지만 부왕이 자신의 소꿉친구이자 짝사랑하고 있던 사촌 수원에 의해 살해당하게 되고  이를 목격한 연화는   세 생일에 가장 큰 위기를 겪게 된다  학의 도움으로 궁을 빠져나온 사이 수원이 고화국의 왕위를 계승하였고  연화는 마음을 추스르며 앞으로의 길을 모색하던 중 신관 익수의 신탁을 듣고 고화국의 신화 속 비룡왕을 보필하던 네 마리 용 백룡  청룡  녹룡  황룡 의 후손을 찾아 나서게 된다 
31, 자막  나의 히어로 아카데미아  기,액션,근미래 일본  사람들의 생활양식은 지금과 크게 다를 바 없으나  환경호르몬과 공해  방사능 등 복합적인 요인으로 인구의 약  할이 돌연변이  즉 초능력을 가지고 태어나게 되었다  이런 초능력을  개성 이라 칭하며  눈동자나 머리색의 유전처럼 자연스럽게 받아들이는 사회  오히려 초능력이 없는 사람을 찾아보기 힘든 이 세계에서는 당연히 능력을 악용한 범죄가 급증하고  그런 범죄자들을 처단하는  정의의 사자 를 표방한 집단   히어로 가 생겨난다  초능력 범죄에 맞서 시민들의 평화를 지키는  일종의 특수경찰로서의 임무를 수행하는  히어로  집단의 인기는 연예인과 맞먹는다  이에 따라  청소년들이 가장 선호하는 장래의 꿈도 당연히  히어로   초능력이 보편적인 이 세계에는 일급 히어로를 양성하는 국립기관까지 설립된 상황  모든 이야기는  어릴 때부터  히어로 가 꿈이었지만 초능력을 타고나지 못해 주위에서 비웃음만 당하던   세 소년이  포기하지 않고 국립 히어로 학교인 유에이 고교 입학시험에 도전하면서 시작된다  
