,titles,category,summary
0,은혼  기,성인,에도 시대 말기  하늘에서 내려온  천인 의 침략으로 전쟁이 발생한다  막부들은 결국 천인과의 공존을 위해 사람들에게 검을 소지할 수 없도록 폐도령을 내려서 사무라이가 큰 위기를 겪고 있다  그러나 사무라이 정신을 굳게 간직한 남자가 있었으니 그의 이름은 사카타 긴토키  단 것을 좋아하는 저돌적인 이 남자가 부패한 에도를 두동강을 낼지도      코미디 액션   은혼의 장르는 은혼이다  
1,진격의 거인  기,성인,   여년 전  갑자기 나타난 거인들에 의해 멸종 위기에 처한 인류는 살아남기 위해    의 거대한 벽을 쌓고 그 안에서 숨죽이며 살아가고 있었다  그러던 어느 날  초대형 거인의 등장으로 벽은 무너지고  거인들이 벽 안으로 들어와 사람들을 잡아먹기 시작하는데    절규와 죽음으로 가득한 절망적인 상황에서 거인에게 소중한 사람들을 빼앗긴 엘런은 복수를 맹세한다 
2,도쿄 리벤저스 part  ,성인,밑바닥 인생을 살던 타케미치  중학교 시절 사귀었던 인생에서 유일한 연인이었던 히나타가 가장 흉포하고 악질적인 악당 연합  도쿄 만지회 에게 살해당했다는 것을 알게 된다  사건을 알게 된 다음 날  역 플랫폼에 있던 타케미치는 누군가에게 떠밀려 선로로 떨어지고 다가오는 열차를 보며 자신의 죽음을 직감한다  하지만 정신을 차리고 보니 어째서인지   년 전으로 타임 리프해 있었다  인생의 전성기였던   년 전 중학교 시절로 타임 리프해서 연인을 구하기 위해  계속 도망치기만 했던 자신을 바꾸기 위해 인생의 리벤지를 시작한다 
3,도쿄 리벤저스 part  ,성인,밑바닥 인생을 살던 타케미치  중학교 시절 사귀었던 인생에서 유일한 연인이었던 히나타가 가장 흉포하고 악질적인 악당 연합  도쿄 만지회 에게 살해당했다는 것을 알게 된다  사건을 알게 된 다음 날  역 플랫폼에 있던 타케미치는 누군가에게 떠밀려 선로로 떨어지고 다가오는 열차를 보며 자신의 죽음을 직감한다  하지만 정신을 차리고 보니 어째서인지   년 전으로 타임 리프해 있었다  인생의 전성기였던   년 전 중학교 시절로 타임 리프해서 연인을 구하기 위해  계속 도망치기만 했던 자신을 바꾸기 위해 인생의 리벤지를 시작한다 
4,오버로드  기,성인,가상 세계에서 현실처럼 플레이하는 체감형 게임  통칭         의 전성기     년      년에 발매된  위그드라실 은         들 중에서도 방대한 맵과 엄청나게 높은 플레이어 자유도로 인해 국내에서 폭발적인 인기를 얻었고         의 붐을 일으킨 장본인이다  그러나   년이 지난 지금 조용히 서비스를 종료할 예정이었다  위그드라실의 최강 마법사  모몬가는 쓸쓸히 나자릭 지하대분묘에서 종료시간을 기다리고 있었다  그러나 종료시간을 넘어도 로그아웃되지 않고     들도 갑자기 의지를 가지기 시작하는데  그의 앞에는 이제껏 본 적 없었던 이세계가 펼쳐지게 된다  
5,약속의 네버랜드  기,성인,어머니처럼 따르는 그녀는 친모가 아니다  함께 사는 그들은 형제가 아니다  이곳 그레이스 필드 하우스는 고아원으로 나는 고아  그렇게 생각하고 있었다 
6,오버로드  기,성인,아인즈는 고민하고 있었다  아인즈 울 고운 마도국의 왕으로서 이 나라를 어떻게 다스려야 할 것인가  알베도  데미우르고스 같은 우수한    들과 휴식 없이 일할 수 있는 언데드들 덕분에  마도국은 현재 안전하고 굶주림 없는 장소가 되어 있었다  하지만  그곳에서 살고 있는 사람들은 아직 공포와 불안감에 떨고 있었고  도시는 불이 꺼진 듯이 조용했으며 활기를 잃어버렸다  사람들의 웃음을 찾아볼 수 없는 가운데  아인즈는 모험자 조합에 방문해 조합장인 아인잭에게 어떤 제안을 했다  한편  갑자기 생겨난 마도국에 당혹스러워하던 주변 나라들의 지도자들도 각자 대항책을 강구하고 있었다  과연 아인즈는 각 나라의 모략을 저지하고 자신의 이상향을 만들어낼 수 있을 것인가 
7,오버로드  기,성인,오버로드  기      년  월 방영 시작 
8,흔해빠진 직업으로 세계최강  기,성인,왕따인 나구모 하지메는 같은 반 아이들과 함께 이세계로 소환된다  차례차례 사기적인 전투 능력을 발현하는 반 아이들과는 달리 연성사라는 평범한 능력을 손에 넣은 하지메  이세계에서도 최약인 그는 어떤 반 아이의 악의로 인해 미궁의 나락으로 떨어지고 마는데   탈출 방법을 찾을 수 없는 절망의 늪에서 연성사로서 최강에 도달하는 길을 발견한 하지메는 흡혈귀인 유에와 운명적인 만남을 갖는다   내가 유에를  유에가 나를 지킨다  그럼 최강이야  전부 쓰러뜨리고 세계를 뛰어넘자   나락으로 떨어진 소년과 가장 깊은 곳에 잠들어 있던 흡혈귀가 펼치는  최강  이세계 판타지 개막  그리고 소년은  최강 을 뛰어넘는다 
9,과호흡  리마스터링 ,성인, 공지  과호흡  리마스터링  버젼 교체 안내   월  일부로 과호흡이  리마스터링  버젼으로 영상 교체되었습니다  추가적인 영상 및 사운드 작업 등으로  감독님께서 많은 공을 들이신 버젼이에요   줄거리  겨울  명이는 학창시절에 짝사랑했던 선호를 만나기 위해 동창회에 왔다  숫기 없는 성격 탓에 술자리에 섞이지 못하고 담배를 핑계로 빠져 나온다  그때 선호도 따라 나서는데  
10,오버로드  기,성인,때는     년  한때 폭발적인 인기를 얻었던 가상 체감형 게임  위그드라실 은 서비스를 종료할 예정이었다  플레이어인 모몬가는 동료와 함께 나자릭 지하대분묘에서 서비스 종료시간을 기다리고 있었다  하지만 종료시간이 지나도 로그아웃이 되기는커녕    들이 갑자기 의지를 가지고 스스로 움직이기 시작했다  게다가 나자릭 밖으로 나가보니 본적도 없는 이세계가 펼쳐져 있었다  모몬가는 예전 동료들을 찾기 위해 길드의 이름이었던 아인즈 울 고운이라는 이름을 사용하고  이세계에 그 이름을 널리 퍼뜨리기로 결심한다  그리고 절대적인 충성을 맹세한 부하들과 함께 새로운 땅을 향해 진격한다 
11,진격의 거인  기 part  ,성인,백 년이라는 긴 시간 동안 인류와 바깥 세계의 사이를 막아온 벽  그 벽 너머에는 본 적 없는 세계가 펼쳐져 있었다  불꽃의 물  물의 대지  사막의 설원 등 책에 써있던 것들은 소년의 탐구심을 자극할 뿐이었다  이윽고 시간이 지나 벽이 거인들에게 파괴된 지금  인류는 세계의 진실을 향해 한발한발 내디딘다  거인의 정체는 무엇인가  왜 벽 안쪽은 거인으로 가득했는가  거인화한 엘런 예거가 가진 좌표의 힘이란 무엇인가  그리고 히스토리아 레이스는 이 세계의 무엇을 알고 있는가  엘렌을 비롯한    기 병사들이 포함된 새로운 체제의 리바이반  본격적으로 움직이기 시작한 그들의 앞을 가장 강한 최악의 적이 가로막는다 
12,진격의 거인 The FINAL part  ,성인,그 거인은 언제 어떤 시대에도 자유를 갈망하며 나아갔다  자유를 위해 싸웠다  그 이름은 진격의 거인 드디어 밝혀진 벽 밖의 진실과 거인의 정체 이곳에 이르기까지 인류는 너무나도 큰 희생을 치렀다  그럼에도 그들은 계속 나아가야만 한다  벽 밖에 있는 자유의 상징  바다를 아직 그 눈으로 보지 못했으니까  이윽고 시간은 흘러 첫 번째  초대형 거인 에 의한 최초의 습격으로부터  년 조사병단은 월 마리아 밖의 벽외 조사를 감행한다   벽 너머에는 바다가 있고  바다 너머에는 자유가 있다  그렇게 믿어왔는데        벽 안의 인류가 처음으로 도달한 바다  끝없이 펼쳐진 수평선 너머에 있는 것은 자유인가  아니면       엘런 예거의 이야기는 새로운 국면을 맞이한다     
13,진격의 거인  기,성인,꿈도 희망도 허락되지 않았던 인류와 거인의 대결이 시작된다      여 년 전 갑작스레 나타난 거인의 먹이가 되어버린 인류는 높이   미터에 이르는 거대한 벽을 쌓고 벽 바깥으로 나가는 자유와 맞바꿔 침략을 막고 있었다  그러나 허울뿐인 평화는 벽을 넘어 버리는 초대형 거인의 등장으로 무너지고  지옥 같은 상황에 빠지고 만다  한편 아직 보지 못한 벽 바깥 세상에 대해 동경하던 앨런과 막강한 전투력의 보유자 미카사  마음 약한 아르민은 병사가 되어 마을을 지켜 나가는데   
14,진격의 거인 The FINAL part  ,성인,그 거인은 언제 어떤 시대에도 자유를 갈망하며 나아갔다  자유를 위해 싸웠다  그 이름은    진격의 거인  드디어 밝혀진 벽 밖의 진실과 거인의 정체  이곳에 이르기까지 인류는 너무나도 큰 희생을 치렀다  그럼에도 그들은 계속 나아가야만 한다  벽 밖에 있는 자유의 상징  바다를 아직 그 눈으로 보지 못했으니까    이윽고 시간은 흘러 첫 번째  초대형 거인 에 의한 최초의 습격으로부터  년  조사병단은 월 마리아 밖의 벽외 조사를 감행한다   벽 너머에는 바다가 있고  바다 너머에는 자유가 있다  그렇게 믿어왔는데        벽 안의 인류가 처음으로 도달한 바다  끝없이 펼쳐진 수평선 너머에 있는 것은 자유인가  아니면       엘런 예거의 이야기는 새로운 국면을 맞이한다 
15,진격의 거인  기 part  ,성인,백 년이라는 긴 시간 동안 인류와 바깥 세계의 사이를 막아온 벽  그 벽 너머에는 본 적 없는 세계가 펼쳐져 있었다  불꽃의 물  물의 대지  사막의 설원 등 책에 써있던 것들은 소년의 탐구심을 자극할 뿐이었다  이윽고 시간이 지나 벽이 거인들에게 파괴된 지금  인류는 세계의 진실을 향해 한발한발 내디딘다  엘렌을 비롯한    기 병사들이 포함된 새로운 체제의 리바이반  본격적으로 움직이기 시작한 그들의 앞을 가장 강한 최악의 적이 가로막는다 
16,은혼  기,성인,외계인들이 습격으로 지구인과 천인 사이에   여년에 걸친 전쟁으로 대다수의 무사와 양이지사      가 천인이 벌인 전쟁에 참가했다  하지만 천인의 막강한 힘에 무릎을 꿇은 막부는 천인의 침략을 인정하고 조약을 체결하게 된다  무사들은 폐도령     으로 칼을 잃고  막부는 천인이 세운 괴뢰정권으로 변했다  이 내용은 실제 일어난 쿠로후네 사건을 모티브로 하고  에도 시대와 현대 문화 및 우주선을 자신의 감각에 맞게 섞어 놓았다  이 무렵 은발의 무사인 사카타 긴토키가 동료들과 함께 기상천외한 생활을 겪는 이야기이다 
17,체인소 맨,성인, 체인소의 악마 포치타와 함께 데블 헌터로 사는 소년 덴지  부모가 남긴 빚을 갚기 위해  가난한 생활을 하던 중  배신을 당해 죽임을 당하고 만다  희미해지는 의식 속에서  덴지는 포치타 와 계약을 맺고  악마의 심장을 가진 자  체인소 맨 으로 되살아 난다  
18,노 게임 노 라이프   판권 부활,성인,인터넷에서는 도시전설이라는 이야기마저 떠도는 천재 게이머 남매  소라   와 시로       가 항상 공란인 관계로 통칭 공백이라고 불리는 이 남매는 세상을 쓰레기 게임이라고 부르며 게임 폐인으로 지내고 있었다  그런데 어느 날 자칭 신이라는 자에게 이끌려 이세계로 소환되는데  그곳은 신에 의해 전쟁이 금지되었으며 모든 것 목숨과 국경선마저도 이 게임으로 결판이 나는 세계였다  다른 종족들에게 연패를 거듭해 마지막 도시 하나만을 남겨둔 일류  소라와 시로 폐인 남매가 이세계에서는 인류의 구세주가 될 수 있을까 
19,안기고 싶은 남자  위에게 협박당하고 있습니다,성인, 년 연속 안기고 싶은 남자  위였던 베테랑 배우 사이죠 타카토와 그 자리를 빼앗은 신인배우 아즈마야 쥰타  연예계를 무대로 펼쳐지는 안기고 싶은 남자  위와  위의 금단의 스캔들의 막이 지금 열린다 
20,약속의 네버랜드  기,성인,자유란  이 얼마나 아름답고도 가혹한 것인지   그레이스 필드 하우스로부터 탈출한   명의 아이들  가짜 낙원을 버리고 자유를 찾는 그들을 기다리고 있는 것은 처음 보는 식물과 동물  그리고 쫓아오는  괴물        아름답고  맞서기엔 너무나도 가혹한 바깥 세계  그러나  아이들은 포기하지 않는다   미네르바 의 메시지  노먼이 남긴 한 자루의 펜에 이끌려 내일을 향해 달린다  하우스에 남겨진  가족 을 데리러 간다는 그 약속을 지키기 위해서 
21,흔해빠진 직업으로 세계최강  기,성인,이세계에서 만난 새로운 동료들과 원래 세계로 돌아갈 방법을 찾아 여행을 하는 나구모 하지메  그런 그의 앞을 막아서는 새로운 적들    하지만 그게 누구든 미궁의 나락에서 정한 하지메의 원칙은 변하지 않는다  적은 모두 죽인다 설령 그것이 신이라도 
22,도쿄 구울,성인,먹이사슬이 정점에 있는 인간  그 중에서도 가장 상위에 위치한 최정점의 존재 인간을 먹이로 삼는 그들의 이름은  구울   인간과 바로 그  구울 이 뒤섞여 사는 세상에서 대학생 카네키는 그 존재를 실감하지 못한 채 평범한 나날을 보내고 있었다  죽을 목숨이었으나 놀랍게도 살아난 카네키  그날부터 그는  반 인간  반 구울  상태의 돌연변이가 되어 인간의 날고기 외에는 식욕을 느끼지 못하고 모두 토해버리는 끔찍한 괴물이 되어버리는데    청년이 괴인과 다시 만났을 때  기구한 운명의 수레바퀴가 돌기 시작한다   이제 인간을 먹지 않고선 살아갈 수가 없다   평범한 대학생에서 구울로 다시 태어난 카네키 켄  인간과 구울이라는 절대 교차할 수 없는 관계  고뇌하는 청년의 숙명이 지금 시작된다   
23,회복술사의 재시작,성인, 치유 의 용사로서 각성해서 다른 용사들과 세계를 구하기 위해 모험을 떠난 소년 케얄  하지만 전투능력이 없는 회복술사에게는 용사들에게 능력을 착취당하고 학대받는 나날이 기다리고 있었다  자유과 존엄을 빼앗기고 자아조차도 잃어가던 케얄은 어느 날  제정신을 되찾고  힐 의 진실을 깨닫는다   힐 은 단순한 치유가 아니다   힐 은 세계를  인간을 근원에서부터 뒤흔들 수 있는 힘이다  라고  케얄은 세계 그 자체에  힐 을 사용해서  년 전으로 모든 것을  재시작 할 것을 결심한다  그리고 용사들에게 복수할 생각에 가슴 설레는데        자  파티 복수 의 시작이다    
24,이세계 미궁에서 하렘을,성인,어느 날  이 세상에 절망하고 있던  카가 미치오 가 발견한 것은 이상한 인터넷 게임  게임에 적혀 있던  이 세상이 살기 힘들다면 이세계에서 살면 된다  라는 말에 이끌려  설정이나 캐릭터 메이크업을 마친 미치오를 기다리고 있던 것은 현실과 다른 진짜 이세계 였다  다양한 스킬  무기  마법 그리고 미궁에 마치 게임 같은 이세계를 무대로  자신의 스테이터스를 자유롭게 재설정할 수 있는 힘을 구사하며 미치오의 모험이 막을 연다 
25,고블린 슬레이어,성인,난 세상을 구하지 않는다  고블린을 죽일 뿐이다  변경의 한 길드에는 고블린 토벌만으로도 은 등급 모험가 등급  위 까지 오른 엄청난 존재가 있다  모험자가 되어 처음으로 파티에 참여해 고블린 퇴치에 나섰다가 위기에 처한 여신관  그리고 그것을 구한 자가 바로 고블린 슬레이어라 불리는 남자였다  그 남자는 고블린 슬레이어라는 이름만큼 수단을 가리지 않고 계속해서 고블린만을 퇴치했다  그 고블린 슬레이어에게 휘둘리는 여신관  감사해하는 접수원  그를 기다리는 소꿉친구인 소치기 소녀  그리고 고블린 슬레이어의 소문을 들은 한 엘프가 어느 의뢰를 하기 위해 나타났다 
26,은혼  기 DASH편,성인,에도 시대 말기  하늘에서 내려온  천인 의 침략으로 전쟁이 발생한다  막부들은 결국 천인과의 공존을 위해 사람들에게 검을 소지할 수 없도록 폐도령을 내려서 사무라이가 큰 위기를 겪고 있다  그러나 사무라이 정신을 굳게 간직한 남자가 있었으니 그의 이름은 사카타 긴토키  단 것을 좋아하는 저돌적인 이 남자가 부패한 에도를 두동강을 낼지도   긴토키가 동료들을 만나면서 일어나는 병맛 코미디물 
27,낙제기사의 영웅담,성인,혼을 마검으로 바꾸어 싸우는 현대 마법사  마도기사   그곳에 다니는 쿠로가네 잇키는 마법의 재능이 없는 열등생  워스트원 낙제 기사  이다  그런데 어느 날  이국의 황녀이자  넘버원  랭크 기사  인 스텔라가 일방적으로  진 사람은 평생 복종 이라는 조건 아래 결투를 밀어붙이는데  이겨버리고 만다  잇키는 마법 대신 검기가 매우 뛰어난 이단의 실력자였던 것이다  그렇게 과거의  낙제 기사 는  어나더원 무관의 검왕  으로서 모든 기사로부터 주목받기 시작하는데  
28,아카메가 벤다 ,성인,인간이 서서히 썩어가듯 나라도 멸망한다 천 년을 번창한 도성조차도 지금은 부패한 생지옥  그곳에 가득한 것은 사람의 탈을 쓰고 잘난 척 날뛰는 온갖 요괴들  하늘이 벌하지 못하는 그 악을 어둠 속에서 처벌하는 살인청부업자  나이트레이드의 활약이 지금 펼쳐진다 
29,이세계 마왕과 소환 소녀의 노예 마술,성인,게임 마왕하고 있었더니  이 세계에 소환되었다         크로스레버리에서 사카모토 타쿠마는 다른 플레이어에게  마왕 이라고 불릴 정도로 압도적인 힘을 자랑하던 어느 날  그는 게임 내의 모습으로 이세계에 소환돼 버린다  거기에는  내가 바로 소환주 라 우기는 소녀 두 명이 있었다  타쿠마는 그녀들로부터 소환수의 노예화 마법을 받게 되는데   그러나 고유 능력  마법 반사  발동  노예화된 것은 소녀들이었다  당황하는 타쿠마  그는 최강의 마술사였지만  커뮤니케이션 능력이 전무했다  고민 끝에 던진 한마디는 게임에서 사용하던 마왕 역할 연기    내가 대단하다고  당연하지  나는 디아블로  마왕으로써 공포의 대상이다   마침내 세계를 뒤흔드는 마왕 연기 이 절대적인 힘으로 돌진하는 이세계 모험담 개막 
30,진격  거인중학교,성인, 진격의 거인  스핀오브 작품  칼 대신 연필을 쥔다  거인은 사람대신 도시락을 먹는다  거인에게 습격당해서 벽 안에 갇혀 새장 같은 생활을 하던 인류    는 꿈이었다  아침부터 지각 위기에 처한 엘런을 미카사가 깨워 둘은 함께 학교를 향해 달린다  가는 길에 사샤  장  코니 등을 만나고 이들은 거대 벽처럼 생긴 학교에 도착한다  이곳은 거인과 함께 다니는 학교였다  거인에게 도시락을 뺏긴 슬픈 경험이 있는 엘런  오늘은 도시락을 지킬 수 있을 것인가 
31,도쿄 구울  A,성인,인간의 시체를 먹는 괴인  구울 이 도사리고 있는 거리 도쿄  대학생 카네키는 한 사고로 인해 구울의 내장을 이식받아 반구울이 된다  인간을 먹어야 살지만  인간을 먹고 싶지는 않다  인간과 구울 사이에서 발버둥 치며  괴로워하는 카네키  어느 세계에도 속해있을 수 없는 그를 받아준 것은 구울  요시무라 가 경영하는 카페  안테이크 였다  그리고 카네키는 스스로 구울과 인간  두 세계에 거처를 가진 유일한 존재임을 알게 된다 
32,스트라이크 더 블러드,성인,전설상에만 존재하는 최강의 흡혈귀  제 진조  누구의 지배도 받지 않으며  세계의 법칙에서 벗어나 있다는 그 흡혈귀는   권속을 거느린며 재앙을 일으킨다고 한다  그런데 어느 날  사자왕 기관은 그 환상의 흡혈귀가 일본에 출현했다는 보고를 받게 되고  검무라는 공마사를 파견하기로 한다  제 진조의 감시자가 된 검무  히메라기 유키나는 진조에 대항할 최강의 영창을 가지고 마족특구  이토가미 섬 을 찾아가는데    그곳에서 그녀가 만난 제 진조  아카츠키 코죠의 정체는    
33,기생수 세이의 격률,성인,어느날 지구에 떨어진 정체불명의 기생 생물들  이 생물은 인간의 뇌에 침입해 머리에 기생하고 육체를 차지  다른 인간을 포식하는 생태를 가지고 있다  이들은 뛰어난 의태 능력과 학습 능력으로 점차 인간 사회를 위협하는데  지극히 평범한 고등학생인 이즈미 신이치는 이 생물이 뇌를 차지하지 못하고 오른팔에만 불완전하게 기생  동화되는 바람에 자칭  오른쪽이 와의 기묘한 공존 인생을 시작하게 된다 
34,독점 마이 히어로,성인,겁 많은 불량 청소년인데다 집에서 자신이 있을 곳이 없는 세타가와 마사히로  교사이자 불량 청소년 지도에 힘쓰는 오오시바 코스케  입장도  나이 차도 큰 그 둘  마사히로가 동경하는 용감함과 유능함  마음가짐을 가진 코스케  독점하고 싶은 그 사람과 우연히 만나고 말았다  한편  코스케의 동생인 켄스케와 같은 반이 된 하세쿠라 아사야  절교했었던 소꿉친구와 화해하기까지의 초조한 거리  마음의 온도가 흔들리면서 결속되어가는 남자아이들  그 네 명의 싱그러운 이야기  한 낮의 어린 잎과 반짝이는 밤 하늘의 별 사이를 달려나간다 
35,시맨틱 에러 스페셜,성인,  시맨틱 에러 스페셜 숏 애니메이션   월 라프텔 독점 오픈    화제의 리디    웹소설이 애니로   시맨틱 에러  원작의 달달 모먼트들 및 저수리 작가님의 미공개 외전 에피소드가  분  화 분량의 애니로 올라올 예정입니다  오직 라프텔에서 움직이는 재영 상우를 만나보세요  원칙주의자이자 규칙 준수의 화신  컴공과 추상우  성격 유형 하나 겹치지 않을 이공계 인간과 예술계 인간의 만남은 우연인지 필연인지 끈질기게 이어지고  어쩌다 보니 물과 기름처럼 섞이지 않을 그들이 모바일 게임을 함께 제작하고 있다   상우의 완벽한 세계를 뒤흔들어 놓은 새빨간 시맨틱 에러  장재영  과연 이 에러를 디버깅할 수 있을까 
36, 무삭제  이종족 리뷰어스,성인,이곳은 인간 뿐만 아니라 엘프  수인  악마  천사와 온갖 이종족이 혼재하며 살고 있는 세계  그곳에는 당연히 온갖 이종족의 음란한 가게도 있고    빈번하게 므흣한 서비스를 해주는 가게에 다니는 인간의 모험자  스턴크 는 어느 날 종족간 감성의 차이로 나쁜 친구인 에로 엘프  젤 과 충돌한다  결판을 내는 방법은     아가씨의 리뷰   모든 이종족의 서비스를 크로스 리뷰 방식으로 평가하고  다른 동료들에게  역할  정보로서 제공해 나가는  스턴크 의 활약은 그야말로 성전사와 같다  오늘도 리뷰어스들은 새로운 쾌락을 찾아 떠나는데    
37,기븐,성인,어느 날  우에노야마 리츠카는 부서진 기타를 안고 있는 사토 마후유와 만난다  기타를 고쳐주자 마후유는 리츠카를 따르게 된다  어쩔 수 없이 기타를 가르치게 된 리츠카였지만  우연히 들은 마후유의 노래가 마음을 파고들었다  리츠카는 마후유를 자신의 밴드로 부르고 둘의 관계가 변하기 시작한다  그러나 감정을 표현하는 일이 서툰 마후유는 과거에 사로잡혀 있는 것 같은데 
