,titles,category,summary
93,리코리스 리코일,액션,평온한 일상   그 이면에는 비밀이 있다  범죄를 미연에 방지하는 비밀 조직                        그곳의 에이전트인 소녀들   리코리스   당연한 일상도  그녀들 덕분이다  역대 최강의 리코리스라고 불리는 엘리트 니시키기 치사토  우수하지만 사연이 있는 리코리스 이노우에 타키나가 근무하는 카페  리코리코 도 지부 중 하나다  이곳에서 받는 주문은 커피와 디저트 주문부터 아이 돌보기  구매 대행  외국인을 위한 일본어 강사 등  리코리스 답지 않은 일 투성이다  자유로운 낙천가이자 평화주의자인 치사토와 쿨하고 효율을 중시하는 타키나  좌충우돌 콤비의 엉망진창인 일상이 시작된다 
94,달링 인 더 프랑키스,액션,그들은 꿈꾼다  언젠가 넓은 하늘을 나는 꿈을  유리로 가려진 하늘이 사실 굉장히 높은 것임을 알면서도  머나먼 미래  인류는 황폐해진 대지에 이동 요새 도시인  플랜테이션 을 건설했다  그리고 도시 안에 만들어진 파일럿 거주지역  미스틸테인   통칭  새장   아이들은 바깥 세상은 전혀 모른 채  자유로운 하늘을 모른 채 그곳에 살고 있다  그들이 맡은 일은 그저 싸우는 것뿐  그들이 싸우는  적 은 모든 것이 비밀에 쌓여있는 거대생명체  규룡   본 적도 없는 적에게 맞서기 위해 아이들은  프랑크스 라 불리는 로봇에 탄다  로봇을 타는 것만이 자신들의 존재를 증명하는 것이라 믿고서  예전에 신동이라 불리던 소년이 있었다  코드 넘버는      이름은 히로  하지만 프랑크스에 타지 않는다면 존재하지 않는다는 것과 같은 의미였기에 지금은 그저 낙오자였으며 그 누구에게도 필요로 하지 않는 존재였다  그런 히로에게 머리에 뿔이 달린 의문의 소녀 제로 투가 나타났다   찾았다  나의 달링  
95,Re   제로부터 시작하는 이세계 생활  기 part  ,액션,내가 반드시 너를 구해 보이겠어  마녀교 대죄사교  나태  담당 페텔기우스 로마네콩티를 물리치고 에밀리아와 재회한 나츠키 스바루  괴로운 결별을 극복하고 드디어 만난 두 사람이었지만 그것은 새로운 파란의 시작이었다  상상을 뛰어넘는 절체절명의 위기 그리고 덮쳐오는 무자비한 현실  소년은 다시 가혹한 운명에 맞선다    
96,나루토 질풍전  기,액션, 년이라는 시간동안 힘을 손에 넣은 사스케가 드디어 움직이기 시작했다  다년간의 비원을 완수하기 위해 순조롭게 타도 이타치를 준비하는 사스케  충격적인 소식을 듣는 나루토는 사스케를 저지하기 위해  앞서서 이타치의 신병을 구속하기 위해 동료들과 행동을 개시한다  한편  힘을 길러가는 아카츠키 세력을 염려하는 지라이야는  정보망을 통해 리더의 소재를 밝혀낸다  마을의 미래를 지키기 위해 잡입을 시도하는 지라이야를 기다리고 있는 것은 
97,혈계전선,액션,한때 뉴욕이라 불리던 거리는  년 전에 출현한 게이트 때문에 단 하룻밤 만에 소실됐다  지금은 상상의 산물로 여겨지던 이계의 생물들과 현세가 뒤섞여 다양한 의도를 가진 자들이 함부로 설치는 거리  헤르살렘즈 롯 이 구축되었다  그런 세계의 균형을 유지하려 비밀리에 움직이는 조직이 있었으니 그 조직의 이름은  비밀 결사 라이브라    소년  레오나르도 는 우연한 계기로 라이브라에 입단하게 되는데    과연 그를 기다리고 있는 운명은 
98,나이츠 앤 매직,액션,천재 프로그래머이자 프라모델 오타쿠인 쿠라타는 어느 날 사고로 죽고만다  그리고 그의 영혼은 이세계의  에르네스티 로 환생하게 되는데  전생의 기억을 가진 다시 태어난 세계에서 거대 인간형 병기 실루엣 나이트를 본 에르  그는 실루엣 나이트를 조종하는 나이트러너가 되기로 결심하는데 
99,나루토 질풍전  기,액션,건강을 되찾은 카카시와 함께 나루토는 차크라 성질변화를 위한 수행을 시작하고  나루토만의 고유 술법을 만들기 위해 열심히 수행에 임하지만 쉽지만은 않다  한편 츠나데는 국경 주변의 사건이 아카츠키의 소행인지 알아보기 위해 아스마와   조를 보내고  나루토에게는  등급 임무인 무덤 도굴꾼 조사를 맡긴다  임무 중 불의 절에 가게 된 나루토 일행은 네 군데의 숨겨진 무덤에 묻힌 사람들의 이야기를 듣게 되는데  
100,나루토 질풍전  기,액션,불의 나라의 나뭇잎 마을의 수장인 호카게를 목표로 열심히 수련하는 소년 닌자 우즈마키 나루토를 중심으로 그려진 닌자액션 애니메이션  쉴 틈없이 달려온 나루토 질풍전의 최종결전이 드디어 시작된다 
101,용사  그만둡니다,액션,마왕군의 침공으로부터 세계를 구한 용사 레오  하지만 그 강함은 평화로운 세계를 맞이한 사람들에게 엄청난 위협이 되었고  끝내 성도로부터 추방당하고 말았다  지위도 명예도 있을 곳도 잃은 채 방황하던 용사가 다다른 곳에 있는 건    너덜너덜한 마왕군   인간에 대한 원한 때문인지  자포자기한 건지는 알 수 없으나  마왕 앞에서 정체를 숨기고 사천왕과 함께 마왕군 재건에 임하는 레오  은퇴 용사의 대업  그 앞에 펼쳐질 미래는 과연    
102,나루토 질풍전  기,액션,나루토를 노리는 가면의 남자와 카부토  그리고 나루토를 보호하기 위한 닌자연합은 결국  차 닌자대전을 일으키게 된다  전장은 세 곳  하나는 나루토와 가면의 남자가 대결하는 전장  가면의 남자가 조종하는 인주력들에게 고전하는 나루토는  구미에게 인정받고 미수화하는데 성공한다  두 번째  우치하 마다라와 츠나데  오오노키  다섯 카게가 격투를 펼치는 전장  마다라의 압도적인 공격에 고전하지만 다섯 카게들은 결코 포기하지 않고 힘을 모아 맞선다  그리고 마지막 전장에서  예토전생의 술자이자 카부토의 행방을 알아냈던  이타치와 사스케가 카부토와 대치한다  이타치는 예토전생을 억제하기 위해  사스케는 진실을 알기 위해  이윽고 전쟁의 운명을 결정할 전투가 벌어진다 
103,은혼  기 DASH편,액션,에도 시대 말기  하늘에서 내려온  천인 의 침략으로 전쟁이 발생한다  막부들은 결국 천인과의 공존을 위해 사람들에게 검을 소지할 수 없도록 폐도령을 내려서 사무라이가 큰 위기를 겪고 있다  그러나 사무라이 정신을 굳게 간직한 남자가 있었으니 그의 이름은 사카타 긴토키  단 것을 좋아하는 저돌적인 이 남자가 부패한 에도를 두동강을 낼지도   긴토키가 동료들을 만나면서 일어나는 병맛 코미디물 
104,어떤 과학의 초전자포 T,액션, 대패성제   일주일에 걸쳐서 개최되며 능력자들이 학교 대항전 형식으로 격전을 벌이는 거대한 운동회  대회 기간 중에는 학원도시의 일부가 민간인들에게도 개방되어 전 세계로 그 모습이 중계되는 큰 이벤트를 앞두고 모두가 들떠 있었다  그 화려한 무대 뒤편에서 꿈틀거리는 것에 대해서는 전혀 눈치채지 못한 채   
105,모브사이코      기,액션,평범한 삶을 꿈꾸며 청춘을 동경하는 중  소년 카게야마 시게오  통칭 모브는 스트레스 지수가    이 되면 초능력이 극대화되어 잠재되어 있던 힘이 폭발하고 만다  모브는 엄청난 초능력을 보유한 소년이었던 것이다  하지만 자기표현이 극도로 서투른 모브는 스스로 초능력을 억누르며 살아간다  스승이자 사기 영능력자인 레이겐은 모브의 초능력을 이용하여 제령을 하고 어른으로서 조언   도 아끼지 않는다  그러나 모브의 힘을 이용하려는 사람들  모브를 둘러싼 웃음과 눈물  놀라움  싸움의 나날이 펼쳐진다  
106,Fate Zero,액션,                 의 사건이 일어나기   년 전  과연 후유키 시에서는 무슨 일이 있었던 것일까  제  차 성배전쟁 개막  성배전쟁   그것은 모든 소망을 이룰 수 있는  성배 를 손에 넣으려는 일곱 마술사가 소환한 서번트를 이용하여 목숨을 걸고 싸우는 궁극의 배틀 로열   마술사 킬러 라는 별명을 가진 에미야 키리츠구는 자신의 숙원을 위해 소환한 영령  세이버 와 함께 모든 것을 걸고 성배를 둘러싼 싸움에 몸을 던지는데                    의 희망과 이어지는  거대한 운명의 이야기가 막을 연다 
107, 더빙  헌터X헌터 리메이크 part  ,액션, 유유백서 로 유명한 작가 토가시 요시히로의 작품  곤은 아버지 진이 유명한 헌터였다는 말을 듣고 아버지의 흔적을 찾기 위해 헌터가 되기로 결심한다  이후 곤은 헌터 시험장에서 만난 암살족의 키르아  붉은 눈의 크라피카  그리고 레오리오와 함께 힘든 시험에 도전하여 어렵게 관문을 넘게 된다  헌터카드를 가지고 집으로 돌아온 곤은 아버지가 남긴 물건을 통해 그리드 아일랜드라는 게임이 아버지와 연관있다는 것을 알게 된다  그리드 아일랜드는 사람이 직접 게임 속으로 들어가 싸우는 것으로 아버지가 만든 넨능력자 전용 게임이다  여러가지 고비 끝에 결국 그리드 아일랜드 속에 들어간 곤과 키르아  게임 속에서 온갖 경험을 한 결과 능력이 더욱 상승한 두 사람  크라피카의 복수의 대상인  붉은 여단 과의 대결이 숨가쁘게 전개되고  이제 돌연변이 곤충들의 왕국과 인류와의 전쟁이 시작된다  과연 곤의 모험은 어디까지 이어질지      숨가쁘게 전개되는 인기 소년애니 
108,예를 들어 라스트 던전 앞 마을의 소년이 초반 마을에서 사는 듯한 이야기,액션,도시에서 멀리 멀리 떨어진 마을에 사는 소년 로이드  군인의 꿈을 품은 그는 사실  마을에서 가장 약한 남자   그런 그가 군인이 되는 것에 대해 주위 마을 사람들은 대 반대  그러나 로이드의 결의는 굳건해 왕도로 여행을 떠나게 된다  하지만  그를 포함해 마을 사람들은 어떤 중대한 사실을 모르고 있었는데    자신들이 일찍이 세계 를 구한 영웅의 후예이며  모두가 인간으로부터 멀어진 힘을 가지고 있다는 것  그리고  마을에서 가장 약한  로이드도 일반적으로는 상식 밖으로 강하다는 것을   
109,갓슈벨  ,액션,머리가 너무 좋아서 반에서 겉도는 존재였던 중학생 타카미네 키요마로  그런 키요마로에게 빨간책과 함께 신기한 아이 갓슈벨이 찾아온다  키요마로가 그 빨간책을 들고 주문을 외치면 다양한 술법을 쓰게 되는 갓슈는 천 년에 한 번 행해지는 마계의 왕을 결정하는 싸움에 출전하게 된    명의 마물 아이 중 한 명이었다  키요마로와 갓슈는 마계의 왕이 되기 위해 마물 아이들과 싸워야만 하는 기구한 운명에 갈등하면서도 서로의 가능성을 깨닫고  어느 샌가 둘 사이엔 두터운 우정이 싹튼다  울보인 갓슈의 순수한 마음을 접하고  지금까지 완고하게 닫고 살았던 자신의 마음을 서서히 열어 나가는 키요마로  생존을 걸고 차례로 나타나는 경쟁자들과의 싸움을 통해 갓슈와 키요마로의 유대감은 더욱 깊어져 간다 
